category,subcategory,name,current_price,raw_price,discount,likes_count
jewelry,Montres connectées,Global Version Xiaomi Mi bande 5,42.99,99.99,57,27
jewelry,Colliers,Collier long pendentif géométrique,17.61,33.55,48,518
jewelry,Montres connectées,Montre intelligente ECG EKG,66.29,166.14,60,505
jewelry,Colliers,Collier à pampilles blanc,9.99,24.99,60,140
jewelry,Boucles d'oreilles,Clips d'oreilles en verre gemme,5.99,10.99,46,107
jewelry,Boucles d'oreilles,Boucles d'oreilles pendentif pierre de lune,6.99,14,50,222
jewelry,Bracelets,Bracelet multicouche turquoise,9.99,19.99,50,63
jewelry,Colliers,Collier écharpe triangle en résine,13.99,29.99,53,51
jewelry,Montres connectées,L7 Montres intelligentes à écran bord à bord,118.77,213.41,44,94
jewelry,Colliers,Collier Pendentif Feuille de Bois,15.31,25.99,41,1055
jewelry,Montres connectées,HD Montre intelligente à écran,329.99,699.99,53,30
jewelry,Boucles d'oreilles,Boucles d'oreilles triangle en pierre du Labrador,9.44,18.94,50,153
jewelry,Bagues,Bague topaze carrée Highland,9.99,0,0,92
jewelry,Colliers,Collier de pierres précieuses arbre de vie,8.99,16.99,47,54
jewelry,Montres connectées,Bande d'origine Xiaomi Mi 5,49.99,102.99,52,19
jewelry,Colliers,Collier boule de verre transparent,7.99,23.99,67,237
jewelry,Colliers,Collier long de perles de Bouddha fait à la main,9.99,21.99,55,76
jewelry,Boucles d'oreilles,Boucles d'oreilles fleur stéréoscopique ,17.81,29.8,40,127
jewelry,Montres pour homme,Montre Homme à Cadran Triangle,34.49,91.98,63,20
jewelry,Bagues,Anneau de minerai de cristal naturel irrégulier,9.99,19.99,50,39
jewelry,Colliers,Collier pompon papillon,9.99,32.99,70,54
jewelry,Boucles d'oreilles,Ensemble de boucles d'oreilles pompon Dreamcatcher ,6.81,15.39,56,188
jewelry,Colliers,Ensemble de collier turquoise,9.99,32.99,70,89
jewelry,Colliers,Collier multicouche chaîne en métal,9.99,32.99,70,41
jewelry,Montres connectées,Montre intelligente d'activité Fitness Tracker,166.96,318.02,48,387
jewelry,Boucles d'oreilles,Boucles d'oreilles irrégulières en pierre naturelle,6.99,19.99,65,29
jewelry,Colliers,Collier poisson stéréoscopique,10.99,22.99,52,59
jewelry,Montres connectées,Moniteur d'activité Affichage des messages Montre intelligente,48.08,91.58,48,314
jewelry,Colliers,Collier long de perles de bois de Bouddha,11.99,22.99,48,25
jewelry,Boucles d'oreilles,Colorful Boucles d'oreilles à motif d'oiseaux,9.49,18.49,49,105
jewelry,Bracelets,Bracelet tressé libellule bleue,6.99,15.98,56,38
jewelry,Boucles d'oreilles,Boucles d'oreilles asymétriques turquoise,10.99,21.99,50,60
jewelry,Bracelets,Bracelet multicouche tournesol,6.99,13.98,50,34
jewelry,Montres connectées,Blood Pressure Smart Bande,32.76,56.99,43,37
jewelry,Bracelets,Bracelet marguerite ethnique ,6.81,15.39,56,108
jewelry,Boucles d'oreilles,Boucles d'oreilles en verre métal Colorful,7.99,14.99,47,75
jewelry,Bracelets,Bracelet double marguerite,19.99,39.99,50,113
jewelry,Colliers,Collier multicouche en mousseline de soie à pompons de perles,15.99,30.99,48,27
jewelry,Colliers,Sautoir Perles en Bois,14.99,28.99,48,14
jewelry,Accessoires des cheveux,Bandeau de broderie bohème,8.99,14.99,40,67
jewelry,Montres pour homme,Petites montres pour hommes à trois aiguilles,12.99,25.98,50,13
jewelry,Boucles d'oreilles,Boucles d'oreilles Fleurs Datura ,5.99,10.99,46,66
jewelry,Colliers,Collier hibou carré en verre,10.99,21.99,50,26
jewelry,Boucles d'oreilles,Ensemble de boucles d'oreilles ailes géométriques ,11.54,20.77,44,67
jewelry,Colliers,Collier pompon perlé à la main papillon,12.99,24.99,48,13
jewelry,Montres pour homme,Montre Sports Luminous Hommes,55.99,111.98,50,11
jewelry,Montres pour homme,Montre numérique à la mode,13.32,25.38,48,342
jewelry,Boucles d'oreilles,Ensemble de boucles d'oreilles pompon Dreamcatcher,7.99,15.81,50,130
jewelry,Boucles d'oreilles,Boucles d'oreilles papillon asymétrique strass,8.99,16.99,47,78
jewelry,Colliers,Collier pompon en perles de céramique irrégulières,14.99,0,0,59
jewelry,Bracelets pour homme,Bracelet tressé multicouche réglable,11.99,23.98,50,21
jewelry,Colliers,Collier de perles fait main de couleur mélangée,9.99,29.99,67,26
jewelry,Montres pour homme,Montre intelligente à écran tactile multifonction,37.49,99.99,63,7
jewelry,Colliers,Collier de perles en bois,9.99,24.99,60,33
jewelry,Boucles d'oreilles,Boucles d'oreilles tournesol en métal sculpté,10.99,21.99,50,28
jewelry,Bracelets,Bracelet multicouche en perles de cristal,13.99,0,0,33
jewelry,Bagues pour homme,Bague en forme de balle de roulette,10.99,21.98,50,13
jewelry,Colliers,Collier pompon dégradé bohème,19.99,42.99,54,26
jewelry,Boucles d'oreilles,Crochet d'oreille papillon zircon,13.99,0,0,50
jewelry,Montres connectées,Global Version Xiaomi Mi bande 5,42.99,99.99,57,27
jewelry,Colliers,Collier long pendentif géométrique,17.61,33.55,48,518
jewelry,Montres connectées,Montre intelligente ECG EKG,66.29,166.14,60,505
jewelry,Colliers,Collier à pampilles blanc,9.99,24.99,60,140
jewelry,Boucles d'oreilles,Clips d'oreilles en verre gemme,5.99,10.99,46,107
jewelry,Boucles d'oreilles,Boucles d'oreilles pendentif pierre de lune,6.99,14,50,222
jewelry,Bracelets,Bracelet multicouche turquoise,9.99,19.99,50,63
jewelry,Colliers,Collier écharpe triangle en résine,13.99,29.99,53,51
jewelry,Montres connectées,L7 Montres intelligentes à écran bord à bord,118.77,213.41,44,94
jewelry,Colliers,Collier Pendentif Feuille de Bois,15.31,25.99,41,1055
jewelry,Montres connectées,HD Montre intelligente à écran,329.99,699.99,53,30
jewelry,Boucles d'oreilles,Boucles d'oreilles triangle en pierre du Labrador,9.44,18.94,50,153
jewelry,Bagues,Bague topaze carrée Highland,9.99,0,0,92
jewelry,Colliers,Collier de pierres précieuses arbre de vie,8.99,16.99,47,54
jewelry,Montres connectées,Bande d'origine Xiaomi Mi 5,49.99,102.99,52,19
jewelry,Colliers,Collier boule de verre transparent,7.99,23.99,67,237
jewelry,Colliers,Collier long de perles de Bouddha fait à la main,9.99,21.99,55,76
jewelry,Boucles d'oreilles,Boucles d'oreilles fleur stéréoscopique ,17.81,29.8,40,127
jewelry,Montres pour homme,Montre Homme à Cadran Triangle,34.49,91.98,63,20
jewelry,Bagues,Anneau de minerai de cristal naturel irrégulier,9.99,19.99,50,39
jewelry,Colliers,Collier pompon papillon,9.99,32.99,70,54
jewelry,Boucles d'oreilles,Ensemble de boucles d'oreilles pompon Dreamcatcher ,6.81,15.39,56,188
jewelry,Colliers,Ensemble de collier turquoise,9.99,32.99,70,89
jewelry,Colliers,Collier multicouche chaîne en métal,9.99,32.99,70,41
jewelry,Montres connectées,Montre intelligente d'activité Fitness Tracker,166.96,318.02,48,387
jewelry,Boucles d'oreilles,Boucles d'oreilles irrégulières en pierre naturelle,6.99,19.99,65,29
jewelry,Colliers,Collier poisson stéréoscopique,10.99,22.99,52,59
jewelry,Montres connectées,Moniteur d'activité Affichage des messages Montre intelligente,48.08,91.58,48,314
jewelry,Colliers,Collier long de perles de bois de Bouddha,11.99,22.99,48,25
jewelry,Boucles d'oreilles,Colorful Boucles d'oreilles à motif d'oiseaux,9.49,18.49,49,105
jewelry,Bracelets,Bracelet tressé libellule bleue,6.99,15.98,56,38
jewelry,Boucles d'oreilles,Boucles d'oreilles asymétriques turquoise,10.99,21.99,50,60
jewelry,Bracelets,Bracelet multicouche tournesol,6.99,13.98,50,34
jewelry,Montres connectées,Blood Pressure Smart Bande,32.76,56.99,43,37
jewelry,Bracelets,Bracelet marguerite ethnique ,6.81,15.39,56,108
jewelry,Boucles d'oreilles,Boucles d'oreilles en verre métal Colorful,7.99,14.99,47,75
jewelry,Bracelets,Bracelet double marguerite,19.99,39.99,50,113
jewelry,Colliers,Collier multicouche en mousseline de soie à pompons de perles,15.99,30.99,48,27
jewelry,Colliers,Sautoir Perles en Bois,14.99,28.99,48,14
jewelry,Accessoires des cheveux,Bandeau de broderie bohème,8.99,14.99,40,67
jewelry,Montres pour homme,Petites montres pour hommes à trois aiguilles,12.99,25.98,50,13
jewelry,Boucles d'oreilles,Boucles d'oreilles Fleurs Datura ,5.99,10.99,46,66
jewelry,Colliers,Collier hibou carré en verre,10.99,21.99,50,26
jewelry,Boucles d'oreilles,Ensemble de boucles d'oreilles ailes géométriques ,11.54,20.77,44,67
jewelry,Colliers,Collier pompon perlé à la main papillon,12.99,24.99,48,13
jewelry,Montres pour homme,Montre Sports Luminous Hommes,55.99,111.98,50,11
jewelry,Montres pour homme,Montre numérique à la mode,13.32,25.38,48,342
jewelry,Boucles d'oreilles,Ensemble de boucles d'oreilles pompon Dreamcatcher,7.99,15.81,50,130
jewelry,Boucles d'oreilles,Boucles d'oreilles papillon asymétrique strass,8.99,16.99,47,78
jewelry,Colliers,Collier pompon en perles de céramique irrégulières,14.99,0,0,59
jewelry,Bracelets pour homme,Bracelet tressé multicouche réglable,11.99,23.98,50,21
jewelry,Colliers,Collier de perles fait main de couleur mélangée,9.99,29.99,67,26
jewelry,Montres pour homme,Montre intelligente à écran tactile multifonction,37.49,99.99,63,7
jewelry,Colliers,Collier de perles en bois,9.99,24.99,60,33
jewelry,Boucles d'oreilles,Boucles d'oreilles tournesol en métal sculpté,10.99,21.99,50,28
jewelry,Bracelets,Bracelet multicouche en perles de cristal,13.99,0,0,33
jewelry,Bagues pour homme,Bague en forme de balle de roulette,10.99,21.98,50,13
jewelry,Colliers,Collier pompon dégradé bohème,19.99,42.99,54,26
jewelry,Boucles d'oreilles,Crochet d'oreille papillon zircon,13.99,0,0,50
jewelry,Accessoires des cheveux,Barrette à cheveux sexy en métal à queue-de-cheval,9.59,19.87,52,723
jewelry,Bracelets pour homme,Bracelet Ethnic Dragon Men,17.61,33.54,48,111
jewelry,Bagues pour homme,Anneaux de chaîne rotatifs en acier au titane ,8.52,17.87,52,160
jewelry,Montres pour homme,POLOBOSS Montre mécanique à dragon décoratif,68.43,162.14,58,652
jewelry,Boucles d'oreilles,Boucles d'oreilles géométriques Swan turquoise ,8.39,16.86,50,35
jewelry,Colliers,Collier long pendentif multi-couches bohème,7.5,16.69,55,280
jewelry,Bracelets,Bracelet bohémien de perles turquoise,11.73,20.68,43,588
jewelry,Montres pour homme,OULM Montre avec quartz pour homme,33.65,61.64,45,930
jewelry,Montres pour homme,Montre punk à bracelet multicouche en cuir,19.75,36.88,46,586
jewelry,Colliers,Collier ethnique en bois d'ébène,13.32,25.39,48,272
jewelry,Bracelets pour homme,Bracelet de prière bouddhiste tibétain,9.59,19.47,51,951
jewelry,Bracelets,Bracelet Perles en Céramique Poissons Métalliques,12.99,0,0,23
jewelry,Montres pour femme,Montre bracelet vintage avec pendentif,7.84,16.34,52,174
jewelry,Colliers,Colliers en perles d'améthyste ethnique en agate,34.72,63.6,45,290
jewelry,Bagues pour homme,Bague Arabian Big pour hommes,10.66,19.9,46,340
jewelry,Montres connectées,Montre-bracelet de style décontracté femmes,25.08,54.29,54,46
jewelry,Montres pour homme,Montre unisexe à bracelet multicouche en cuir,19.75,36.88,46,394
jewelry,Colliers pour homme,Collier de chaîne de déclaration des hommes,14.88,29.18,49,175
jewelry,Montres pour femme,Montre multicouche bohémienne à bracelet en cuir cristal,18.68,34.88,46,423
jewelry,Montres pour homme,Montre de sport style hommes lumineux quart,16.54,30.88,46,166
jewelry,Bracelets pour homme,Bracelet pendentif en acier inoxydable,11.73,24.84,53,31
jewelry,Boucles d'oreilles,Oiseau sur l'arbre Dangle boucles d'oreilles,11.73,20.99,44,373
jewelry,Colliers,Collier multi-couches Peace Pigeon,7.5,16.69,55,242
jewelry,Boucles d'oreilles,Boucles d'oreilles asymétriques en papier essuie-tout,10.99,0,0,29
jewelry,Colliers,Collier de Pull Ethnique en Céramique,9.59,19.64,51,685
jewelry,Bracelets,Bracelet de pierre concassée de Bohême ,10.55,20.1,48,472
jewelry,Boucles d'oreilles,Punk Boucles d'oreilles clip magnétique,9.59,20.25,53,712
jewelry,Colliers,Collier pompon perles en bois,13.99,26.99,48,38
jewelry,Bracelets,Bracelet multicouche en perles roses,10.99,0,0,46
jewelry,Bracelets,Bracelet multicouche en métal Star Moon,3.5,12.99,73,17
jewelry,Bagues pour homme,Bague Eagle stéréoscopique ,17.61,35.95,51,88
jewelry,Boucles d'oreilles,Ensemble de clous d'oreilles émeraude,9.59,19.2,50,98
jewelry,Colliers,Pendentif coquille multi-couche collier,9.59,20.67,54,148
jewelry,Sets de bijoux,Ensemble de bijoux en forme de pierre gemme de cristal coloré,22.66,42.76,47,385
jewelry,Bagues pour homme,Bagues Vintage,13.32,25.38,48,239
jewelry,Montres pour femme,Montre Bohème À Cadran Fleuri Avec Bracelet En Cuir PU,14.4,27.42,48,1256
jewelry,Montres connectées,Montre intelligente IP68,26.99,59.99,55,3
jewelry,Colliers,Collier Éblouissant Clé en Cuir Vintage,14.4,26.88,46,891
jewelry,Colliers,Collier pendentif vintage,10.66,18.91,44,278
jewelry,Colliers,Perles Ethniques en Céramique Feuille Longs Colliers,14.4,26.36,45,329
jewelry,Boucles d'oreilles,Boucles d'oreilles pendentif fleur du soleil ,9.59,25.11,62,161
jewelry,Boucles d'oreilles,Boucles d'oreilles en cristal de Boekont,9.59,20.66,54,741
jewelry,Colliers,Colliers à breloques en perles ethniques en bois,18.68,34.22,45,1047
jewelry,Boucles d'oreilles,Boucles d'oreilles fleur Zircon doux ,16.54,30.88,46,157
jewelry,Colliers pour homme,Collier vintage à pendentif pour homme,15.04,28.64,48,193
jewelry,Bracelets,Bracelet en perles de pierre naturelle,10.66,19.69,46,711
jewelry,Bracelets,Bracelets Vintage Multicouches Unisex,9.59,20.66,54,732
jewelry,Montres pour homme,Montres mécaniques automatiques DEFFRUN,118.31,236.67,50,208
jewelry,Bracelets,Bracelet chaine chat mignon ,14.4,28.68,50,57
jewelry,Boucles d'oreilles,Pendentif vintage en argent sterling 925,17.18,32.72,48,573
jewelry,Boucles d'oreilles,1 Paire De Boucles d'oreilles À LED Clous D'oreilles Style Noël,9.26,18.57,50,3787
jewelry,Bracelets,Kit de bracelet pendentif Lotus creuse,6.99,24.12,71,115
jewelry,Boucles d'oreilles,Boucles d'oreilles élégantes feuilles en strass,9.59,20.66,54,2007
jewelry,Colliers,Bracelet à grande chaîne avec cadenas,8.09,24.17,67,264
jewelry,Montres pour homme,CURREN Affichage de date de style casual hommes,27.23,53.06,49,201
jewelry,Montres pour homme, Cadran carré montre homme,43.8,78.7,44,72
jewelry,Colliers,Strass plume longue chaîne de chandail ,17.61,35.95,51,145
jewelry,Bagues,Ensemble d'anneaux de tournesol en métal saphir,10.99,21.99,50,25
jewelry,Accessoires des cheveux,Pince à cheveux,5.85,14.11,59,379
jewelry,Boucles d'oreilles,Clip d'oreille punk en forme de grimpeur,8.52,18.26,53,1121
jewelry,Boucles d'oreilles,Boucles d'oreilles strass flocon de neige,13.79,22.79,40,64
jewelry,Colliers,Colorful Collier multicouche perlé,14.99,29.99,50,16
jewelry,Montres pour homme,Montres Mécaniques ,219.44,417.99,48,49
jewelry,Bracelets,Ensemble de bracelet en corde tressée bohème,10.23,24.88,59,190
jewelry,Boucles d'oreilles,Boucle d'oreille ronde irrégulière,7.44,16.59,55,85
jewelry,Colliers,Colliers Pendentif Animaux Colorés,18.25,53.82,66,633
jewelry,Montres pour femme,Mode montre à quartz,17.61,33.54,48,310
jewelry,Bagues,Ensemble de 3 bagues Boho Set,10.66,19.27,45,334
jewelry,Bracelets pour homme,Bracelet en cuir véritable vintage,14.4,27.42,48,97
jewelry,Montres connectées,Mesurer la montre intelligente de mode,90.92,196.8,54,201
jewelry,Bracelets,Bracelet Tibétain en Bois avec Perles,13.32,23.5,43,913
jewelry,Fine Copper,Bague fleur en argent sterling,22.96,40.5,43,783
jewelry,Colliers,Chaîne de chandail de paon Vintage,13.32,18.13,27,763
jewelry,Colliers,Sautoir en cristal Vintage en bois,28.3,52.97,47,305
jewelry,Bagues,Ensemble de bague fleur creuse,8.99,16.99,47,37
jewelry,Montres pour homme,Montre de sport numérique chrono,23.05,43.92,48,276
jewelry,Montres pour homme,Montres Mécaniques Sport Hommes,42.72,81.38,48,115
jewelry,Bracelets de cheville,Bracelet de cheville tendance à double épaisseur,7.99,14.99,47,895
jewelry,Sets de bijoux,Ensembles de bijoux de luxe en or 18 carats,32.58,63.32,49,193
jewelry,Boucles d'oreilles,Boucles D'oreilles Ornées Strass Cristal En Acier Style Paon Pour Femme,9.59,19.87,52,3562
jewelry,Colliers,Pendentif fleur rose,13.32,33.01,60,142
jewelry,Bagues,Bague Motif Dragon en Acier Inoxydable,9.73,20.58,53,1134
jewelry,Bracelets de cheville,Bracelets de cheville rétro à pompon,7.5,16.69,55,269
jewelry,Boucles d'oreilles,Boucles d'Oreilles Cristal Rouge Bohème ,11.09,22.46,51,458
jewelry,Colliers,Anneau pendentif couple collier,8.52,17.08,50,549
jewelry,Boucles d'oreilles,Boucles d'oreilles rondes turquoise,11.54,20.77,44,82
jewelry,Bagues,Ensemble d'anneaux de gemme goutte d'eau triangle,6.5,24.99,74,26
jewelry,Boucles d'oreilles,Boucles d'oreilles fleurs stéréoscopiques,12.64,20.77,39,43
jewelry,Boucles d'oreilles,Ligne géométrique poisson ligne oreille,5.85,16.96,66,247
jewelry,Montres pour femme,Montre à quartz à cadran,15.47,32.72,53,173
jewelry,Colliers,Collier en acier inoxydable à pendentif hexagonal,25.49,47.21,46,396
jewelry,Bracelets,Bracelet Constellation Vintage fait main,9.59,19.47,51,372
jewelry,Bagues,Bagues carrées en zircon,12.99,24.99,48,10
jewelry,Colliers,Collier Unisexe Simple Collier Noir Obsidian Avalokitesvara,8.09,17.13,53,737
jewelry,Boucles d'oreilles,Boucle d'oreille en pierre bleue,11.99,0,0,28
jewelry,Colliers,Colliers de chandail de corde en bois ethnique,11.73,21.9,46,391
jewelry,Bracelets pour homme,Bracelet énergétique magnétique pour homme,14.4,26.36,45,406
jewelry,Bagues,Bague ajustable en forme d'aile d'ange en strass,18.25,33.43,45,765
jewelry,Montres pour femme,Montre élégante à quartz avec bracelet en cuir,43.47,86.99,50,246
jewelry,Montres pour homme,SKMEI Luminous Montre Classique,33.6,58.21,42,131
jewelry,Montres pour homme,Montre à chiffres romains à la mode,20.82,45.06,54,93
jewelry,Colliers,Collier pendentif transparent en résine solide ,16.54,36.36,55,192
jewelry,Bagues,Ensemble de bague en strass feuille de métal,10.49,20.99,50,53
jewelry,Bracelets,Bracelet perlé oeil bleu foncé rétro ,7.44,16.25,54,210
jewelry,Bagues pour homme, Bague homme à imprimé pneu de voiture,2.72,17.33,84,23
jewelry,Colliers,Collier fleur de cristal bleu Fashion,16.54,30.31,45,154
jewelry,Bracelets,Bracelet Doux Argenté Tibétain avec Perles à Coeur,16.54,29.81,45,1555
jewelry,Bracelets,Ensemble de 4 bracelets,10.99,21.98,50,8
jewelry,Bagues,Bague de mariage en argent sterling Zircon Platinum,11.95,21.16,44,561
jewelry,Bagues,Bagues Bohemian Retro Blue Turquoise,7.44,15.95,53,287
jewelry,Bagues,Ensemble de bagues éléphant papillon,12.99,25.99,50,30
jewelry,Montres de poche, Montre mécanique à remontage manuel ,37.37,67.14,44,114
jewelry,Colliers,Collier À Pendentif Goutte D'eau Ronde En Cristal À Chandail,14.4,27.32,47,1011
jewelry,Colliers pour homme,Army Style White Black 2 Collier de Tag Dog,11.53,19.95,42,417
jewelry,Colliers,Collier multicouche plume en métal ,11.49,18.74,39,59
jewelry,Montres connectées,Montre intelligente de moniteur d'ECG de thermomètre,33.99,66.99,49,4
jewelry,Colliers de couple,Collier double lettrage tournesol ,6.92,14.17,51,84
jewelry,Montres pour femme,Montres en cuir multicouche à la mode,13.32,24.4,45,782
jewelry,Bagues,Jeu de bagues bohémiennes,9.59,20.25,53,640
jewelry,Colliers,Collier pendentif éléphant vintage,12.37,23.56,48,325
jewelry,Boucles d'oreilles,Boucles d'oreilles lune soleil déesse bohème,11.3,21.52,48,169
jewelry,Colliers,Collier plastron en cristal coloré pour femme,17.45,33.25,48,252
jewelry,Boucles d'oreilles,Kit de boucles d'oreilles géométriques,2.42,18.35,87,72
jewelry,Bagues,Letters Gravé Fleur Anneau,11.3,20.3,44,943
jewelry,Bracelets pour homme,Bracelets perlés tressés en cuir tressés,11.62,22.78,49,196
jewelry,Montres pour homme,REDEAR Montres en bois faites à la main,58.79,111.82,47,256
jewelry,Colliers,Collier multicouche pompon pentagramme,10.99,0,0,54
jewelry,Colliers pour homme,Sautoir Couronne Lion Sautoir,20,38.12,48,175
jewelry,Bracelets pour homme,Bracelet chaîne magnétique à la mode,43.37,80.98,46,87
jewelry,Bracelets pour homme,Bracelets multicouches en cuir vintage,13.97,26.08,46,219
jewelry,Montres pour femme,Montre Femme Alloy Mesh Bande,8.99,19.98,55,6
jewelry,Bagues,Ensemble de bagues en diamant opale coloré ,7.44,16.59,55,194
jewelry,Colliers,Pendentif pierre multi-couche collier,14.4,31.17,54,98
jewelry,Colliers pour homme,Collier pendentif en perle noir obsidienne noir,11.22,22,49,212
jewelry,Colliers,Collier pendentif femme bohème,9.59,20.66,54,1066
jewelry,Bracelets,Bracelets en cuir multicouches occasionnels,9.42,17.56,46,543
jewelry,Bagues,Bague en acier inoxydable pour hommes,14.73,28.07,48,451
jewelry,Bracelets,Bracelet perlé de bois de santal multicouche,9.59,19.66,51,1033
jewelry,Montres pour femme,Montre à quartz à bracelet en cuir,32.58,62.06,48,290
jewelry,Bracelets pour homme,Bracelet de mots en cuir punk,10.66,18.79,43,203
jewelry,Montres connectées,Montre intelligente de style professionnel,326.54,642.71,49,113
jewelry,Bracelets pour homme,Bracelet Vintage 12 Constellation,14.27,28.54,50,41
jewelry,Bagues,Élégants anneaux en cristal bleu argent,9.59,20.25,53,622
jewelry,Colliers,Collier pendentif clavicule en forme de v,5.85,16.96,66,234
jewelry,Colliers pour homme,Collier en acier inoxydable de 3mm collier carré,9.59,19.87,52,190
jewelry,Montres connectées,Montre Huawei Honor,356.99,612,42,65
jewelry,Boucles d'oreilles,1 paire d'oreilles extraterrestres Xenomorph,6.99,19.75,65,1110
jewelry,Montres pour femme,Montre femme calendrier givré,7.99,17.98,56,6
jewelry,Bagues,Ensemble de bagues étoiles à six branches,6,22.99,74,22
jewelry,Accessoires des cheveux,Barrette creuse en forme de chat mignon à perle décorative,9.59,19.48,51,1029
jewelry,Boucles d'oreilles,Boucles d'oreilles bohémiennes,13.32,23.95,44,263
jewelry,Colliers, Collier feuille d'or hémisphère,6.99,12.99,46,52
jewelry,Montres pour femme,Montre Fashion Square Style Femme,19.75,39.19,50,324
jewelry,Montres de poche,Montre de poche mécanique lumineuse,40.15,73.55,45,89
jewelry,Boucles d'oreilles,Boucles d'oreilles en plumes de paon Vintage,8.23,15.81,48,1312
jewelry,Zinc Alloy,Bague en argent avec strass rétro,18.68,34.22,45,522
jewelry,Colliers,Déclaration grand collier pendentif,25.08,45.94,45,254
jewelry,Boucles d'oreilles,Boucles d'oreilles polonaises ternes,9.59,20.66,54,183
jewelry,Colliers,Collier en forme de feuille d'érable,13.97,36.65,62,357
jewelry,Fine Copper2,Bague de luxe pour femme,19.75,36.88,46,542
jewelry,Bagues,Anneaux de pierres précieuses sculptées de style rétro ,9.16,18.71,51,434
jewelry,Bagues,Ensemble d'anneaux en relief pour portrait en métal ,11.73,21.11,44,109
jewelry,Boucles d'oreilles,Boucles d&#39;oreilles en cristal plaqué or 18 carats en zircon,8.89,16.48,46,523
jewelry,Accessoires des cheveux,Pince à cheveux Vintage Tessals,17.18,32.72,48,375
jewelry,Sets de bijoux,Ensemble de bijoux élégant avec strass et perles,11.29,20.27,44,509
jewelry,Montres pour homme,Montre-bracelet à quartz en cuir sport,50.22,95.66,48,258
jewelry,Montres connectées,Mi Band 3/4 Bracelet en silicone de remplacement,5.99,10.99,46,2
jewelry,Bracelets,Bracelet multicouche en marbre triangle,9.99,19.99,50,18
jewelry,Colliers,Collier pendentif long en daim,10.66,25.39,58,128
jewelry,Bagues de couple,Bague Vintage Open Couple,9.16,19.84,54,593
jewelry,Bagues,Bagues Ethniques en Strass,18.25,34.76,48,152
jewelry,Boucles d'oreilles,Boucles d'oreilles turquoise bohème,6.28,16.33,62,400
jewelry,Accessoires des cheveux,Barrette douce charmante en forme de lune brillante à frange,9.59,19.87,52,317
jewelry,Montres pour homme,Montres Business Quartz,55.58,103.78,46,178
jewelry,Montres pour femme,Montre de style Business avec affichage de la date ,52.36,99.74,48,233
jewelry,Boucles d'oreilles,Goutte d'oreille en diamant émeraude,13.32,25.38,48,172
jewelry,Montres pour homme,Montre à quartz fashion,29.57,59.14,50,398
jewelry,Boucles d'oreilles,Punk U Shape Clip d'oreille,9.16,17.35,47,425
jewelry,Bagues,Bague colorée à la mode,14.88,24.66,40,175
jewelry,Bracelets,Bracelet élégant en S925 argent,17.18,32.72,48,384
jewelry,Colliers,Collier glands multicouches Boehmian,10.23,21.45,52,203
jewelry,Bracelets,Bracelet multicouche tissé à la main punk ,5.85,15.25,62,54
jewelry,Colliers,Pendentif pendentif pissenlit,9.59,20.25,53,1625
jewelry,Colliers,Collier élégant style vintage en bois,11.73,23.77,51,1805
jewelry,Bracelets pour homme,Vintage Silver Toner 316L Bracelet en acier inoxydable,30.19,56.36,46,550
jewelry,Montres pour homme,Montre de sport à quartz,65.22,124.23,48,50
jewelry,Montres pour homme,Montre à quartz lumineux de style entreprise,24.3,46.29,48,141
jewelry,Bracelets,Bracelet géométrique floral tissé à la main,7.44,21.58,66,63
jewelry,Boucles d'oreilles,Boucles d'oreilles longues goutte d'eau géométrique,7.06,18.02,61,345
jewelry,Bracelets,Bracelet élégant pour femme Bracelet spirale en spirale creux,11.35,20.79,45,248
jewelry,Bagues,Bague vintage en pierre de lune,14.4,27.43,48,565
jewelry,Bagues,Bague Ajustable Géométrique,8.52,24.85,66,135
jewelry,Bagues,Ensemble de bagues réglables Moon Star,9.99,19.99,50,19
jewelry,Bracelets,Bracelet de perles de turquoise de Bohème,19.75,37.63,48,282
jewelry,Boucles d'oreilles,Asymmetry Stud Set,1.59,10.19,84,51
jewelry,Boucles d'oreilles,Boucles d'oreilles à la mode,31.08,48.91,37,281
jewelry,Boucles d'oreilles,Boucles d'oreilles Simples Longues En Alliage Style Fleur Noire Pour Femme,10.66,19.15,44,1665
jewelry,Colliers,Collier bohémien multicouche croissant,7.99,21.45,63,637
jewelry,Colliers,Collier multi-couches punk hip hop ,9.99,22.34,55,116
jewelry,Accessoires des cheveux,Daisy Hair Bande,9.99,19.99,50,34
