category,subcategory,name,current_price,raw_price,discount,likes_count
jewelry,Bracelets,Bracelet multicouche strass lettre F,11.99,22.99,48,5
jewelry,Colliers,Collier long vintage avec pendentif,19.98,39.96,50,102
jewelry,Montres pour femme,Montre bracelet de style décontracté femmes,26.8,53.17,50,115
jewelry,Montres pour femme,Montre à bracelet en cuir pour femme,19.75,37.62,48,615
jewelry,Bagues,Sweet Wedding Ring Three Zircon Platinum Ring for Women Gift,7.22,13.87,48,127
jewelry,Fine Copper2,2 pcs / set Anneaux de mariage coeur rouge,19.75,37.62,48,387
jewelry,Bagues,Bague strass géométrique ,11.82,23.78,50,169
jewelry,Bagues,Bague en cristal bleu,9.99,19.99,50,5
jewelry,Montres pour homme,Montre bracelet à bascule Montre bracelet en cuir rétro Retro Bracelet Homme,19.24,33.92,43,553
jewelry,Boucles d'oreilles,Boucles d'oreilles rétro en métal ,7.74,14.89,48,55
jewelry,Bagues pour homme,Bagues à motif vintage,16.54,31.5,48,103
jewelry,Colliers,Colliers pendentifs à la feuille d'or à la mode,9.59,19.87,52,141
jewelry,Montres pour femme,Montre-bracelet à quartz,45.48,83.62,46,135
jewelry,Bracelets,Bracelet charmant arbre de vie,8.52,18.9,55,437
jewelry,Montres pour homme,Chronomètre hommes de luxe,50.22,95.66,48,24
jewelry,Bracelets,Bracelet à remontage turquoise rétro ,12.37,22.22,44,141
jewelry,Boucles d'oreilles,Boucles d'oreilles rondes style rétro ,10.07,24.53,59,429
jewelry,Boucles d'oreilles,Bohemian Colorful Stud d'oreille ,13.97,26.6,48,103
jewelry,Colliers,Collier de parfum Vintage Life Tree,15.14,26.64,43,120
jewelry,Bracelets de cheville,Vintage longues chaines de cheville,11.73,22.34,48,186
jewelry,Boucles d'oreilles,Boucles d'oreilles zircon flocon de neige élégant,11.73,22.34,48,216
jewelry,Bracelets pour homme,Bracelet Plume Métal Punk,10.23,22.8,55,56
jewelry,Colliers,Collier multicouche à pampille gemme,9.44,19.26,51,33
jewelry,Bracelets de cheville,Chaîne de cheville en forme de serpent,8.52,21.74,61,20
jewelry,Bijoux de corps,Chaîne de corps en velours avec strass ,9.17,18.35,50,111
jewelry,Colliers,Collier de perles en bois bouddhiste,19.75,35.49,44,265
jewelry,Montres pour homme,Montres étanches de phase de lune de lune,58.79,111.98,48,208
jewelry,Boucles d'oreilles,Boucles d'oreilles pompon fleur lune,10.08,21.24,53,758
jewelry,Bracelets,Bracelets en perles de bois pompon Vintage,10.62,19.43,45,197
jewelry,Boucles d'oreilles,Boucles d'oreilles douces argentées dorées avec fleurs,8.52,21.73,61,2151
jewelry,Bracelets,Bracelet Bohème Femmes Bracelet Multicouches Bracelet Plage,8.05,15.37,48,115
jewelry,Colliers pour homme,Collier à gourdin en acier inoxydable,12.21,24.43,50,118
jewelry,Montres pour femme,Montres à quartz ultra-légères,9.99,19.98,50,2
jewelry,Bracelets pour homme,216 Bracelets perlés de prière de 6mm,8.52,17.23,51,307
jewelry,Broches et épingles,Broche de collier de triangle de modèle,3.99,7.98,50,0
jewelry,Montres pour femme,Montre à quartz en plastique pour femmes,9.99,19.98,50,0
jewelry,Colliers,Collier de chandail ethnique en céramique,12.84,23.55,46,64
jewelry,Boucles d'oreilles,Boucles d'oreilles non cartilagineuses,9.59,19.87,52,266
jewelry,Colliers pour homme,Pendentif croix en cuir rétro ,9.3,19,51,31
jewelry,Colliers,Collier à pendentif mini harmonica,5.5,21.98,75,2
jewelry,Colliers pour homme,Collier Bouddha Vintage Bijoux Obsidien Noir Raise Hands Necklace,5.59,10.16,45,273
jewelry,Boucles d'oreilles,Boucles d'oreilles en pierre irrégulière multicolore,8.52,19.69,57,337
jewelry,Bracelets pour homme,Bracelet en silicone en acier inoxydable pour homme,9.59,19.2,50,605
jewelry,Colliers,Collier pendentif creux palm,8.52,24.85,66,80
jewelry,Bracelets pour homme,Bracelet punk pour hommes Bracelet en cuir véritable Bracelet fait à la main,13.23,23.63,44,118
jewelry,Bracelets pour homme,Bracelet jonc géométrique ,21.89,46.35,53,35
jewelry,Boucles d'oreilles, Boucles d'oreilles à paillettes irrégulières ,7.44,16.59,55,68
jewelry,Boucles d'oreilles,Boucles d'oreilles bohémiennes en forme de feuille,9.16,19.08,52,261
jewelry,Bagues pour homme,Anneaux De Mode En Argent Or,9.59,20.66,54,99
jewelry,Bracelets,Bracelet multicouche bohémien à perles colorées,15.47,28.33,45,446
jewelry,Bagues,Bague en résine animal mignon,10.23,23.05,56,89
jewelry,Bagues de couple,Bague de couple,9.16,19.08,52,717
jewelry,Bagues,Bague délicate en zircon fleur coquillage,13.32,23.5,43,469
jewelry,Bagues,Ensembles Bagues Soleil Lune Tournesol ,10.66,19.15,44,196
jewelry,Bagues,Anneaux de coeur de tortue rétro ,10.66,23.06,54,241
jewelry,Boucles d'oreilles,Boucles d'oreilles ethniques faites à la main en forme de soleil,8.15,16.3,50,602
jewelry,Colliers,Collier à la main Vintage pendentif,9.59,23.61,59,138
jewelry,Montres pour femme, Ligne géométrique simple montre à aiguille,34.67,66.68,48,32
jewelry,Bagues pour homme,Anneaux de doigt de crâne de mode,11.3,21.52,48,117
jewelry,Sets de bijoux,Ensembles de bijoux pendentif en or de mode,7.74,15.48,50,199
jewelry,Montres connectées,Bakeey Montre intelligente de pression artérielle en temps réel avec écran,31.51,51.96,39,61
jewelry,Montres pour homme,Montre Sport Led Night Light Men,27.87,56.47,51,78
jewelry,Boucles d'oreilles,Boucles d'oreilles douces fleurs suspendues,9.26,18.9,51,116
jewelry,Colliers,Collier ethnique en ébène,17.18,32.72,48,146
jewelry,Boucles d'oreilles,Boucles d'oreilles Ancien de vacances,10.66,20.3,48,96
jewelry,Boucles d'oreilles,Boucles d'oreilles à la mode,8.52,18.62,54,280
jewelry,Bracelets pour homme,Bracelet en alliage de Bohême,10.66,17.26,38,81
jewelry,Boucles d'oreilles,Boucles d'oreilles texture de minerai vert africain,12.37,24.04,49,118
jewelry,Colliers,Collier pendentif ethnique Lotus noir ébène,18.68,40.43,54,104
jewelry,Bijoux de corps,Chaîne de corps géométrique,10.19,20.39,50,99
jewelry,Bijoux de corps,Bracelet ajustable en zircon géométrique ,9.59,20.67,54,199
jewelry,Bijoux de corps,Kit de prothèse canine ,15.47,30.7,50,26
jewelry,Boucles d'oreilles,Ensemble de clous d'oreilles vintage,10.19,18.53,45,64
jewelry,Boucles d'oreilles,Boucles d'oreilles Turquoise creuses ,11.54,20.77,44,46
jewelry,Boucles d'oreilles,Boucles d'Oreilles Longues Fleur Tempérament,15.51,28.22,45,15
jewelry,Fine Copper,Bracelet à breloques Lotus,28.3,52.84,46,316
jewelry,Boucles d'oreilles,Boucles d'oreilles crâne en acier inoxydable punk,15.04,28.08,46,212
jewelry,Colliers,Chaîne de pull en pierre colorée,9.71,20.93,54,466
jewelry,Montres connectées,Montre intelligente Bluetooth Xiaomi AMAZFIT GPS,219.44,420.09,48,80
jewelry,Colliers,Collier pompon en perles de 10 mm,11.99,23.99,50,4
jewelry,Montres pour femme,Montres à quartz avec chiffres romains,11.99,25.98,54,2
jewelry,Boucles d'oreilles,Asymmetry Conch Pendant Pendant ,4.11,8.23,50,86
jewelry,Bracelets,Punk Eagle Charmant Bracelet en cuir,14.73,27.44,46,109
jewelry,Bracelets de cheville,Bracelet de cheville multicouche en pâte polymère,4.5,16.99,74,7
jewelry,Bracelets,Bracelet en cuir Vintage Buckle,10.43,22.26,53,119
jewelry,Colliers,Collier écharpe ethnique multicolore,15.04,27.05,44,174
jewelry,Montres pour femme,Montre multifonctionnelle en cuir,57.99,115.98,50,2
jewelry,Boucles d'oreilles,Boucles d'oreilles mignonnes,10.66,19.9,46,129
jewelry,Bracelets pour homme,Bracelet pendentif géométrique en acier au titane ,15.47,33.16,53,26
jewelry,Boucles d'oreilles,Boucles d'oreilles brisées en or rétro,6.99,17.44,60,111
jewelry,Bracelets,Bracelets de charme perlés doux,13.97,27.62,49,209
jewelry,Colliers,Collier pendentif femme pompon,13.99,27.98,50,0
jewelry,Montres pour femme,Montre femme à fermoir réglable,8.99,19.98,55,0
jewelry,Colliers,Collier foulard imprimé léopard,11.19,27.98,60,0
jewelry,Bagues,Deux bagues Swan Heart Zircon,18.68,34.22,45,474
jewelry,Bagues,Ensemble de 6 anneaux d'articulation vintage,13.32,25.38,48,456
jewelry,Bagues,Bague astronomique en cuivre ,9.59,29.54,68,141
jewelry,Bracelets,Bracelet à breloques bohème,11.21,21.98,49,208
jewelry,Montres pour homme,Montre Sport Homme,58.79,111.98,48,73
jewelry,Sets de bijoux,Ensemble de bijoux de luxe,22.53,42.08,47,216
jewelry,Boucles d'oreilles,Boucles d'oreilles en argent sterling or mat,13.32,23.95,44,105
jewelry,Colliers,Collier vintage tibétain avec pendentif en agate neuf yeux,22.96,42.06,45,161
jewelry,Montres pour homme,Montre homme de luxe en alliage Bande,30.74,81.98,63,3
jewelry,Colliers,Collier pompon oeil de tigre,9.99,19.99,50,12
jewelry,Bracelets,Bracelet réglable perle papillon,10.49,21.27,51,58
jewelry,Colliers,Collier fleur en céramique fait main,7.99,14.99,47,32
jewelry,Montres pour homme,Montre à quartz lumineuse,40.49,107.98,63,0
jewelry,Accessoires des cheveux,Serre-tête en dentelle Palace,12.99,25.99,50,23
jewelry,Bracelets,Bracelet de perles en céramique fleur,8.99,0,0,40
jewelry,Colliers,Collier de perles fait main turquoise,12.99,24.99,48,12
jewelry,Boucles d'oreilles,Boucles d'oreilles pendantes à imprimé vintage,9.39,16.39,43,30
jewelry,Bagues,Bague réglable pour animaux,22.41,37.84,41,48
jewelry,Boucles d'oreilles,Boucles d'oreilles pompon Sector,8.99,16.99,47,35
jewelry,Colliers,Chaîne de chandail en perles de cristal,17.99,34.99,49,5
jewelry,Montres pour femme,Montres No Number Femme,9.99,19.98,50,13
jewelry,Montres pour homme,Montre à quartz en acier inoxydable,18.74,49.98,63,2
jewelry,Colliers,Collier pendentif pompon marguerite,11.54,21.99,48,43
jewelry,Boucles d'oreilles,Boucles d'oreilles marguerite asymétrique ,12.59,23.99,48,66
jewelry,Boucles d'oreilles,Boucles d'oreilles goutte d'eau marguerite,5.99,10.99,46,29
jewelry,Bracelets,Bracelet perlé de cloches tissé à la main,9.99,19.99,50,12
jewelry,Accessoires des cheveux,Bandeau de broderie vintage,7.99,12.99,39,25
jewelry,Montres pour homme,Montres à quartz à calendrier étanche,10.49,27.98,63,1
jewelry,Montres connectées,Montre-bracelet Bluetooth Sport Smart,14.99,29.99,50,4
jewelry,Boucles d'oreilles,Boucles d'oreilles à pompons en coton mélangé,4.99,9.99,50,11
jewelry,Boucles d'oreilles,Clip d'oreille en forme de C perle,6.99,12.99,46,34
jewelry,Colliers,Collier fleur séchée ,10.49,22.39,53,54
jewelry,Montres connectées,Bracelet solaire plein écran rond,79.99,161.99,51,5
jewelry,Boucles d'oreilles,Boucles d'oreilles goutte d'eau strass,14.99,0,0,24
jewelry,Bracelets pour homme,Bracelet Planète du Système Solaire,12.99,25.98,50,8
jewelry,Colliers,Collier en cuir velours animal,9.99,19.99,50,17
jewelry,Montres pour femme,Montres à quartz mignonnes Bee,10.99,21.98,50,4
jewelry,Accessoires des cheveux,Bandeau en tissu plié à fleurs,12.99,0,0,21
jewelry,Colliers,Collier pendentif en verre de tournesol,5,19.99,75,9
jewelry,Boucles d'oreilles,Grandes boucles d'oreilles en bois géométrique,11.99,0,0,25
jewelry,Colliers,Collier multicouche en mousseline de soie perlé à la main,13.99,26.99,48,5
jewelry,Boucles d'oreilles,Boucles d'oreilles en oeil de chat,11.99,22.99,48,15
jewelry,Bagues,Anneaux de couronne coeur de pêche,9.44,18.94,50,69
jewelry,Sets de bijoux,Ensemble de collier marguerite en résine,8,30.99,74,10
jewelry,Montres pour homme,Montre à cadran triangle d'affaires,34.49,91.98,63,6
jewelry,Montres pour femme,Rotate Indicator Femmes Montres,8.99,19.98,55,8
jewelry,Bagues,Ensemble de 8 bagues,19.99,39.98,50,6
jewelry,Boucles d'oreilles,Ensemble de boucles d'oreilles turquoise,11.54,20.77,44,33
jewelry,Montres pour homme,Montre de sport avec bracelet en cuir,29.24,77.98,63,2
jewelry,Colliers,Collier à pampilles en cristal,9.99,26.99,63,4
jewelry,Colliers,Collier pompon perles en bois,11.99,22.99,48,16
jewelry,Montres pour homme,Montre chronographe à quartz avec calendrier,9.74,25.98,63,6
jewelry,Boucles d'oreilles,Ensemble de boucles d'oreilles gland fait main ,9.44,18.94,50,48
jewelry,Montres connectées,Montre intelligente avec moniteur de fréquence cardiaque 24h,41.99,82.99,49,6
jewelry,Bagues,Bague en forme de serpent géométrique,11.54,20.77,44,63
jewelry,Colliers,Collier de perles en céramique,9.19,14.66,37,34
jewelry,Montres pour femme,Montre à quartz étanche pour femme,18.99,37.98,50,5
jewelry,Colliers,Sautoir en perles de bois 8 mm,10.99,21.99,50,11
jewelry,Montres pour femme,Montre à double boucle déployante,50.99,71.98,29,3
jewelry,Bracelets,Bracelet petit papillon brodé,6.99,13.98,50,3
jewelry,Montres pour femme,Montre bracelet losange,33.99,67.98,50,9
jewelry,Boucles d'oreilles,Ensemble de boucles d'oreilles pompon Sector,8.39,16.86,50,49
jewelry,Montres pour homme,Montre Business Steel Bande,26.24,69.98,63,3
jewelry,Colliers,Collier pompon à trois couches,12.99,24.99,48,4
jewelry,Boucles d'oreilles,Boucles d'oreilles spirales rondes ,10.34,16.71,38,51
jewelry,Colliers,Collier multicouche de perles de riz,9.02,16.33,45,47
jewelry,Bracelets,Bracelet pendentif perles en céramique fleur,10.99,0,0,34
jewelry,Boucles d'oreilles,Boucles d'oreilles goutte d'oreille Vintage,9.59,20.25,53,189
jewelry,Montres pour homme,Quartz Sport Hommes Montres,54.51,103.82,48,83
jewelry,Montres pour femme,Montres Casual Femme,21.41,42.82,50,87
jewelry,Accessoires,Cravate Bolo Vintage Réglable,25.08,49.18,49,50
jewelry,Bagues pour homme,Bagues à chaîne vintage,18.25,34.76,48,61
jewelry,Boucles d'oreilles,Boucles d'oreilles à la mode lisses,7.49,16.66,55,80
jewelry,Montres pour femme,Montre-bracelet Crystal Diamond pour femmes,14.4,27.43,48,85
jewelry,Montres pour homme,Montre connectée sport,27.81,51.98,47,197
jewelry,Colliers,Collier multicouche de mode,11.3,21.52,48,100
jewelry,Accessoires,Manchette de style flocon de neige,7.74,15.48,50,30
jewelry,Boucles d'oreilles,Goutte d'oreille de fleur de style rétro ,8.15,18.52,56,94
jewelry,Bracelets pour homme,Bracelet en cuir queue de baleine,7.13,15.29,53,44
jewelry,Colliers,Tassel Dreamcatcher Sweater Chain,11.73,27.32,57,82
jewelry,Boucles d'oreilles,Boucles d'oreilles pendentif gland vintage ,9.59,22.15,57,58
jewelry,Boucles d'oreilles, Boucles d'oreille en pierre naturelle dégradée,25.08,47.79,48,60
jewelry,Boucles d'oreilles,Boucles d'oreilles glands africains ,10.66,19.53,45,97
jewelry,Bracelets de cheville,Bracelet de cheville perlé bohème,7.5,16.69,55,79
jewelry,Boucles d'oreilles,Boucles d'Oreilles Pompon Fleur,13.32,25.39,48,22
jewelry,Boucles d'oreilles,Boucles d'Oreilles Longues Pompon Feuille,15.51,26.99,43,18
jewelry,Bracelets pour homme,Ensemble de bracelets en cuir Buddha Beads,11.73,21.49,45,131
jewelry,Montres pour homme,Montres de poche mécaniques Vintage OUYAWEI,57.72,113.4,49,67
jewelry,Broches et épingles,Broche feuille d'érable à la mode,10.66,19.53,45,293
jewelry,Montres pour homme,Montre Sport numérique homme,305.99,611.98,50,27
jewelry,Montres pour homme,Montre Étanche Extra Plat pour Homme,33.65,64.09,48,389
jewelry,Bracelets pour homme,Bracelet en cuir aigle Fashion,9.83,20.77,53,140
jewelry,Bijoux de corps,1pcs Punk Nez Piercing Ring,7.44,15.34,52,621
jewelry,Montres pour homme,Montres Hommes Lumineux En Cuir,36.74,97.98,63,0
jewelry,Montres pour femme,Montre à cadran rotatif à fleurs,47.99,95.98,50,0
jewelry,Bracelets,Bracelet multicouche à perle cristal,9.16,19.56,53,993
jewelry,Montres pour homme,Montre d'affaires à quartz,19.75,37.62,48,361
jewelry,Montres pour femme,Montres de luxe à quartz minimaliste Lady's,47.01,88.3,47,185
jewelry,Boucles d'oreilles,Boucles d'oreilles Vintage Star Moon,8.52,18.62,54,389
jewelry,Colliers,Collier chandail à boucle à glissière,6.5,25.98,75,0
jewelry,Boucles d'oreilles,Boucles d'Oreilles Strass en Oreille Cristal,9.59,19.48,51,1109
jewelry,Boucles d'oreilles,Boucles d'oreilles rondes en bronze africain ,9.59,19.48,51,49
jewelry,Boucles d'oreilles,Clous d'oreilles en marbre dégradé ,10.34,16.71,38,23
jewelry,Boucles d'oreilles, Boucles d'oreilles irrégulières en acrylique vert,8.52,17.08,50,30
jewelry,Colliers,Collier foulard en coton flammé,11.19,27.98,60,0
jewelry,Colliers,Collier à pendentif en perles d'imitation,11.99,29.98,60,1
jewelry,Montres pour homme,Montre-bracelet décontractée à quartz,47.01,89.54,48,79
jewelry,Bracelets de cheville,Pompon rond pendentif cheville ,8.58,18.75,54,119
jewelry,Boucles d'oreilles,Boucles d'oreilles rétro à la main ,8.52,18.62,54,80
jewelry,Colliers,Collier Mode avec Pierre Naturelle Multicolore,9.32,19.64,53,294
jewelry,Colliers,Collier long ethnique perlé,9.17,17.98,49,211
jewelry,Boucles d'oreilles,Boucles d'oreille de gemme fleur de Hallow Bohemian ,8.52,18.99,55,208
jewelry,Accessoires des cheveux,Bandeau élastique à pompons,9.99,19.99,50,11
jewelry,Montres pour femme,Montre à bracelet en feuille tressée multicouches,10.66,18.81,43,548
jewelry,Bagues,Bague fleur de luxe élégante ,10.66,22.57,53,204
jewelry,Bagues,Bague Fleur Vintage Sculptée ,5.85,16.96,66,111
jewelry,Bagues,Ensemble d'anneau empilable ,7.44,16.59,55,158
jewelry,Bagues,4 pièces / ensemble bague dorée,3.5,13.98,75,0
jewelry,Boucles d'oreilles,Boucles d'oreilles en plumes de Bohème,9.59,19.87,52,119
jewelry,Boucles d'oreilles,Boucles d'oreilles élégantes en pierres précieuses,10.23,21.88,53,154
jewelry,Boucles d'oreilles pour homme,1 paire de boucles d'oreilles clip en acier inoxydable,11.3,20.7,45,81
jewelry,Boucles d'oreilles,Boucles d'oreilles cône en acier titane pour homme,9.17,17.64,48,143
jewelry,Boucles d'oreilles,Boucles d'oreilles bohémiennes en forme de feuille,7.13,13.45,47,493
jewelry,Sets de bijoux,Ensemble de bijoux de luxe ailes de papillon,17.61,32.25,45,144
jewelry,Boucles d'oreilles,Boucles d'oreilles à fleurs ethniques,8.52,17.91,52,271
jewelry,Boucles d'oreilles,Boucles d'oreilles déclaration d'insectes,19.32,36.8,48,118
jewelry,Bracelets,Bracelet fait main turquoise à la mode,7.44,15.78,53,212
jewelry,Boucles d'oreilles,Boucles d'oreilles ethniques en pierres précieuses,9.86,17.91,45,670
jewelry,Colliers,Collier de fleurs séchées étoilées lumineuses,13.32,23.95,44,195
jewelry,Montres pour femme,Montre-bracelet décontractée pour femmes en cristal,14.4,26.88,46,140
jewelry,Colliers,Collier pendentif bohème,10.7,20.38,48,113
jewelry,Montres pour homme,Montre homme quartz,37.37,71.18,48,395
jewelry,Bracelets,Bracelet Vintage Love Bird,8.52,18.62,54,116
jewelry,Boucles d'oreilles,Boucles d'oreilles rétro hibou diamant,10.02,23.63,58,79
jewelry,Boucles d'oreilles,Boucles d'oreilles Vintage Leaves,8.52,18.62,54,149
jewelry,Bracelets de cheville,Bracelet de cheville de fleur hallow vintage,9.59,20.66,54,215
jewelry,Montres connectées,Montre intelligente de moniteur d'activité,43.8,83.42,48,53
jewelry,Bracelets pour homme,Bracelet en cuir tissé rétro,12.84,24.23,47,56
jewelry,Bracelets pour homme,Bracelet Vintage multi-couches punk,11.73,24.54,52,29
jewelry,Bracelets pour homme,Bracelet d'énergie magnétique d'affaires ,20.82,39.67,48,278
jewelry,Montres pour femme,Montre analogique décontractée pour femme,22.53,43.8,49,104
jewelry,Montres pour homme,Montre à quartz calendrier de style d'affaires ,43.8,88.74,51,62
jewelry,Boucles d'oreilles,Goutte d'oreille fleur papillon rétro or,9.59,21.98,56,149
jewelry,Boucles d'oreilles,Boucles d'oreilles Cercle Tendance ,5.09,10.19,50,39
jewelry,Colliers,7 Chakra Moon Pendentif Colliers,15.47,27.4,44,310
jewelry,Colliers,Collier à pampilles à fleurs ethniques,16.11,28.95,44,274
jewelry,Boucles d'oreilles,Punk Barbell Skull Stud Boucles d'oreilles,6.11,11.75,48,52
jewelry,Bracelets pour homme,Bracelet en cuir véritable,19.37,37.25,48,69
jewelry,Bracelets,Bracelet de charme féminin Bracelet en strass de perles de bohème,8.2,15.24,46,198
jewelry,Boucles d'oreilles,Boucles d'Oreilles Punk Rivets Unisexe,6.11,11.53,47,243
jewelry,Montres pour femme,Montre bracelet à fleurs sculptées,21.99,43.98,50,1
jewelry,Boucles d'oreilles,Boucles d'oreilles Masque,5.74,9.99,43,21
jewelry,Porte-clefs & Décoration,Porte-clés en cuir de tête de léopard de luxe,25.08,45.95,45,87
jewelry,Sets de bijoux,Ensemble de boucles d'oreilles élégant pour cheveux,18.47,39.96,54,176
jewelry,Montres pour homme,Montre vintage punk rétro à bracelet en cuir cadeau pour homme,19.45,34.94,44,479
jewelry,Bracelets,Bracelet en alliage tendance,9.59,22.15,57,116
jewelry,Bracelets,Ensemble de pendentif strass ,2.8,20.39,86,39
jewelry,Montres pour femme,Montre avec Bracelet Multirang Tressé en Cuir PU,14.4,26.88,46,967
jewelry,Colliers,Collier pendentif coquille d'ormeau,12.99,0,0,20
jewelry,Montres pour homme,LED Montre en alliage chrono à compte à rebours,25.08,45.07,44,54
jewelry,Boucles d'oreilles,Boucles d'oreilles élégantes,16.54,31.5,48,92
jewelry,Bracelets,Bracelets multicouches de Bohème,6.72,13.44,50,160
jewelry,Bracelets pour homme,Bracelets en perles de dragon vintage,8.52,18.62,54,129
jewelry,Montres pour homme,SKMEI Men's Montre à quartz créative,48.08,93.44,49,196
jewelry,Colliers,Collier de Rotation Or à Pendentif Sablier,9.59,20.25,53,1471
jewelry,Montres pour femme,Montres ethniques de crâne de bracelet des femmes,11.73,21.1,44,315
jewelry,Bagues,Yueyin Anneau doux en tissage coeur Anneau plaqué argent,9.2,18.44,50,74
jewelry,Colliers,Collier pendentif à fleurs ethniques Rectangle,19.75,36.18,45,163
jewelry,Bagues,Ensemble de 7 bagues vintage,12.35,24.71,50,97
jewelry,Bagues,Ensemble de bagues géométriques turquoises,10.66,20.31,48,186
jewelry,Bagues,Bague Octopus Géométrique Vintage,5.85,16.96,66,108
jewelry,Bagues,Bagues à Diamants Ajourées,16.54,32.72,49,56
jewelry,Bagues,Ensemble d'anneaux de feuilles de flèche,6.5,24.99,74,7
jewelry,Bagues,Ensemble de boucles d'oreilles chat,9.99,19.99,50,2
jewelry,Boucles d'oreilles,Veste d'oreille strass Bohème,11.73,21.49,45,174
jewelry,Boucles d'oreilles,Feuilles Tendance Ear Drop,9.59,20.67,54,222
jewelry,Boucles d'oreilles,Boucles d'oreilles vintage,9.59,20.25,53,82
jewelry,Accessoires,Cravate Bolo Vintage Réglable,15.04,28.64,48,75
jewelry,Boucles d'oreilles,Stud à l'oreille coloré de Ziron,15.04,28.64,48,250
jewelry,Montres connectées,Montre intelligente rectangulaire avec moniteur d'activité,69.5,132.38,48,90
jewelry,Bracelets pour homme,Bracelet Vintage Turquoise,19.75,37.62,48,114
jewelry,Bracelets,Bracelet ethnique tissé à la main de pierre biliaire noire,5.85,18.64,69,100
jewelry,Montres connectées,Montre intelligente de moniteur d'activité,69.07,128.98,46,91
jewelry,Boucles d'oreilles,Boucles d'oreilles à la mode ,6.11,12.22,50,136
jewelry,Montres connectées,Montre intelligente colorée de sport,156.25,338.2,54,27
jewelry,Boucles d'oreilles,Boucles d'Oreilles Rétro Grandow Rondes,10.23,22.33,54,111
jewelry,Boucles d'oreilles,Boucles d'oreilles rétro Colorful avec diamants ,10.23,22.33,54,67
jewelry,Boucles d'oreilles,Clou d'oreille de fleur noire creuse ,6.17,12.35,50,85
jewelry,Colliers,Collier pendentif boussole multicouche,8.52,18.63,54,154
jewelry,Montres pour femme,Montres-bracelets à quartz,44.87,89.74,50,64
jewelry,Colliers,Collier vintage charmant à pendentif de 7 chakras,15.47,27.85,45,157
jewelry,Bracelets,Bracelets de charme de coeur d'acier inoxydable,30.44,55.83,46,199
jewelry,Colliers,Collier de fleurs de zircon coloré de luxe,33.65,61.64,45,147
jewelry,Bracelets,Bracelet Arbre de Vie Vintage,11.73,21.07,44,458
jewelry,Bracelets,Bracelet à perles de 8mm de guérison bonne chance,9.31,19.38,52,348
jewelry,Colliers,Collier élégant pour femme Collier pendentif en strass,11.21,20.4,45,206
jewelry,Boucles d'oreilles,Boucles d'oreilles Élégantes Doux Ballon Votif Verre D'étoiles Avec Fleur Rose Pour Femme,8.52,17.91,52,1524
jewelry,Colliers pour homme,Collier Vintage Vintage Pendentif Naturel Obsidienne Naturel à l&#39;Éléphant,19.78,36.62,46,161
jewelry,Bracelets pour homme,Bracelet à chaîne en acier inoxydable Punk,18.1,31.35,42,213
jewelry,Montres pour homme,Montres à quartz calendrier étanche,11.24,29.98,63,2
jewelry,Boucles d'oreilles,Boucles d'oreilles irrégulières en peau de serpent ,7.46,12.99,43,14
jewelry,Bagues pour homme,Anneau en croix en acier titane,12.35,24.72,50,99
jewelry,Montres pour femme,YAZOLE Luxury Diamond Montres en or,34.72,63.6,45,84
jewelry,Bracelets, Ensemble de pendentif flèche en métal,10.66,25.39,58,80
jewelry,Colliers,Collier multicouche à pampilles en métal,6.5,24,73,4
jewelry,Bracelets,Bracelet opale en forme de chat,3,11.98,75,10
jewelry,Montres pour femme,Montres en cuir à la mode de quartz,43.37,82.6,48,95
jewelry,Colliers,Collier de couples de chats mignons,6.93,12.82,46,516
jewelry,Montres pour homme,Montre Sport Homme Numérique,32.58,62.06,48,79
jewelry,Colliers,Collier rétro fleur de soleil libellule,17.61,34.94,50,77
jewelry,Montres pour femme,Montre à quartz à la mode pour femmes,12.37,23.56,48,279
jewelry,Boucles d'oreilles,Boucles d'oreilles en cristal de fleurs colorées,11.03,20.99,48,135
jewelry,Colliers,Thriller humain Luminou Collier,7.13,13.2,46,440
jewelry,Colliers,Collier Ethnique Rétro Vintage Ornés De Jage Et Perles,19.19,34.46,44,334
jewelry,Montres pour homme,MEGIR Montres militaires de luxe pour hommes,86.69,176.92,51,103
jewelry,Colliers pour homme,Collier en cuir vintage en alliage fait main en cuir,11.54,21.12,45,716
jewelry,Bagues,10pcs Bague Unique Vintage Ethnique Anneau D'articulation Avec Pièce,8.52,17.23,51,4006
jewelry,Bagues,Anneau d'orteil de symbole de paix d'amour,6.11,11.53,47,331
jewelry,Bagues,Bague ethnique en argent en forme de paon,9.59,20.25,53,274
jewelry,Bagues,Bague de luxe en cristal ,18.25,34.76,48,141
jewelry,Bagues,Ensemble de bagues papillon rétro feuilles,9.05,18.55,51,179
jewelry,Bagues,Ensemble de bagues strass géométriques,8.15,16.31,50,172
jewelry,Bagues,Geometric Bird Bee Anneaux Set,10.66,25.39,58,82
