category,subcategory,name,current_price,raw_price,discount,likes_count
jewelry,Boucles d'oreilles,Boucles d&#39;oreilles à 2 boucles d&#39;oreille Sweet Style,9.71,18.33,47,254
jewelry,Bijouterie DIY,1PCS DIY Crystal 90-120mm Natural Obsidian Crystal,10.68,19.56,45,115
jewelry,Bijouterie DIY,100g Bricolage Cristal Belle Radiante Opale Cristal Particules Pierres Cristal,10.39,19.6,47,111
jewelry,Bijouterie DIY,100g DIY Crystal Natural Dong ling Jade Gravel Crystal Stone,8.56,17.63,51,160
jewelry,Bijouterie DIY,100g DIY Crystal Natural Black Tourmaline Crystal Rough Stone,5.8,10.74,46,102
jewelry,Bijouterie DIY,60mm Bricolage Grand Loupes En Bicolore Lentilles De Dôme Semi Cristal,9.89,19.03,48,71
jewelry,Mascarade & Cosplay,Masque sexy masque en dentelle noire,10.53,19.14,45,256
jewelry,Coffrets & Sacs de bijoux,Punk Watch Box Black Clear Watch Case,10.76,20.7,48,77
jewelry,Fine Copper,Boucles d&#39;oreilles en fleurs 925 Sterling Silver,9.95,19.42,49,242
jewelry,Bijouterie DIY,1pc Cristal Cristal Pierre,8.52,17.56,52,91
jewelry,Bijouterie DIY,Cristal de rubis naturel Ovale Moissanite,7.44,15.34,52,90
jewelry,Bijouterie DIY,50g bricolage cristal naturel pierres,6.11,11.53,47,126
jewelry,Bracelets de couple,Bracelet Punk De Cuir De Cuir En Cuir PU,6.81,12.38,45,622
jewelry,Broches et épingles,Broche papillon en alliage strass,9.71,18.69,48,212
jewelry,Broches et épingles,Broche élégante en strass en cristal Rose Flower Rose,7.74,14.33,46,287
jewelry,Présentoirs de bijoux,Boucles d'Oreilles Collier Boucles d'Oreilles,6.11,11.53,47,222
jewelry,Montres pour homme,Petite montre à quartz à trois points,41.24,109.98,63,0
jewelry,Montres pour femme,Montre Bracelet Fleurs Feuilles,28.99,57.98,50,3
jewelry,Bracelets,Bracelet tresse torsadée lumineuse laser,10.99,17,35,3
jewelry,Boucles d'oreilles,Boucles d'oreilles masque goutte d'eau,8.04,12.99,38,4
jewelry,Bracelets de cheville,Bracelet de cheville multicouche à pompon,7.34,15.22,52,20
jewelry,Boucles d'oreilles,Boucles d'oreilles géométriques ananas,8.49,16.49,49,4
jewelry,Coffrets & Sacs de bijoux,Ensemble bac à rangement à bijoux 100 Slots Velvet,11.41,19.79,42,174
jewelry,Boucles d'oreilles,Goutte élégante de boucles d'oreilles de perles ,10.66,20.72,49,83
jewelry,Boucles d'oreilles,Boucles d'oreilles fleur du soleil de Bohême,8.52,18.63,54,84
jewelry,Bracelets pour homme,Bracelet tissé de style décontracté,15.29,30.58,50,35
jewelry,Bijouterie DIY, Outil de pince de bijoux de coupe 1PC,6.11,12.24,50,53
jewelry,Montres connectées,Montre intelligente GPS intégrée,64.25,123.55,48,18
jewelry,Bracelets de cheville,Cheville dames perlées bohème,9.59,20.66,54,186
jewelry,Montres pour homme,Montre homme quartz,26.51,51.98,49,22
jewelry,Boucles d'oreilles,Boucles d'oreilles fleurs stéréoscopiques en résine vintage ,14.4,32.42,56,32
jewelry,Boucles d'oreilles,Boucles d'oreilles longues plumes ,9.59,22.15,57,33
jewelry,Porte-clefs & Décoration,Punk Keychain Porte-clés,10.11,20.04,50,17
jewelry,Montres pour homme,STRYVE Sport Digital Quartz Montres,50.99,99.98,49,30
jewelry,Boucles d'oreilles,Boucles d'oreilles fleur vintage,8.52,18.62,54,56
jewelry,Bijouterie DIY,Échantillon de minéraux à base de spécimen de cristaux de lapis Lazuli à cristaux liquides de 50g,5.81,10.96,47,134
jewelry,Montres pour homme,Montre-bracelet numérique à quartz sport,72.41,144.82,50,29
jewelry,Bracelets de cheville,Bracelet de cheville à pompon en coton,6.5,24.99,74,7
jewelry,Bracelets de cheville,Bracelet de cheville multicouche à pompon,5.5,21.99,75,1
jewelry,Bracelets de cheville,Bracelet de cheville multicouche tissé,6,22.99,74,3
jewelry,Boucles d'oreilles,Boucles d'oreilles strass fleur de Bohème,7.59,16.46,54,99
jewelry,Montres pour homme,Montre à quartz calendrier en cuir,41.65,78.18,47,80
jewelry,Colliers,Maman dans les colliers de coeur,15.9,30.58,48,119
jewelry,Boucles d'oreilles,Boucles d'oreilles perles colorées,10.23,20.66,51,142
jewelry,Boucles d'oreilles,Boucles d'Oreilles Pierre Style Long Bohème ,10.7,21.23,50,36
jewelry,Bagues de couple,Bague Sweet Couple KISS &amp; LOVE Zircon Bague élégante pour femmes Hommes,10.46,20.65,49,23
jewelry,Boucles d'oreilles,Boucles d'oreilles de Noël papillon,9.82,19.99,51,209
jewelry,Colliers,Collier multicouche à verrouillage en métal,6.5,24.99,74,4
jewelry,Colliers,Collier papillon 3PCS,5.5,21.99,75,1
jewelry,Porte-clefs & Décoration,Porte-clé de voiture en métal à la mode,5.7,10.76,47,16
jewelry,Boucles d'oreilles,Boucles d'oreilles pendantes rondes creuses ,9.19,13.33,31,16
jewelry,Colliers, Ensemble de collier serpent en métal ,10.49,20.99,50,12
jewelry,Boucles d'oreilles,Manchette d'oreille aile avec glands Punk Skull ,8.15,15.68,48,208
jewelry,Boucles d'oreilles,Boucles d'oreilles glands de bronze rétro,11.73,22.8,49,123
jewelry,Montres connectées,V7 Dialog Camouflage Strap Montres intelligentes,71.39,137.29,48,14
jewelry,Montres pour femme,Montre à quartz,19.32,34.73,44,182
jewelry,Porte-clefs & Décoration,Porte-clés voiture chapeau punk rétro,6.11,11.2,45,32
jewelry,Fine Copper,Boucles d'oreilles pattes de chat mignonnes en argent 925,8.15,16.3,50,118
jewelry,Broches et épingles,Broche de tortue strass mignonne,12.37,22.73,46,141
jewelry,Boucles d'oreilles,Boucle d'oreille élégante de mode,13.32,25.38,48,58
jewelry,Bracelets de cheville,Boho perles pendentif pièce de monnaie,11.3,20.3,44,159
jewelry,Bracelets,Bracelets de perles de bohème,16.11,30.68,48,75
jewelry,Bijouterie DIY,80mm Crystal Ball Grand Magnifying Glass Paperweight Dome Semi Crystal Ball,14.32,27.54,48,50
jewelry,Bagues de couple,Couple anneau doux anneau en zircon en acier inoxydable pour hommes femmes,8.95,18.32,51,91
jewelry,Bracelets,Bracelet Coeur Lumineux Doux,9.16,22.71,60,187
jewelry,Broches et épingles,Sweet Swan Silver Broche,11.82,23.64,50,105
jewelry,Montres pour homme,Montres Business Quartz,81.59,163.19,50,10
jewelry,Boucles d'oreilles,Boucles d'Oreilles Retro Elephant Palm ,9.05,21.35,58,53
jewelry,Boucles d'oreilles,Boucles d'oreilles Sky style rétro étoilé,10.23,20.66,51,66
jewelry,Accessoires des cheveux,Pince à cheveux tendance bouton pied de poule,6.11,11.99,49,48
jewelry,Montres pour femme, Mode Style Cristal Femmes Poignet Watc,16.31,31.98,49,69
jewelry,Boucles d'oreilles,Boucles d'oreilles turquoise en métal avec incrustations de plumes,7.44,19.92,63,40
jewelry,Boucles d'oreilles,Clous d'oreilles en forme de lune pentacle,8.52,17.92,53,622
jewelry,Boucles d'oreilles,Boucles d'oreilles Bohémiennes Pendants d'oreilles à Pampilles et Perles,6.11,11.21,46,69
jewelry,Colliers,Colliers à breloques en bois Vintage Rectangle,15.29,29.98,49,128
jewelry,Boucles d'oreilles,Boucles d'oreilles ethniques à franges,9.59,20.08,52,153
jewelry,Bracelets,Bracelet simple serti de perles de Bohême,11.82,27.52,57,87
jewelry,Accessoires des cheveux,Pince à cheveux élégante avec dossier Word,7.13,16.21,56,86
jewelry,Bijouterie DIY,Bricolage 24Pcs Candy Color Plastic Christmas Tree Boucles d&#39;oreilles Bijoux,5.37,9.75,45,78
jewelry,Porte-clefs & Décoration,Punk Guitar Crystal KeyChain,11.21,21.55,48,88
jewelry,Bracelets,Bohemian 4PCS Sun Bracelet Set,12.37,23.1,47,123
jewelry,Bracelets de cheville,Bracelet de cheville rétro conque Yoga,9.26,18.9,51,72
jewelry,Montres pour homme,Montre à quartz squelette creuse,25.08,45.07,44,139
jewelry,Bracelets de cheville,Perles de cheville de tortue de Bohême,8.52,18.62,54,237
jewelry,Montres pour femme,Montre étoilée Sky à quartz,26.16,49.82,48,258
jewelry,Boucles d'oreilles,Goutte d'oreille de flocon de neige de mode ,9.59,20.61,54,474
jewelry,Montres pour homme,Montre numérique à double affichage pour hommes,34.99,73.22,52,32
jewelry,Bracelets de cheville,Boho Hématite perle cheville,9.59,19.21,50,75
jewelry,Bijouterie DIY,12 Modèles de moules Silicone Moule Résine DIY Pendentif Bijoux Outils Accessoires,8.97,17.25,48,387
jewelry,Bijouterie DIY,DIY Transparent Acrylique Bouddha Stupa Tibet Bouddhiste Décoration,11.59,21.46,46,53
jewelry,Colliers,Collier Pandent en 925 Sterling Silver Sunshine Letter,16.12,28.96,44,84
jewelry,Bracelets,Bracelet en bois multicolore Bracelet en béton de la Bohème,7.13,13.25,46,85
jewelry,Bracelets,Bracelet manchette ajustable doux,9.78,19.56,50,93
jewelry,Bijouterie DIY,Bricolage Bijoux Belle Amber Fossile Insect Centipede Amber,14.91,27.61,46,100
jewelry,Bracelets,Bracelet en 7 couleurs à perles d'équilibre chakra,9.59,19.87,52,410
jewelry,Bracelets,Bracelet Turquoise Blanche Style Ethnique,8.52,18.62,54,84
jewelry,Boucles d'oreilles,Boucles d'oreilles longues bohémiennes ,15.47,29.47,48,43
jewelry,Boucles d'oreilles,Boucles d'oreilles à tête de tigre exagérées,10.7,26.51,60,39
jewelry,Boucles d'oreilles,Clous d'oreilles en acrylique acrylique,11.54,20.77,44,9
jewelry,Montres pour femme,Montre à quartz sans numéro,9.99,21.98,55,0
jewelry,Bracelets,Colliers de bracelets perlés multifonctions,11.73,21.9,46,171
jewelry,Montres pour femme,Montre-bracelet à la mode ,15.47,29.46,48,74
jewelry,Bracelets de cheville,Cheville turquoise bohème,8.58,18.75,54,239
jewelry,Boucles d'oreilles,Boucles d'oreilles pompon perles de riz ,9.59,28.06,66,66
jewelry,Boucles d'oreilles,Boucles d&#39;oreilles boucles d&#39;oreilles,9.08,17.73,49,285
jewelry,Boucles d'oreilles,Ensemble de bijoux Vintage Ear Drop Stud,5.7,10.2,44,68
jewelry,Boucles d'oreilles,Pendentif tessin vintage losange,10.19,20.38,50,86
jewelry,Montres pour femme,Montres à quartz,18.35,36.7,50,64
jewelry,Boucles d'oreilles,Clip oreille rond ouvert doux,9.59,20.66,54,117
jewelry,Boucles d'oreilles,Boucles d'oreilles montées à la mode,9.59,20.66,54,249
jewelry,Boucles d'oreilles,Boucles d'oreilles en métal avec strass,7.44,21.58,66,21
jewelry,Bagues,Yueyin Sweet Ring Flower Zircon Women Ring,11.75,21.94,46,69
jewelry,Bagues,Bague de luxe pour femme Bague spéciale à zircon plein,11.3,20.78,46,57
jewelry,Bagues,Bague tête de cerf perle élégante,7.74,15.48,50,100
jewelry,Montres pour homme,Montres à la mode pour hommes ,50.99,101.99,50,16
jewelry,Bagues,Ensemble de bague ethnique en argent,7.5,16.69,55,66
jewelry,Bagues de couple,Doux Anneau de couple Zircon Bague en or argenté pour femme Hommes,10.2,20.2,50,84
jewelry,Bracelets de cheville,Boho Turtle cheville,8.52,17.56,52,370
jewelry,Boucles d'oreilles,Boucles d'oreilles goutte d'eau de mode ,9.67,19.33,50,242
jewelry,Colliers,Collier pendentif tendance léopard punk,8.76,18.35,52,27
jewelry,Bracelets,Bracelet Bohemian Femmes Bracelet Multicouches Multicouches,9.16,18.95,52,83
jewelry,Bijouterie DIY,1 Pcs Silicone Moule Rhombus / Drop Moules,7.13,13.71,48,104
jewelry,Boucles d'oreilles,Boucles d'oreilles papillon strass perle,22.56,41.86,46,19
jewelry,Montres connectées,Montre S3 Smart Heart Rate,115.29,230.58,50,43
jewelry,Bijouterie DIY,Accessoires Boucles d'oreilles Ore,6.99,13.98,50,0
jewelry,Broches et épingles,Broche Rainbow Love Femme,4.99,9.98,50,1
jewelry,Broches et épingles,Broche de pont arc-en-ciel,4.99,9.98,50,0
jewelry,Boucles d'oreilles,Little Bee Boucles d'Oreilles Femme,4.99,9.98,50,2
jewelry,Colliers,Collier à pendentif goutte turquoise,11.99,23.98,50,1
jewelry,Boucles d'oreilles,Boucles d'oreilles femmes feuilles,5.99,11.98,50,1
jewelry,Montres pour homme,Montres homme à trois yeux,31.49,83.98,63,0
jewelry,Montres pour homme,Montres Homme Double Cadran,34.49,91.98,63,0
jewelry,Montres pour homme,Montres hommes étanches lumineuses,31.49,83.98,63,0
jewelry,Montres pour femme,Montre Bracelets Femme Imperméable,24.99,49.98,50,0
jewelry,Montres pour homme,Montres homme en maille ajustable,9.74,25.98,63,0
jewelry,Bracelets de cheville, Bracelet de cheville multicouche en perles de riz,9.44,19.26,51,12
jewelry,Bracelets,Bracelet multicouche aile d'éléphant,6.5,24.99,74,0
jewelry,Colliers,Ensemble de collier à découpes de flammes,5.5,21.99,75,1
jewelry,Colliers,Collier ange en métal,5,19.99,75,0
jewelry,Colliers,Collier Alphabet Initiale Sauvage,4,15.98,75,1
jewelry,Colliers,Colliers à pendentif année rétro,4,15.98,75,3
jewelry,Colliers,Collier multicouche pour femme pentagramme,4.5,17.98,75,0
jewelry,Boucles d'oreilles,Boucles d'oreilles cadre photo Paintings,9.99,19.98,50,0
jewelry,Boucles d'oreilles,Boucles d'oreilles femme visage humain,3.99,7.98,50,0
jewelry,Broches et épingles,Broche en métal mignon Koi,4.99,9.98,50,0
jewelry,Colliers,Collier pendentif lettre femme,9.99,19.98,50,0
jewelry,Bagues pour homme,Bague unisexe lettres d'art,7.99,15.98,50,0
jewelry,Bagues pour homme,Bague homme en alliage rectangle,5.99,11.98,50,0
jewelry,Colliers,Ensemble de 3 colliers pour femmes,13.99,27.98,50,0
jewelry,Boucles d'oreilles,Ensemble de boucles d'oreilles multi-combinaisons pour femmes,8.99,17.98,50,0
jewelry,Montres pour femme,Montres femmes sauvages,8.99,19.98,55,0
jewelry,Montres pour femme,Montre en cuir à motif arbre,8.99,19.98,55,0
jewelry,Colliers,Collier écharpe à pendentif goutte,13.59,33.98,60,1
jewelry,Colliers,Collier foulard de couleur unie,11.99,29.98,60,0
jewelry,Colliers,Collier foulard multicouche,11.19,27.98,60,0
jewelry,Colliers,Collier à pendentif colibri bleu,4.99,9.98,50,0
jewelry,Colliers,Collier pendentif femme hibou,5.99,11.98,50,0
jewelry,Boucles d'oreilles,Boucles d'oreilles femme à imprimé tournesol,6.99,13.98,50,0
jewelry,Boucles d'oreilles,Boucles d'oreilles à motifs d'art populaire polonais,6.99,13.98,50,0
jewelry,Colliers,Collier à pendentif arbre de vie,5.99,11.98,50,0
jewelry,Colliers,Collier Femme Eye Of Horus,4.99,9.98,50,0
jewelry,Colliers,Collier pendentif femme tournesol,5.99,11.98,50,0
jewelry,Boucles d'oreilles,Boucle d'oreille Halloween sorcière,7.99,15.98,50,0
jewelry,Bagues,Ensemble de 8 bagues de montage perle,4.5,17.98,75,3
jewelry,Montres connectées,Surveiller la montre intelligente bluetooth5.0,35.04,81.78,57,93
jewelry,Montres connectées,Surveillance du bracelet intelligent,18.85,40.99,54,28
jewelry,Accessoires des cheveux,Clip Banane Noeud Ruban,9.59,23.99,60,7
jewelry,Accessoires des cheveux,Bandeau fleur brodé,12.79,18.99,33,9
jewelry,Montres pour femme,Montre Femme Femme,5.59,15.9,65,621
jewelry,Colliers,JASSY® Colliers à perles géométriques,5.15,79.98,94,150
jewelry,Montres connectées,Montre intelligente de style décontracté,58.17,138.51,58,627
jewelry,Montres pour homme,Montre à Quartz Intelligente à la Mode ,58.17,439.73,87,486
jewelry,Sets de bijoux,Ensemble de bijoux européens en cristal sculpté en alliage,7.61,17.28,56,203
jewelry,Sets de bijoux,Ensemble de boucles d'oreilles collier strass cercle,7.92,18.34,57,198
jewelry,Bagues,Ensemble d'anneaux en forme de strass,8.79,21.99,60,26
jewelry,Fine Copper,Boucles d'oreilles en argent sterling 925 avec zircon,9.43,80.14,88,30
jewelry,Montres pour homme,Montre de Sport à Rotation Créative,12.59,44.22,72,599
jewelry,Montres pour homme,SKMEI Montre-bracelet professionnelle en acier inoxydable 1366,23.66,51,54,23
jewelry,Colliers,Tour de cou multi-couches en métal ,3.56,8.23,57,629
jewelry,Montres pour homme,Montre automatique mécanique en strass WEIGUAN,8.7,82.89,90,79
jewelry,Porte-clefs & Décoration,Chaussures mignonnes Porte-clés,3.92,9.23,58,102
jewelry,Bracelets,Bracelet Multi-tour Cuir Avec Trangle Hibou Ailes,6.82,17.56,61,2778
jewelry,Bagues,NFC bague intelligente unisexe en titane acier,11.34,28.36,60,689
jewelry,Montres pour homme,Montre mécanique automatique à affichage de la date ,48.95,127.48,62,72
jewelry,Bagues,Anneaux en acier inoxydable de mots musulmans de mode,0.4,13.71,97,207
jewelry,Boucles d'oreilles,Grandes boucles d'oreilles irrégulières acryliques,1.29,27.5,95,59
jewelry,Montres pour femme,Cloisonne Montre de luxe Montre à fleurs,3.77,25.18,85,101
jewelry,Montres en bague,Montre en alliage strass,2.45,9.07,73,44
jewelry,Boucles d'oreilles,Boucles d'Oreilles Bohème Secteur Glands,1.23,18.35,93,130
jewelry,Boucles d'oreilles,Boucles d&#39;oreilles en 925 Sterling Silver Green Agate,6.98,16.47,58,659
jewelry,Fine Copper,Argent 925 longue ligne d'oreille,3.77,62.72,94,65
jewelry,Accessoires des cheveux,Épingle à cheveux rétro fleur papillon,6.47,15.54,58,60
jewelry,Sets de bijoux,8 en forme d&#39;alliage d&#39;argent en cristal collier boucles d&#39;oreilles ensemble de bijoux,1.63,20.52,92,84
jewelry,Montres pour homme,"Montre intelligente d'écran couleur de 1,3 pouces",101.18,478.38,79,65
jewelry,Sets de bijoux,"Jeu de bijoux Cute Set Elephant rétro turquoise Collier Boucles d'oreilles Set {{{ Éléphant Retro Turquoise Kit, Elephant Necklace Boucles d'oreilles Bracelet Set",8.74,21,58,40
jewelry,Bracelets,Bracelet en braguette strass en papillon,8.16,20,59,184
jewelry,Bagues,Bague en silicone unisexe Fashion 8mm,0.29,15.68,98,56
jewelry,Montres pour femme,Montre à motif de carte en cuir d'alliage,4.42,9.13,52,460
jewelry,Bracelets,Bracelet en or 18 carats Magic Magic Health Care Bracelet,6.93,16.33,58,55
jewelry,Bracelets pour homme,Bracelet Vintage Nephrite Bracelet Jasper Old Jade Cylinder Men,29.2,88.47,67,25
jewelry,Colliers,Collier multicouche doux,7.67,20.66,63,1282
jewelry,Montres pour homme,BOSCK Cuir en acier inoxydable Montre mécanique,7.98,77.57,90,94
jewelry,Sets de bijoux,Ensemble de bijoux élégant Ensemble de bijoux d'opale bleue [{} }] Style: Collier Boucles d'Oreilles,7.18,16.94,58,42
jewelry,Sets de bijoux,Rétro Bijoux Set Religion Sun Ensemble Collier Boucles d'oreilles strass,5.63,13.03,57,38
jewelry,Sets de bijoux,Rétro Bijoux ensemble Éléphant rond Turquoise Boucles d'oreilles Collier Set Bracelet [{} [}] Style: Jeu de bijoux d'éléphant,8.99,20.82,57,30
jewelry,Fine Copper,Boucles d'oreilles en perles de zircon,4.35,49.15,91,75
jewelry,Colliers,Collier ethnique à la main de glands de fleurs,22.13,67.26,67,99
jewelry,Colliers,Collier pendentif tendance,5.7,14.26,60,97
jewelry,Bagues pour homme,Bague en tungstène noir pour hommes,15.5,37.25,58,83
jewelry,Bracelets,JASSY® Colorful Bracelet en cristal,5.15,51.36,90,432
jewelry,Colliers,Collier pendentif deux feuilles,4.89,11.53,58,540
jewelry,Bracelets,YUEYIN Bracelet simple Bracelet en argent plaqué en argent,6.02,13.67,56,46
jewelry,Boucles d'oreilles,Manchette d'oreille feuilles vintage,7.67,20.66,63,578
jewelry,Sets de bijoux,Ensemble de bijoux de perles de mariée de luxe,2.14,48.08,96,133
jewelry,Colliers,Antique Silver Dream Catcher Feather Necklace,2.49,5.87,58,122
jewelry,Sets de bijoux,Parures De Feuille Vintage,10.6,26.5,60,117
jewelry,Montres pour homme,REBIRTH Montres minimalistes avec bracelet en cuir doux,2.32,29.03,92,380
jewelry,Bracelets,Bracelet INALIS Simple Platinum en spirale Bracelet strass,19.91,46.07,57,36
jewelry,Colliers,Géométrie Big Crystal Ribbon Chain Chunky Necklace,5.28,12,56,29
jewelry,Bracelets,Chaussures plaqué argent Bracelet pendentif,5.55,12.62,56,132
jewelry,Sets de bijoux,Style: Ensemble de bijoux de luxe,14.83,34.99,58,55
jewelry,Bagues de couple,Bague de Couple en Acier au Titane Anneau d'amour,0.46,18.01,97,155
jewelry,Bagues,Anneau à anneaux creux en or rose,5.28,12.44,58,74
jewelry,Sets de bijoux,Ensembles de bijoux de mariée or luxe,16.41,45.96,64,52
jewelry,Colliers,Cristal Pendentif Pendentif Pendentif,4.02,9.49,58,23
jewelry,Boucles d'oreilles,S925 Zircone Boucles d'oreilles,6.57,23.73,72,57
jewelry,Bagues,Anneau de zircon de cuivre luxueux,6.45,14.65,56,88
jewelry,Montres connectées,Montre intelligente de style branché,60.38,150.94,60,34
jewelry,Montres connectées,Montre élégante de style orange,61.19,152.98,60,49
jewelry,Broches et épingles,Broches de fleurs en cristal artisanal en bois,1.35,31.98,96,63
jewelry,Bracelets,Bracelet Bohème Femmes Bracelet Pendentif en Cristal,5.27,12.84,59,317
jewelry,Boucles d'oreilles,Boucles d'oreilles ethniques,8.15,24.46,67,167
jewelry,Zinc Alloy,Anneaux de noeud Vintage Infinity,7.95,27.44,71,103
jewelry,Bracelets pour homme,Punk Health Magnetic Titanium Bracelet,6.34,14.39,56,113
jewelry,Colliers pour homme,8mm Black Lava Stone Tibet Bouddhiste 108 Collier de perruques de prière,7.17,17.22,58,249
jewelry,Montres pour femme,Montre pendentif cristal femme,8.15,19.23,58,90
jewelry,Colliers,Collier pendentif en coquille de Bohême,10.19,20.39,50,48
jewelry,Bagues,Yueyin Sweet Ring Heart Zircon Crown Ring pour cadeau féminin,5.3,12.27,57,133
jewelry,Bracelets,YueYin® Infinity Symble Bracelet en zircon plaqué argent pour cadeau féminin,8.02,21.61,63,34
jewelry,Accessoires des cheveux,Retro épingle à cheveux épingle à cheveux,6.17,14.82,58,112
jewelry,Bracelets,YUEYIN Bracelet élégant Bracelet en argent sterling plaqué or 8,6.02,13.66,56,36
jewelry,Montres pour homme,Punk multicouche Bracelet Montres,9.99,27.44,64,417
jewelry,Boucles d'oreilles,Boucles d'oreilles glands ethniques,7.95,25.5,69,136
jewelry,Montres pour femme,REBIRTH Montres en cuir de mode,2.9,32,91,95
jewelry,Colliers,Collier rétro ethnique Collier vintage Jade Collier,9.78,22.66,57,96
jewelry,Montres connectées,Montre intelligente de podomètre de Bluetooth GSM,27.74,71.39,61,546
jewelry,Boucles d'oreilles,Jolies boucles d'oreilles en perles de cristal,0.66,15.98,96,95
jewelry,Accessoires des cheveux,Perle One Pince à cheveux Word,4.11,10.29,60,54
jewelry,Montres pour homme,Montre en cuir vintage,40.76,99.93,59,41
jewelry,Bagues,3Pcs Hollow Cross Stack Knuckle Rings,2.48,5.85,58,47
jewelry,Bagues,Bague unisexe drôle,5.7,13.71,58,131
jewelry,Bracelets,Bracelets de cravate de cheveux de mode,4.59,18.34,75,44
jewelry,Colliers,Collier Steampunk Gear Wings,1.23,27.51,96,267
jewelry,Montres pour femme,Montre Vintage à Fleurs pour Fille,1.28,19.31,93,319
jewelry,Colliers,Collier pendentif tibétain Turquoise Owl,6.81,15.75,57,59
jewelry,Sets de bijoux,Ensemble de bijoux en cristal Pendentif en cristal,7.53,17.11,56,35
jewelry,Bagues,Style d&#39;équilibrage Anneau d&#39;alliage doux Anneau carré de perles colorées,5.03,12.34,59,57
jewelry,Colliers,Chaîne de chandail de Bohème Tassel longue,5.23,14.36,64,76
jewelry,Bracelets,JASSY Bracelet Turquoise Noir Plaqué Or,10.19,38.75,74,153
jewelry,Colliers,Collier goutte d'eau colorée à la mode,6.81,27.15,75,38
jewelry,Colliers,Collier écharpe ethnique Options de couleurs multiples,13.61,54.23,75,76
jewelry,Colliers,Collier pendentif Hsiuyen Jules,11.6,63.45,82,55
jewelry,Sets de bijoux,Style: Sweet,5.65,20.9,73,92
jewelry,Bracelets,Bracelets élégants de manchette de bowknot,5.87,19.56,70,63
jewelry,Sets de bijoux,Ensemble de bijoux Penadnt,10.6,26.5,60,77
jewelry,Colliers,"Collier, Ren en acier inoxydable Collier unisexe",4.7,11.26,58,46
jewelry,Fine Copper,Boucles d'Oreilles Géométriques en Argent 925,4.06,50.98,92,77
jewelry,Colliers,Bohemian Carve Flower Pattern Alloy Choker Collier,6.3,15.18,59,464
jewelry,Accessoires des cheveux,Accessoires de cheveux Metel élastique de broderie,2.45,15.38,84,111
jewelry,Accessoires des cheveux,Pince à cheveux en feuille d'érable,6.11,11.31,46,292
jewelry,Colliers,Boucles d'oreilles pendentif vintage,7.67,20.66,63,157
jewelry,Colliers,Collier de fleurs occasionnels femmes,13.86,48.94,72,115
jewelry,Boucles d'oreilles,Boucles d'oreilles serpent déclaration,0.73,15.78,95,151
jewelry,Boucles d'oreilles,S925 Boucles d'oreilles en zircone,6.45,17.14,62,73
jewelry,Porte-clefs & Décoration,Coeur famille maman père fille fils KeyChain,2.62,6.42,59,22
jewelry,Bagues,Bague en Acier Inoxydable Effet Dents de Scie,8.26,21.97,62,98
jewelry,Boucles d'oreilles,Boucles d'oreilles Vintage Dream Net,8.97,22.42,60,70
jewelry,Montres connectées,Montre intelligente de Bluetooth de podomètre,10.88,95.87,89,111
jewelry,Accessoires des cheveux,Vintage Luxury Hairpin Tassel Rhinestone Flower Hair Accessoires,8.17,18.89,57,75
jewelry,Colliers,S925 collier de perles de perles de perles en argent,9.08,20.66,56,31
jewelry,Bagues,Bagues Multifonctionnelles Fashion Smart,31.49,78.72,60,43
jewelry,Colliers,Collier de famille en acier inoxydable,11.09,26.65,58,82
jewelry,Montres pour femme,Montre de style de la mode diamant femmes ,32.63,78.44,58,30
jewelry,Montres pour femme,Montre de luxe en acier inoxydable ultra-mince,6.38,94.42,93,90
jewelry,Colliers,Punk Collier Clavicule Ras De Cou Chaîne En Dacron Pour Femme,5.7,13.71,58,254
jewelry,Bracelets,Bracelets de feuilles de cristal Bracelets de palmiers,6.52,15.98,59,538
jewelry,Bracelets,Bracelet de femmes de luxe en tissage Bracelet simple plaqué argent,8.1,19.09,58,44
jewelry,Montres connectées,Montre intelligente de soins de santé,28.79,71.99,60,2
jewelry,Sets de bijoux,Ensemble de bijoux pendentif déclaration,12.23,30.58,60,67
jewelry,Montres couple,Montres numériques de mode,14.28,55.98,75,22
jewelry,Boucles d'oreilles,Stud à la mode perle étoile d'oreille,5.95,22.58,74,405
jewelry,Montres connectées,Montre intelligente de miroir de sport,63.64,159.1,60,29
jewelry,Colliers,Style: Collier unisexe,28.58,88.24,68,58
jewelry,Bracelets,Bracelet en géométrie simple Rectangle creux Bracelet simple pour cadeau féminin,7.23,16.42,56,30
jewelry,Colliers,Collier de bavette en métal à bords courbés Slim Curved,5.4,12.74,58,92
jewelry,Boucles d'oreilles,Boucles d'oreilles Feuilles Spirales Exagérées,3.57,13.71,74,319
jewelry,Boucles d'oreilles,Boucles d'Oreilles Cristal Carré Fashion ,4.28,13.71,69,95
jewelry,Bagues,Vintage Alloy Crystal Cross Stripes Ring,4.06,9.77,58,232
jewelry,Sets de bijoux,Ensemble de bijoux pendentif déclaration,11.9,29.76,60,81
jewelry,Bracelets pour homme,Bracelet Mode Homme d'affaires,23.66,59.14,60,35
jewelry,Fine Copper,Manchette d'oreille en argent sterling avec zircon,6.24,49.05,87,78
jewelry,Boucles d'oreilles,Boucles d'oreilles de luxe Phoenix perle,44.06,101.98,57,32
