category,subcategory,name,current_price,raw_price,discount,likes_count
kids,Chaussettes,Coton Kawaii Kids Chaussette Pour 2Y-10Y,7.22,22.72,68,294
kids,Salopettes & Combinaisons,Barboteuse bébé garçon nouveau-né d'été pour 0-36M,15.99,32.99,52,124
kids,Salopettes & Combinaisons,Barboteuse bébé imprimé animal pour 0-36M,15.99,36.99,57,182
kids,Brassières de grossesse,Soutien-gorge d'allaitement Soutien-gorge de maternité,13.63,42.94,68,144
kids,Maillots de bain,Ensemble de bikini à sangles pour filles style bohème Moana,11.99,28.99,59,61
kids,Costume & Jupe-culotte,2pcs / Set Toddler Girl Summer Set Pour 2Y-9Y,18.39,43.99,58,151
kids,Salopettes & Combinaisons,Polka Dot avec Ruffles Baby Girls Romper Pour 0-24M,14.43,35.28,59,67
kids,Robes,Angel Wings Girls Dress pour 1-9 ans,14.68,37.32,61,243
kids,Robes,Robe d'épaule nue pour fille,20.79,46.99,56,268
kids,Blousons & Vestes,Manteau mignonne à capuche pour enfants,21.96,55.27,60,66
kids,Robes,Motif de camouflage robes de filles droites,11.42,27.12,58,69
kids,Tops & T-shirt,T-shirt de garçons de dessin animé pour 2Y-11Y,10.6,27.47,61,51
kids,Robes,Avion Robes Décontractées Pour 1Y-6Y,13.71,31.76,57,218
kids,Salopettes & Combinaisons,2pcs filles mignonnes barboteuse + manteau pour 0-24m,21.72,60.35,64,118
kids,Costume & Jupe-culotte,Ensemble de vêtements pour filles imprimés pour 1Y-7Y,15.97,37.67,58,180
kids,Robes,Robes de dentelle blanche pour les filles,27.87,67.86,59,103
kids,Costume & Jupe-culotte,Ensemble élégant de pantalons imprimés pour enfants de Londres,35.43,72.78,51,87
kids,Pantalons & Jupes,Cool Girls Jeans Pantalon évasé,19.47,46.8,58,55
kids,Tops,Sweatshirts Broderie Fleurs Pour Filles,24.26,59.74,59,70
kids,Chaussettes,Le tube moyen de coton de bouche lâche de coton de dessin animé chaussette des chaussettes chaudes de genou d&#39;Anti-lutte pour des enfants,3.91,9.21,58,43
kids,Salopettes & Combinaisons,TUBEN Manches longues pour bébés lapins avec chaussettes rampantes barboteuses ,18.23,45.57,60,53
kids,Chaussures pour garçon,Chaussures de sport unisexes respirantes sneakers pour enfant,30.29,64.06,53,202
kids,Chaussures pour fille,Bottes courtes Girl Bowknot Cute Princess Flat Dancing Shoes,11.44,28.82,60,208
kids,Sacs à dos,Enfants toile occasionnels lunettes sac à dos sac à dos sac à bandoulière cartable voyage,12.26,30.06,59,32
kids,Chapeaux,Enfants Garçons Filles Coton Grille Mignonnes Bérets Chapeau Patch Cap Plat Casque Visière Extérieure Gorras,6.8,15.46,56,18
kids,Maillots de bain,Jolies filles maillot de bain rayé côté dentelle rayé profond plongeant,18.39,38.99,53,32
kids,Chapeaux,Chapeaux de béret de chapeau d&#39;enfants de bébé mélangés mignons de baseball de rayures de couleur mélangées de couleur,4.83,11.14,57,14
kids,Chaussures pour garçon,Unisex Kids Casual Flip Flops Softwood Beach Sandals,21.28,49.23,57,183
kids,Chapeaux,Enfants Garçons Filles Coton Mignon Béret Bonnet Motif Animal Patchwork Décontracté En Plein Air Soleil Patch Chapeau Plat,6.38,15.34,58,26
kids,Blousons & Vestes,Chemises longues à rayures simples pour filles,14.35,33.63,57,34
kids,Chaussures pour fille,Jolies chaussures bowknot de petite fille de couleur pure,8.5,18.87,55,127
kids,Colliers & Pendentifs,Collier de lapin en coton fait à la main avec dentelle,4.36,9.9,56,45
kids,Sacs à dos,1-6 ans enfants belle bande dessinée sac à dos coton crêpe Soft sac d&#39;école sécuritaire,15.8,38.72,59,31
kids,Chaussettes,Bas de collants de bas de collants de bas de bas de collants de filles d&#39;enfants ultra bas,4.15,9.61,57,63
kids,Chapeaux,Enfants Fille et Garçon Bébé Hiver Infant Crochet Tricot Chapeau Bonnet Bonnet,7.76,17.62,56,47
kids,Brassières de grossesse,Soutien-gorge d'allaitement de maternité sans fil anti-affaissement,12.79,31.98,60,6
kids,Culottes de grossesse,Culotte élastique respirante sans couture,7.99,19.98,60,1
kids,Robes,Robes Fendues Côté Fille,15.4,32.83,53,134
kids,Chapeaux,Casquette chauffante Kids Pilot,6.89,17.61,61,122
kids,Pantalons,Épaissir Sport Style Boys Pants Pour 2-11Y,18.18,42.84,58,23
kids,Costumes pour bébé,2pcs confortables ensembles de vêtements pour filles pour 0-24 mois,22.14,47.93,54,20
kids,Robes,Robe de fille de fleur en dentelle pour 0-24 mois,31.19,64.99,52,75
kids,Tops,T-shirt Rayé Fille à Volants 1Y-7Y,10.58,24.48,57,50
kids,Accessoires pour cheveux,Bandeau élastiques filles de fleurs 3d pour 0Y-5Y,4.7,14.27,67,151
kids,Tops & T-shirt,T-shirts garçons imprimés à manches courtes en coton,11.29,26.12,57,34
kids,Coutumes & Co-ords,Garçons Denim Romper Shorts pour 1Y-7Y,14.43,30.6,53,56
kids,Tops,Dessus de dentelle de patchwork de filles pour 4-13Y,21.18,44.87,53,11
kids,Robes,Robes d'été pour filles imprimées de fleurs,15.19,31.99,53,142
kids,Coutumes & Co-ords,2pcs ensembles de vêtements de garçons de dinosaures pour 1Y-7Y,17.32,42.84,60,44
kids,Tops,Hauts d'épaule pour filles pour 3Y-11Y,14.43,30.59,53,36
kids,Robes,Fleurs Princesse Robe De Princesse Pour 4Y-13Y,24.47,81.59,70,125
kids,Robes,Robes de filles de fleurs en dentelle pour 3-11Y,19.58,50.99,62,164
kids,Salopettes & Combinaisons,Stripe Girls Romper Pour 0-24M,13.47,30.59,56,117
kids,Robes,Robe patchwork à manches longues pour 3-13Y,26.63,61.19,57,46
kids,Costume & Jupe-culotte,2pcs été style filles shorts fixés pour 1Y-5Y,18.29,40.38,55,121
kids,Salopettes & Combinaisons,Dentelle fleur bébé nouveau-né barboteuse pour 0-24 m,15.4,32.32,52,184
kids,Chaussures pour fille,Soie Bowknot filles belles chaussures de sport,15.58,42.82,64,154
kids,Robes,Faux filles robe deux-pièces pour 3-11Y,15.22,38.07,60,71
kids,Tops & Tees, Hauts d'allaitement en dentelle à rayures brodées de maternité,14.68,36.7,60,25
kids,Costume & Jupe-culotte,Hauts à carreaux pour fille + pantalon à bretelles pour 2-8 ans,25.67,80.84,68,29
kids,Robes,Robe de maternité sans manches en dentelle,24.21,57.11,58,70
kids,Tops & Tees,Haut de maternité à rayures et à manches longues,20.79,50.99,59,16
kids,Robes,Sweatshirt gris robe surdimensionnée,37.55,85.75,56,127
kids,Coutumes & Co-ords,Ensembles de vêtements à carreaux pour garçons formels 4Pcs,23.99,58.99,59,73
kids,Pantalons & Capris,Pantalon évasé de maternité à taille haute,26.92,71.39,62,46
kids,Blousons & Vestes,Cartoon Fox Boys Vestes Pour 2A-9Y,28.82,58.52,51,56
kids,Coutumes & Co-ords,Ensemble d'impression de lettres de requin pour garçon pour 1-7 ans,14.39,40.99,65,12
kids,Robes,Robe décontractée à imprimé floral pour 1-9 ans,16.36,39.77,59,21
kids,Robes,Modèle fille à carreaux robe pour 2-11Y,23.1,61.19,62,46
kids,Blousons & Vestes,Veste boutonnée pour filles pour 1-5 ans,17.13,46.91,64,40
kids,Coutumes & Co-ords,Letter Print Boy Ensembles sans manches pour 1-7Y,13.86,37.73,63,43
kids,Tops & T-shirt,T-shirt en coton pur à manches courtes Lovely Lovely Baby Children Boy,8.59,19.53,56,27
kids,Costumes pour bébé,Filles 3pcs anniversaire robe tutu ensemble pour 0-24m,18.39,45.98,60,61
kids,Robes,Robe Pompon Plaid Fille Pour 3-11Y,16.31,40.78,60,56
kids,Tops & T-shirt,T-shirt Garçon Imprimé Décontracté Pour 2Y-11Y,12.73,28.56,55,36
kids,Costumes pour bébé,Ensemble de pantalons de barboteuse pour garçons pendant 0-2 ans,24.06,50.99,53,28
kids,Robes,Toddler Pageant Dresses For 3-13Y,21.94,61.19,64,79
kids,Tops & T-shirt,Bear Boys Tops Manches Longues Pour 2Y-12Y,11.06,23.97,54,134
kids,Costume & Jupe-culotte,Garçons Filles Soft Ensemble de vêtements en lin 2Y-11Y,28.87,63.24,54,208
kids,Robes,Patch Lace Filles Casual Dress 1Y-5Y,18.39,43.99,58,62
kids,Robes,Robe de mariée en tulle pailleté pour fille pour 4-13 ans,27.19,67.99,60,74
kids,Pyjamas,Vêtements de nuit d'allaitement respirants et confortables en coton,30.54,76.34,60,52
kids,Pantalons & Jupes,Pantalon fille style floral sarouel,12.51,26.52,53,47
kids,Robes,Animal Baby Girl Dress Pour 0Y-6Y,18.39,36.99,50,132
kids,Pantalons,Sport Boys Long Pants Pour 2Y-11Y,17.59,41.99,58,72
kids,Robes,Robe florale Big Bow pour filles de 3 à 13 ans,31.99,101.06,68,350
kids,Coutumes & Co-ords,3pcs vêtements formels pour garçons pour 1Y-11Y,27.74,69.86,60,184
kids,Robes,Robe de bureau pour femmes enceintes à col en V,11.99,40.79,71,32
kids,Costumes pour bébé,Ensemble de filles à col fleur pour 0-24M,25.67,80.84,68,150
kids,Brassières de grossesse,Soutien-gorge d'allaitement à boutons ouverts sur le devant,14.18,35.46,60,63
kids,Costume & Jupe-culotte,Shorts de filles en coton doux pour 1Y-7Y,18.45,58.1,68,208
kids,Tops,Motif Lion T-shirt Filles 2Y-9Y,12.51,26.52,53,33
kids,Tops,"T-shirts à capuche pour garçons, 1Y-7Y",16.36,36.72,55,54
kids,Robes,Robe longue de maternité à imprimé fleuri,20.75,51,59,75
kids,Costumes pour bébé,Floral Girls Clothing Set Pour 0-24M,13.05,32.63,60,147
kids,Robes,Robe confortable style bohème filles 4Y-15Y,26.39,56.99,54,139
kids,Robes,Leisure Girls Casual Dress Pour 2Y-9Y,17.6,36.72,52,32
kids,Costume & Jupe-culotte,2pcs ensembles courts d'été de filles pour 3Y-11Y,16.36,35.69,54,62
kids,Robes,Robe décontractée pour filles de 2 à 11 ans,19.19,39.99,52,27
kids,Robes,Patch Designs Girls Décontracté Robe 2Y-13Y,16.79,34.99,52,74
kids,Robes,Robe de fille élégante à paillettes pour 4Y-15Y,44.79,93.99,52,121
kids,Costume & Jupe-culotte,2pcs pantalons pour filles à rayures 4Y-15Y,28.79,60.99,53,144
kids,Robes,Robe de broderie fille élégante 4Y-15Y,38.5,81.6,53,135
kids,Robes,Robe de soirée plissée à fleurs pour filles 4Y-12Y,35.99,75.99,53,81
kids,Brassières de grossesse,Soutien-gorge d'allaitement matelassé anti-fuite,10.6,26.51,60,22
kids,Salopettes & Combinaisons,Barboteuse Gentleman Baby Boys pour 0-24M,13.59,28.99,53,94
kids,Costumes pour bébé,3Pcs Reindeer Pattern Girls Set pour 0-24M,20.79,43.99,53,111
kids,Tops,Col montant filles chemise 2Y-9Y,11.41,30.6,63,35
kids,Imperméables,Enfant UFO Raincoat For 1Y-18Y,11.19,24.99,55,54
kids,Tops,Tassel Bottom Girls Hauts à épaules dénudées,11.54,24.47,53,87
kids,Salopettes & Combinaisons,Barboteuses à imprimé à manches courtes bébé,8.97,22.44,60,19
kids,Robes,Robe de princesse pour fille en dentelle fleurie 1Y-9Y,28.07,88.42,68,56
kids,Costumes pour bébé,Ensemble court de filles à paillettes 3 pièces pour 0M-18M,15.99,42.99,63,81
kids,Robes,Robe de princesse Big Bow Girls 1Y-9Y,22.46,42.99,48,126
kids,Salopettes & Combinaisons,Plaid Soft Barboteuse Bébé Pour 0-24M,16.84,53.04,68,164
kids,Robes,Robe de princesse bleue pour tout-petit,22.14,49.97,56,36
kids,Robes,"Robes d'été imprimées florales pour filles, 2Y-9Y",13.86,30.6,55,52
kids,Robes,Butterfly Patch Girls Dress Pour 2-9Y,19.25,40.8,53,302
kids,Robes,Toddler Girls Summer Dress Pour 1-7Y,15.19,40.99,63,70
kids,Pantalons & Jupes,Pantalon Floral pour filles de 1 à 7 ans,12.51,26.52,53,18
kids,Chaussures pour bébé,Sandales Tassel Baby Girls pour 6-24M,14.43,45.46,68,97
kids,Costume & Jupe-culotte,2pcs filles vêtements à rayures pour 1Y-9Y,18.45,58.1,68,43
kids,Accessoires pour cheveux,Bandeau de filles de boule pour 0-3 ans,3.98,13.25,70,102
kids,Robes,Robes blanches de concours pour les filles 1-7Y,26.39,72.99,64,121
kids,Pantalons,"Short de couleur unie en coton pour garçons, 2Y-9Y",18.45,58.1,68,50
kids,Accessoires pour cheveux,Flower Girls Bandeau Pour 0-3 Ans,5.76,13.25,57,108
kids,Salopettes & Combinaisons,Lion Baby Coton Barboteuse Pour 0-36M,14.42,30.59,53,28
kids,Salopettes & Combinaisons,Ensemble de maillots de bain à paillettes pour filles 0-24M,16.79,35.99,53,100
kids,Pantalons,Shorts de couleur unie garçons pour 2Y-11Y,15.39,32.64,53,21
kids,Pantalons,Pantalon doux de carreaux de garçons de coton pour 2-9Y,12.4,26.52,53,31
kids,Robes,Robe de fille de fleur d'épaule unique pour 6-24M,26.95,61.19,56,104
kids,Chapeaux,Chapeau Tricoté Enfant Grenouille Pour 2Y-6Y,12.52,26.52,53,36
kids,Chapeaux,Bonnets Enfant Bonnets Écharpe Set Pour 1Y-5Y,20.79,43.99,53,64
kids,Vêtements de nuit,2pcs filles pyjamas réglés pour 4y-15y,31.77,69.36,54,69
kids,Robes,Robe de filles en dentelle fleurie pour 1Y-7Y,18.29,38.76,53,66
kids,Pulls & Sweat-shirts,Garçon Filles Épaisses Pull Pour 2Y-7Y,30.81,67.32,54,58
kids,Robes,Robes Princesse Filles Pour 3Y-11Y,34.39,71.99,52,48
kids,Robes,Soft Robe d'allaitement patchwork en coton,19.89,46.92,58,107
kids,Chaussures pour bébé,Polaire bébé chaud bottes d'hiver pour 0-18 mois,14.43,30.6,53,68
kids,Pantalons & Capris,Pantalon de maternité crayon taille élastique,27.99,88.42,68,57
kids,Costume & Jupe-culotte,Ensembles Filles Rayés Rose Pour 1-7Y,13.86,35.69,61,17
kids,Robes,Robe Pull Fille En Dentelle Patch Pour 1-5Y,21.21,57.11,63,41
kids,Costumes pour bébé,Meilleur cadeau imprimer bébé définit pour 0-2ans,15.5,39.77,61,21
kids,Chaussures pour fille,Sandales de plage avec clip floral pour filles,13.18,32.43,59,187
kids,Brassières de grossesse,Dentelle sexy lingerie de maternité,12.23,40.79,70,17
kids,Chaussures pour garçon,Garçon belle bande dessinée chaussures de sport,18.86,45.28,58,27
kids,Chaussures pour fille,Sandales à paillettes couleur pure pour filles,16.47,41.16,60,56
kids,Robes,Robe d'allaitement en coton à rayures,16.31,43.85,63,64
kids,Salopettes & Combinaisons,Gentleman Print Baby Romper Pour 0-2Y,11.42,30.59,63,27
kids,Salopettes & Combinaisons,Barboteuse pour bébé avec impression de crème glacée pendant 0 à 2 ans,12.23,30.59,60,18
kids,Robes,Robes De Fleurs Bowknot Pour 0-3 Ans,13.05,33.65,61,29
kids,Chaussures pour fille,Les filles tissent des sandales plates confortables Slingback,15.74,39.07,60,167
kids,Robes,Appliques de fleurs 3d robe de filles pour 4-15Y,21.21,57.11,63,67
kids,Coutumes & Co-ords,Tee-Shirt Imprimé Garçons Jeans Set 1Y-7Y,21.18,46.92,55,35
kids,Costume & Jupe-culotte,Combinaisons filles imprimées fleurs 1Y-7Y,16.35,36.72,56,92
kids,Robes,Patch Designs Princesse Robe De Fille 1Y-9Y,23.1,51,55,50
kids,Tops & Tees,Blouse d'allaitement confortable avant ouverte,16.42,40.79,60,50
kids,Robes,Filles ailes d'ange robe pour 2y-11y,30.7,69.36,56,50
kids,Tops & T-shirt,Garçons de dessin animé pour 2Y-9Y,18.29,38.76,53,21
kids,Salopettes & Combinaisons,Combinaison bébé épaisse et chaude pour 0-36M,24.06,50.99,53,211
kids,Pantalons & Jupes,Pantalon Fille Couleur Unie Pour 2Y-11Y,16.94,36.72,54,36
kids,Tops & Tees,Hauts d'allaitement de maternité patchwork décontractés,20.86,65.68,68,111
kids,Tops & Tees,Hauts à col rond de maternité floraux,17.29,46.08,63,44
kids,Robes,Robe de demoiselle avec feuilles de fleurs pour les 6-24 mois,25.99,55.07,53,86
kids,Robes,Robe de soirée pour filles brodée pendant 6 à 24 mois,25.99,55.07,53,31
kids,Robes,Robe de demoiselle a volants Patchwork 2-9Y,15.1,32.64,54,78
kids,Costume & Jupe-culotte,2pcs ensembles de vêtements pour filles pour 2Y-11Y,19.14,45.9,58,47
kids,Chaussures pour bébé,Toison Bébé Bottes Pour 0-12 Mois,16.36,34.67,53,22
kids,Chaussures pour garçon,Chaussures de sport sport respirant unisexe KidsMesh,16.42,42.05,61,89
kids,Salopettes & Combinaisons,Cute Fox Baby Romper Pour 0-24 mois,19.25,40.79,53,40
kids,Robes,Robe De Jupe De Ballet Pour Les Filles 2-11 Ans,14.43,30.59,53,26
kids,Robes,Costume de danse classique pour fille 2-11 ans,3.19,29.57,89,18
kids,Tops & Tees,Débardeurs Sexy à Épaules Dénudées,13.05,40.79,68,34
kids,Robes,Robe en jean avec poches et bretelles pour 4-15Y,31.77,70.37,55,71
kids,Robes,Rainbow Girls Striped Dress Pour 2-11Y,15.4,40.79,62,48
kids,Tops,T-shirt Enfant À Manches Longues Pour 2Y-9Y,11.54,25.49,55,30
kids,Coutumes & Co-ords,Ensembles de polaire en forme de dinosaure pour 1-7Y,25.99,61.19,58,30
kids,Tops,Bouton garçons épaule T-shirt pour 0-24M,15.19,30.99,51,29
kids,Robes,Robe De Ruffles Pour Filles De Noël Pour 2A-9Y,15.4,32.64,53,43
kids,Costumes pour bébé,Ensemble de barboteuse bébé 4 pièces pour 0-24M,18.39,37.99,52,84
kids,Pantalons & Capris,Pantalon large pour femmes enceintes,24.21,57.12,58,64
kids,Chaussures pour garçon,"Bottes de neige imperméables pour enfants, mi-mollet, enfants",23.47,53.34,56,59
kids,Chapeaux,Bonnet + écharpe pour enfant pour enfant de 1 à 10 ans,19.25,40.8,53,99
kids,Robes,Robe Fille Fleur Noeud Pour 1A-9A,18.93,40.8,54,41
kids,Robes,Robe Princesse Tassel Fille Pour 1Y-7Y,17.22,40.8,58,272
kids,Costumes pour bébé,Cute Pink Smile Girls Set Pour les 0 à 4 ans,16.36,34.67,53,79
kids,Chaussures pour bébé,Baby Soft Flats Premier Marcheur Pour 0-2 Ans,14.43,30.59,53,49
kids,Robes,Robe de mariée de fille de fleur de perles 4Y-13Y,27.91,61.2,54,135
kids,Chaussures pour fille,Bande Dessinée Filles Bowknot Belles Chaussures Décontractées,18.55,46.71,60,105
kids,Costumes pour bébé,Ensemble de vêtements pour garçons 2pcs pour 6-36 m,19.25,40.79,53,34
kids,Maillots de bain,Bikini mignon à volants pour filles 2-15Y,17.32,36.71,53,13
kids,Costumes pour bébé,Pink Girls Romper + Suspender Pants Set Pour les 0-3 ans,24.06,50.99,53,25
kids,Pantalons & Capris,Jupe longue plissée de maternité,32.63,91.79,65,48
kids,Brassières de grossesse,Soutien-gorge d'allaitement sans fil Grid Flower,11.24,39.77,72,19
kids,Robes,Robe de couleur unie poche de maternité lâche,20.39,51,60,14
kids,Chaussures pour fille,Unisexe Enfants Color Match Casual Chaussures,16.5,38.23,57,100
kids,Robes,Robe plissée fille à manches longues pour 2-9Y,18.76,50.99,63,85
kids,Costume & Jupe-culotte,Ensembles de jupe à fleurs pour filles pour 1-7Y,14.68,38.75,62,27
kids,Costumes pour bébé,3pcs bébé ensembles formels barboteuses pour 0-2Y,24.47,61.19,60,31
kids,Salopettes & Combinaisons,Summer Baby Strap Jumpsuit Pour 0-36M,14.68,38.75,62,59
kids,Robes,Robe de fille en velours côtelé pour 2-9 ans,13.59,31.99,58,9
kids,Sweaters & Hoodies,Chandail épais de col roulé pour tout-petit pour 2-9Y,20.79,49.99,58,12
kids,Culottes de grossesse,Culotte de maternité en coton,8.82,27.77,68,10
kids,Tops & Tees,Hauts d'allaitement rayés à fleurs multicolores de maternité,17.59,43.99,60,12
kids,Robes,Robe de princesse de mariage de fleur de fille pour 6-18 ans,28.88,90.95,68,51
kids,Robes,Robe de fille en tulle à fleurs pour fille 4-15Y,25.59,61.99,59,46
kids,Tops & Tees,Chemise d'allaitement boutonnée vintage ,20.79,54.99,62,10
kids,Robes,Robe de licornes arc-en-ciel pour fille,31.99,86.99,63,61
kids,Salopettes & Combinaisons,Barboteuses à capuche en coton fleur de bébé pour 0-24M,22.39,60.99,63,44
kids,Robes,Robe Pull à Capuche Rayée Pour Fille Pour 1-9Y,17.94,43.84,59,51
kids,Robes,Robe occasionnelle imprimée licorne pour fille pour 1-9 ans,17.13,41.8,59,54
kids,Tops,T-shirt à manches longues pour enfants de 1 à 9 ans ,9.78,26.5,63,46
kids,Robes,Robe longue de maternité à imprimé floral,18.76,43.84,57,31
kids,Robes,Robe Fleur Tutu Fille 4-13Y,22.02,55.06,60,35
kids,Pulls & Sweat-shirts,Chemise Casual Garçon Imprimé Dinosaures Pour 1-9Y,18.77,46.92,60,13
kids,Robes,Robe en tulle à tenue assortie,13.05,32.62,60,31
kids,Culottes de grossesse,Culotte taille basse en coton ,7.19,15.99,55,21
kids,Robes,Robe de Noel pour Fille 2-9ans,13.59,33.99,60,21
kids,Robes,Robe brodée filles Elk pour 2-9Y,14.39,34.99,59,13
kids,Robes,Robe Fille Tutu Licorne Pour 3-11Y,17.94,44.86,60,81
kids,Brassières de grossesse,Soutien-gorge d'allaitement sans fil anti-relâchement,8.15,20.38,60,44
kids,Costumes pour bébé,Toddler Girls 3Pcs Anniversaire Tutu Dress Set Pour 3-24 M,17.94,44.86,60,30
kids,Tops & T-shirt,Pulls mignons de garçons pour 2Y-12Y,13.05,30.21,57,104
kids,Robes,Floral imprimé filles mignonnes robes décontractées,16.32,38.4,58,47
kids,Robes,Floral Manches Longues Filles Robes Décontractées,14.68,37.42,61,65
kids,Vêtements d'extérieur & Manteaux,Cartoon Girl Hooded Jacket Pour 0-24M,23.37,48.95,52,105
kids,Vêtements de nuit,Vêtements de nuit filles mignonnes chat plaid garçons,25.31,60.86,58,124
kids,Vêtements de nuit,Pyjama Garçons Filles Imprimé Géométrique,26.87,61.06,56,72
kids,Pantalons & Jupes,Jeans de filles fraîches de fleur de broderie,18.82,45.52,59,45
kids,Pantalons & Jupes,Pantalon de jarretelles Solid Kids Girls,19.6,44.55,56,114
kids,Culottes de grossesse,Soft Culotte de maternité de couleur unie Boyshort,8.79,20.99,58,63
kids,Tops,Sweatshirts Imprimés Lettre en Dentelle Filles,20.26,49.78,59,51
kids,Chaussures pour garçon,Chaussures de sport unisexes en tricot pour enfant,21.14,46.14,54,161
kids,Chaussures pour garçon,Chaussures pour bébé nouveau-né plates et confortables,12.27,28.42,57,57
kids,Chapeaux,Casquette de baseball pour enfants avec point d'exclamation,6.46,15.75,59,13
kids,Chapeaux,Chapeau respirable de pêcheur de chapeau de boucle de protection solaire de cowboy d&#39;enfants,6.92,15.99,57,30
kids,Tops & T-shirt,ovely Owl Baby Enfants Garçon Garçon Coton À Manches Courtes Haut,8.62,20.73,58,38
kids,Tops & T-shirt,T-shirt en coton à manches courtes Little Maven Orange Lovely Car Boy en coton,9.59,21.99,56,27
kids,Tops & T-shirt,T-shirt en coton à manches courtes Lovely Baby Baby Boy,8.7,21.32,59,17
kids,Chapeaux,Chapeau de soleil enfants couleur unie béret étoiles enfants voyageant bébé bonnet de visière d&#39;été,6.76,15.37,56,29
kids,Brassières de grossesse,Ensemble de soutiens-gorge d&#39;allaitement maternel sans fil à fronces sur toute la longueur de la couverture en coton devant,11.26,28.15,60,66
kids,Robes,Cravate irrégulière en mousseline de soie robe sans manches pour enfants fille,16.31,51.71,69,459
kids,Chaussures pour garçon,Chaussures de football Tiebao Kids Breathable Firm-Ground Long Spikes,38.64,91.02,58,97
kids,Maillots de bain,Beau maillot de bain deux pièces d&#39;impression de cerise à pois doux pour des filles,16.4,41,60,20
kids,Robes,Robe imprimée à col en V sans manches et à dos noué pour les filles,11.06,25.47,57,49
kids,Chaussures pour garçon,Tiebao Chaussures d&#39;entraînement pour football en plein air antidérapantes Tiebao,20.6,47.69,57,9
kids,Chaussures pour fille,Chaussons à Slingback à la Mode et à la Mode Squishy pour Fille,14.66,33.99,57,46
kids,Salopettes & Combinaisons,Barboteuses rampantes rampantes sans manches,15.08,37.7,60,77
kids,Accessoires pour cheveux,Bébé Filles Toddler Imprimer Bohème Nœud Floral Nœud Bandeau Turban Élastique Stretc,3.62,8.47,57,88
kids,Chapeaux,Enfants Enfants Coton Camouflage Bérets Chapeaux Militaire Casquette Plate Patch Newboy Chapeaux Réglable Gorra,6.48,15.21,57,81
kids,Tops & T-shirt,Chemises blanches à manches longues pour garçons,13.6,31.52,57,12
kids,Chapeaux,Enfants Garçons Filles Dessin Animé Requin Motif Bonnet De Bain En Silicone Plongée Étanche Bonnet De Bain,5.48,13.53,60,20
kids,Chapeaux,Chapeaux de bérets à séchage rapide respirant pour enfants beaux chapeau de broderie ours motif visière en pointe,7.41,17.16,57,9
kids,Écharpes,Les filles jolies petites écharpes carrées imprimant des foulards foulards foulards Foulard ,3.98,9.21,57,33
kids,Chaussures pour garçon,Paillettes LED Luminous Children Flats,16.26,39.11,58,264
kids,Culottes de grossesse,Culotte respirante en forme de U pour hommes ,6.74,15.6,57,110
kids,Chapeaux,Bébé enfants mignon hiver chaud chapeau d'ours moelleux,6.66,14.13,53,220
kids,Chapeaux,Chapeau de dessin animé de bonnet de bonnet de bonnet de filles de bébé garçons chat mignon avec l&#39;oreille beau crochet chapeau chaud,4.67,10.62,56,12
kids,Colliers & Pendentifs,Collier pendentif en strass avec dentelle de lapin pour enfant,4.36,10.68,59,32
kids,Sacs à dos,Sac à bandoulière en toile avec sac à dos,13.68,32.26,58,45
kids,Trousses,Etui à crayons hologramme portable avec pochette pour sac de rangement,5.46,13.48,60,543
kids,Colliers & Pendentifs,Collier pendentif poupée fait main pour enfant,4.42,10.84,59,25
kids,Chaussures pour fille,Boules de poisson Sandales d&#39;été Candy Color Flats Beach Kids Chaussures causales,7.86,18.29,57,119
kids,Chaussures pour fille,Chaussures de danse plates en soie brodées avec soie pour filles,10.18,26.45,62,136
kids,Chaussures pour fille,Enfants Princesse Rivet Filles Robe Casual Mocassins,10.17,21.79,53,296
kids,Chaussures pour garçon,Kids Colorful LED Shoes Sneakers Light Up Chaussures de sport Dance Magic Tapes,58.42,135.22,57,105
kids,Accessoires pour cheveux,Bandeau bébé noeud imprimé floral léopard noeud de cheveux élastiques stretch cheveux Bande,3.72,8.45,56,38
kids,Chaussures pour fille,Girls Bowknot Casual Shoes Lovely Princess Flat Lover,14.94,34.58,57,178
kids,Sacs à main,Sac à main à bandoulière sac à bandoulière pour enfants,4.24,9.83,57,92
kids,Accessoires pour cheveux,Infant de fleurs pour enfants avec nœud papillon pour bébé,3.82,9.38,59,25
kids,Accessoires pour cheveux,Enfants Filles Rose Floral Fleur Couronne Tête De Couleurs Vives Bande,3.06,7.07,57,42
kids,Brassières de grossesse,Soutien-gorge d'allaitement sans fil Soft Sleep,15.19,37.99,60,14
kids,Costumes pour bébé,2pcs filles imprimées été court ensemble pour 6-48m,16.36,34.26,52,100
kids,Chaussures pour garçon,Chaussures à lacets en cuir à manches longues anti-collision,21.51,49.88,57,36
kids,Maillots de bain,3pcs filles halter beau bikini pour 1Y-10Y,16.1,38.72,58,206
kids,Robes,Robe d'été sans manches pour fille 0-24M,15.4,34.67,56,80
kids,Maillots de bain,Flamingo Girl Maillot De Bain Pour 2-15Y,18.29,40.79,55,37
kids,Robes,Robe à manches longues fleur bébé fille,14.68,35.19,58,65
kids,Robes,Robe de princesse longue pour fille de fleur pour 6-15Y,38.5,83.64,54,111
kids,Blousons & Vestes,Boy Devil Printemps Automne WindProof Vestes,16.83,40.72,59,83
kids,Robes,"Robes de Noël pour tout-petits, 2Y-11Y",24.06,51,53,104
kids,Costumes pour bébé,Costume à Capuche Bébé Rayé Pour 0-24M,13.86,34.66,60,13
