category,subcategory,name,current_price,raw_price,discount,likes_count
kids,Costumes pour bébé,4Pcs Girls Romper Pants Set For 0-24 mois,24.99,41.99,41,138
kids,Chaussures pour fille,Souliers Unisex Enfants Léopard,17.79,31.74,44,55
kids,Chaussures pour fille,Bottes courtes imperméables enfants unisexes,19.77,40.9,52,158
kids,Coutumes & Co-ords,Ensembles de vêtements à imprimé animal pour 1-7Y,23.06,58.1,60,60
kids,Chaussures pour garçon,Bottes de neige Fawn Cartoon unisexe pour enfants,35.01,55.3,37,68
kids,Costumes pour bébé,3Pcs Christmas Girls Set pour 0-24M,23.99,39.99,40,78
kids,Brassières de grossesse,Soutien-gorge d'allaitement pour le sommeil sans fil pendant la grossesse,16.99,30.99,45,55
kids,Robes,Robe de princesse en dentelle avec fleurs pour 2-9 ans,45.12,113.7,60,27
kids,Costumes pour bébé,Ensemble de vêtements pour enfants à rayures de 0 à 3 ans,24.99,41.99,41,56
kids,Chaussures pour fille,Chaussures plates à sequins Bling pour filles,21.33,37.5,43,133
kids,Chaussures pour fille,Filles gland décorées jolies chaussures plates,17.92,32.21,44,140
kids,Robes,Robe à bretelles bowknot pour fille de 1 à 7 ans,18.04,45.46,60,24
kids,Costume & Jupe-culotte,Combinaison sans manches à imprimé rétro pour fille pour 1-5 ans,18.04,45.46,60,15
kids,Brassières de grossesse,Soutien-gorge d'allaitement respirant ouvert sur le devant,16.04,40.41,60,23
kids,Robes,Robe d'allaitement de maternité sans manches à lacets,28.07,70.73,60,9
kids,Costume & Jupe-culotte,Ensemble de robe fleurie à manches volantées pour 1-7 ans,20.05,50.52,60,30
kids,Costume & Jupe-culotte,Costume à capuche imprimé chat pour fille pour 2-9 ans,21.05,53.04,60,33
kids,Robes,Robe Capuche Fille Pour 6-15Y,21.05,53.04,60,12
kids,Pantalons & Jupes,Survêtement en velours côtelé pour tout-petit ourson pour 1-7 ans,22.06,55.57,60,16
kids,Chaussettes,Chaussettes Coton Douces Style Rose Pour 0-18M,13.03,32.83,60,169
kids,Robes,Robe de maternité à volants avec nœuds,49.14,123.8,60,75
kids,Robes,Robe princesse à point polka pour fille de 6-36 mois,22.06,55.57,60,249
kids,Pantalons & Jupes,Pantalon de sport d'été pour enfant pour 1-5 ans,12.03,30.3,60,6
kids,Pyjamas,Pyjama imprimé voiture de dessin animé pour garçon 6-11 ans,15.99,31.98,50,8
kids,Costume & Jupe-culotte,Ensemble imprimé + combinaison pour fille de 3 pièces pour 1-7 ans,21.99,43.98,50,4
kids,Costumes pour bébé,Ensemble sans manches à imprimé bébé pour 3-18M,15.99,31.98,50,7
kids,Robes,Robe rayée à manches volantées pour fille pour 1-5 ans,19.99,39.98,50,8
kids,Brassières de grossesse,Soutien-gorge d'allaitement sans fil de maternité,21.99,43.98,50,4
kids,Costumes pour bébé,Ensemble sans manches bébé couleur unie pour 6-24M,18.99,37.98,50,6
kids,Pulls & Sweat-shirts,Sweat-shirt rayé à imprimé lettre pour garçon 2-10 ans,15.99,31.98,50,0
kids,Pulls & Sweat-shirts,Sweats à capuche épaissis à glissière pour garçon 2-10 ans,27.99,55.98,50,0
kids,Tops,T-shirt fille à imprimé fraises pour 2-10 ans,8.99,17.98,50,1
kids,Salopettes & Combinaisons,Barboteuses à imprimé fruits pour bébé pour 3 à 18 mois,17.99,35.98,50,0
kids,Sacs à dos,Sac à dos enfant 4 couleurs sac d'école bébé sac porté épaules pour garderie,15.25,17.99,15,493
kids,Écharpes,Écharpes en tricot style Noël pour enfants,16.99,28.99,41,20
kids,Costumes pour bébé,Ensemble de manches longues pour garçons 2pcs pour 0-24M,25.99,43.99,41,154
kids,Chaussures pour garçon,"Bottes de neige extérieures mi-mollets pour garçons, filles",42.31,74.05,43,35
kids,Salopettes & Combinaisons,Barboteuses bébé en molleton à capuche pour 0-24M,21.99,43.99,50,37
kids,Chaussures pour fille,Jolies filles bowknot épissage sandales,18.93,33.5,44,97
kids,Tops & Tees,Tops Drôles Femmes Enceintes,22.06,55.57,60,62
kids,Coutumes & Co-ords,Costume de sport pour garçon imprimé football pour 1-8 ans,31.99,43.98,27,2
kids,Tops & Tees,Blouse d'allaitement à col montant,28.07,70.73,60,78
kids,Chapeaux,0-3 ans écharpes chapeau chaud enfants oreille de lapin,22.06,55.57,60,153
kids,Chaussures pour fille,Chaussures plates brodées Folkways pour filles,23.15,45.17,49,43
kids,Robes,Robe de fille imprimée papillon pour 3-13Y,41.84,105.41,60,64
kids,Chaussures pour garçon,Souliers unisexes avec boucle à crochet en maille pour enfants,29.12,53.01,45,43
kids,Robes,Robe à bretelles à imprimé floral pour fille pour 1-5 ans,16.04,31.98,50,15
kids,Salopettes & Combinaisons,Combinaison Garçons Gentleman Grid Coton Pour 0-24M,35.09,88.42,60,73
kids,Chaussures pour fille,Chaussures de performance filles brillantes princesse,32.85,58.46,44,321
kids,Tops & Tees,Pull de maternité décontracté à capuche ,35.09,88.42,60,28
kids,Robes,Colorful Robe à imprimé papillon pour fille pour 2-10 ans,14.53,28.98,50,9
kids,Blousons & Vestes,Polaires Filles Couleur Unie Manteaux 2Y-11Y,37.1,93.48,60,87
kids,Vêtements d'extérieur & Manteaux,Vestes à capuche pour filles pour 6-36M,32.99,54.99,40,47
kids,Salopettes & Combinaisons,Barboteuse bébé avec chapeau pour 0-12M,18.99,37.99,50,85
kids,Robes,Motif De Noël Fille Robe Pour 3Y-13Y,39.99,67.99,41,143
kids,Écharpes,Kids Winter Écharpe + chapeau ensemble Pour les 0-12 ans,32.99,54.99,40,27
kids,Chaussures pour fille,Chaussures Mary Jane à motif floral pour fille,21.85,41.06,47,99
kids,Robes,Robe fille à col roulé pour 1-5 ans,23.06,58.1,60,18
kids,Costumes pour bébé,2pcs Stripe Boy Set pour 0-24M,26.07,65.68,60,60
kids,Chaussures pour fille,Filles Perle Creuse Respirant Mary Jane,19.06,33.73,44,54
kids,Salopettes & Combinaisons,Barboteuses à imprimé papillon bébé pour 0-12M,11.02,27.77,60,7
kids,Robes & Sacs de couchage,Peignoir De Bain Enfant Motif Animal,32.99,64.99,49,73
kids,Blousons & Vestes,Casual Fleece Zipper Coat Pour 3Y-11Y,36.1,90.95,60,32
kids,Costume & Jupe-culotte,Ensemble de robe à bretelles en velours côtelé pour 0-24M,22.06,55.57,60,25
kids,Robes,Robe décontractée en coton pour filles pour 1Y-9Y,25.06,63.15,60,144
kids,Tops & Tees,Top à manches longues à fonction de maternité,24.06,60.63,60,309
kids,Costume & Jupe-culotte,2pcs fille dentelle ensembles de jupe 4Y-13Y,21.05,53.04,60,369
kids,Robes,Robe chemise fille à manches longues pour 6Y-15Y,35.99,64.99,45,70
kids,Robes,Robe de princesse de sangles de filles pour 1Y-11Y,35.09,88.42,60,62
kids,Robes,Princesse Style Party Robe Pour 2Y-9Y,30.99,54.99,44,60
kids,Maillots de bain,3pcs filles maillot de bain sirène 4Y-13Y,25.99,49.99,48,85
kids,Salopettes & Combinaisons,Barboteuse bébé en coton renne pour 0-24M,19.99,32.99,39,77
kids,Salopettes & Combinaisons,Barboteuse confortable à motif animal pour 0-24 m,22.06,55.57,60,44
kids,Costumes pour bébé,Ensemble court 2 pièces garçons singe pour 0-24 m,19.99,32.99,39,41
kids,Salopettes & Combinaisons,Barboteuse bébé éléphant mignon pour 0-24M,23.06,58.1,60,68
kids,Salopettes & Combinaisons,Ensemble barboteuse pour filles 0-24M,25.06,63.15,60,143
kids,Robes,Robes Princesse Imprimées Fleurs,24.99,40.99,39,46
kids,Robes,Robes sans manches denim mailles,27.07,68.21,60,125
kids,Robes,Robe de fille à épaules dénudées,24.06,43.99,45,88
kids,Tops & Tees,Top nursing de maternité décontracté,23.06,58.1,60,108
kids,Costumes pour bébé,Ensemble de bébé imprimé coton Dino 2 pièces pour 0-24M,20.99,34.99,40,80
kids,Écharpes,Foulard en molleton chaud pour filles,15.99,27.99,43,24
kids,Costumes pour bébé,Pyjama bébé unisexe 2 PCs pour 3-18M,17.99,34.99,49,24
kids,Chaussures pour garçon,Bottes mi-mollet extérieures imperméables unisexes,37.66,68.79,45,60
kids,Blousons & Vestes,Imperméable à fleurs pour filles de 4 à 13 ans,37.99,62.99,40,24
kids,Brassières de grossesse,Soutien-gorge d'allaitement sans fil en dentelle,15.99,28.99,45,40
kids,Tops & Tees,Plus T-shirts d'allaitement taille S-5XL,26.99,52.99,49,26
kids,Chaussures pour fille,Filles sandales de plage noeud papillon perle,17.83,35.67,50,65
kids,Chaussures pour fille,Filles strass élégante sandales de plage,16.47,33.09,50,52
kids,Chaussures pour fille,Jolies fleurs sandales perles,20.06,36.16,45,84
kids,Chaussures pour fille,Chaussures plates de danse brillantes pour filles,20.52,37.41,45,126
kids,Chaussures pour fille,Chaussures plates Bling pour fille et paillettes,21.2,32.56,35,132
kids,Robes,Déguisements de filles de fleur 3D pour 2Y-13Y,44.12,111.17,60,106
kids,Salopettes & Combinaisons,Body bébé floral pour 0-24M,19.99,32.99,39,44
kids,Vêtements de nuit,Ensemble de pyjamas de Noël 2pcs,23.99,43.99,46,68
kids,Blousons & Vestes,Cape pour fillette pour 1Y-5Y,27.99,54.99,49,36
kids,Coutumes & Co-ords,3pcs ensembles de garçons de style chinois pour 2Y-11Y,41.99,71.99,42,24
kids,Costumes pour bébé,Ensemble de vêtements de bébé de Noël pour 0-24M,19.99,39.99,50,107
kids,Robes,Cartoon Girls Casual Dress Pour 1Y-7Y,19.99,39.99,50,24
kids,Tops & Tees,Hauts d'allaitement de maternité ouverts à l'avant,22.06,55.57,60,184
kids,Brassières de grossesse,Soft Soutien-gorge d'allaitement à boutons en coton,16.99,32.99,49,12
kids,Chaussures pour fille,Filles Bowknot Slip On Confortables Flats,24.01,40.1,40,158
kids,Tops & Tees,Hauts d'allaitement de maternité à manches longues,26.99,52.99,49,38
kids,Costumes pour bébé,Ensemble de manches longues pour garçons de bande dessinée pour 0-24M,25.99,43.99,41,43
kids,Costumes pour bébé,Ensemble de 3 barboteuses en coton pour 3-18 m,25.06,63.15,60,34
kids,Écharpes,Écharpe en tricot écusson Bowknot Patch pour enfants de 1 à 6 ans,13.99,21.99,36,62
kids,Écharpes,Écharpe d'hiver de pompon pour enfants en laine chaude pour 1-12 ans,16.99,28.99,41,31
kids,Écharpes,Écharpe géométrique en laine pour enfant de 1 à 12 ans,15.99,26.99,41,14
kids,Pyjamas,Ensemble de pyjama de maternité imprimé,52.99,103.99,49,39
kids,Chaussures pour bébé,Ballon Décor Baby Boots Pour 0-2 Ans,20.99,34.99,40,104
kids,Costume & Jupe-culotte,Ensemble d'ananas pour fille pour 1-7 ans,14.99,27.99,46,8
kids,Robes,Robe rayée arc-en-ciel fille pour 1-7 ans,15.03,37.88,60,20
kids,Coutumes & Co-ords,Ensemble formel chemise garçon + pantalon à carreaux pour 1-8 ans,31.08,78.32,60,16
kids,Coutumes & Co-ords,Ensembles formels pour garçons 2 pièces pour 1-8 ans,31.08,78.32,60,20
kids,Coutumes & Co-ords,Ensemble t-shirts et pantalons violets pour garçon 1-8 ans,31.08,78.32,60,6
kids,Coutumes & Co-ords,T-shirts et pantalons verts pour garçon pour 1-8 ans,31.08,78.32,60,15
kids,Coutumes & Co-ords,T-shirts et pantalons jaunes pour garçon pour 1-8 ans,31.08,78.32,60,12
kids,Salopettes & Combinaisons,Barboteuses imprimées de lettre de bébé pour 0-12M,11.02,27.77,60,8
kids,Salopettes & Combinaisons,Barboteuses d'éléphant de bande dessinée de bébé pour 0-12M,11.02,27.77,60,14
kids,Robes,Robe à imprimé floral pour fille pour 1-5 ans,17.54,44.2,60,7
kids,Costumes pour bébé,Ensemble de manches volantes à imprimé bébé à pois pour 3-24M,18.55,46.73,60,6
kids,Brassières de grossesse,Dentelle Soft Soutien-gorge d'allaitement de maternité en coton,17.04,42.94,60,50
kids,Robes,Robe d'allaitement de maternité à pyjama,28.07,70.73,60,14
kids,Tops & Tees,Hauts de maternité imprimés de Noël,22.99,44.99,49,7
kids,Tops & Tees,Haut d'allaitement patchwork de maternité à rayures,20.92,52.72,60,9
kids,Tops & Tees,Haut de maternité à imprimé léopard,22.99,44.99,49,21
kids,Salopettes & Combinaisons,Barboteuses de Noël pour bébé 0-24M,12.99,24.99,48,7
kids,Costumes pour bébé,Ensemble de volants à fleurs pour fille de 3 pièces pour 0-24M,23.06,58.1,60,37
kids,Costumes pour bébé,Ensemble imprimé rayé bébé crocodile pour 0-24M,21.05,53.04,60,8
kids,Costumes pour bébé,Baby Gentleman Rompers Set For 0-18M,18.99,37.99,50,14
kids,Robes,Robe de fille à rayures de dessin animé pour 1-7Y,18.04,45.46,60,24
kids,Costume & Jupe-culotte,Toddler Animal Cartoon Set Pour 1-7Y,21.99,42.99,49,15
kids,Costume & Jupe-culotte,Girl's Floral Print Set Pour 2-9Y,21.05,53.04,60,27
kids,Costumes pour bébé,Ensemble arc-en-ciel de dessin animé bébé pour 0-24M,18.04,45.46,60,18
kids,Costume & Jupe-culotte,"Ensemble décontracté pour filles et garçons, 1-7 ans",22.06,55.57,60,46
kids,Salopettes & Combinaisons,Barboteuses décontractées Baby Elk pour 0-24M,29.08,73.26,60,8
kids,Robes,Robe imprimée à pois et licorne pour fille de 2 à 9 ans,19.99,39.99,50,20
kids,Brassières de grossesse,Soutien-gorge d'allaitement sans fil de maternité,19.05,47.99,60,12
kids,Brassières de grossesse,Coussin d'allaitement anti-fuites,6.01,15.14,60,40
kids,Pantalons & Jupes,Pantalon Panda imprimé fille pour 1-9 ans,14.03,35.35,60,25
kids,Costume & Jupe-culotte,Pyjama de dessin animé pour fille pour 1-7 ans,23.06,58.1,60,16
kids,Salopettes & Combinaisons,Barboteuse bébé mignon avec chapeau pour 0-24M,25.06,63.15,60,114
kids,Salopettes & Combinaisons,Barboteuse en tulle pour fille de 0 à 24 mois,25.06,63.15,60,178
kids,Salopettes & Combinaisons,Barboteuse Bébé Motif Animal Pour 0-24M,22.06,55.57,60,94
kids,Salopettes & Combinaisons,Barboteuse bébé rose / jaune pour 0-18M,28.07,70.73,60,97
kids,Accessoires pour cheveux,Bandeau Bébé 14 Couleurs Pour Les 0-5 Ans,9.02,22.72,60,130
kids,Accessoires pour cheveux,Bandeau Bowknot mignon de fille de bébé,8.01,20.19,60,96
kids,Costumes pour bébé,2pcs Leopard Girls Set pour 0-24M,28.07,70.73,60,140
kids,Robes,Filles sans manches robes de fleurs pour 6M-36M,20.99,32.99,36,166
kids,Robes,2pcs filles tulle robes manteau ensemble pour 6m-36m,30.08,75.79,60,224
kids,Chapeaux,Joyeux noël fête fête noël chapeaux,7.86,13.88,43,59
kids,Chapeaux,Bonnet Filles Bonnet Bonnet Bonnet,8.01,20.19,60,155
kids,Chapeaux,Chapeaux de soleil vides d&#39;été de bébés filles d&#39;été de chapeaux supérieurs de soleil de paille de pli de large bord pliable,11.36,21.55,47,93
kids,Chapeaux,Nouveau-né bébé filles garçons corne laine chapeau tricot Soft accessoires de photo au crochet cap,8.46,15.37,45,63
kids,Chaussures pour fille,Sandales d'été pour toute-petite fille à fleurs,20.42,37.82,46,327
kids,Chaussures pour garçon,Kids Unisex Flip Flops Softwood Cork Slippers,22.54,40.88,45,116
kids,Chapeaux,Bonnet chaud pour bébé Baby Infant Winter,10.81,21.27,49,55
kids,Chapeaux,"Chapeau à tricoter pour enfants, garçons, filles, dessin animé, grand, chapeau, chaud, laine",7.11,12.95,45,41
kids,Trousses,Enfants belle bande dessinée chat cas de crayon boîte stylo sac de rangement stationnaire,5.99,9.99,40,201
kids,Sacs à dos,Enfants de l&#39;école primaire Drawstring Natation Imperméable À L&#39;eau Sacs Sac À Dos D&#39;école,6.53,9.99,35,240
kids,Brassières de grossesse,Maternity Soft Soutien-gorge d'allaitement respirant,18.99,37.98,50,2
kids,Robes,Robe patchwork à carreaux bébé pour 3-18M,19.99,39.98,50,0
kids,Tops & Tees,Hauts d'allaitement sans manches à fleurs de maternité,20.05,39.98,50,5
kids,Tops,T-shirt rayé à imprimé fruits pour fille pour 1-5 ans,17.04,42.94,60,6
kids,Tops & Tees,Mignon Panda Tops de maternité à motif,15.99,31.98,50,4
kids,Pyjamas,Pyjama garçon imprimé baleine pour 1-5 ans,16.04,31.98,50,12
kids,Pyjamas,Plus Gilet de maternité imprimé à rayures de taille,14.99,29.98,50,5
kids,Robes,Jupe plissée à imprimé rose pour fille pour 2-8 ans,14.03,27.98,50,12
kids,Sets de coutumes,Pyjama d'allaitement de maternité Soft,38.99,77.98,50,3
kids,Brassières de grossesse,Soutien-gorge d'allaitement sexy Soutien-gorge sans fil de maternité,15.99,31.98,50,7
kids,Salopettes & Combinaisons,Barboteuses bébé dinosaure pour 6-24M,12.99,25.98,50,8
kids,Coutumes & Co-ords,Costume de messieurs d'anniversaire à imprimé floral pour garçon pour 2-10 ans,29.99,59.98,50,6
kids,Tops & Tees,Hauts d'allaitement à volants multifonctionnels,20.99,41.98,50,6
kids,Brassières de grossesse,Soutien-gorge d'allaitement sans fil rayé de maternité,14.99,29.98,50,10
kids,Robes,Robe rayée camouflage bébé pour 6-24M,18.99,36.99,49,6
kids,Robes,Robe De Cheval Imprimé Filles Pour 2A-11Y,19.05,47.99,60,172
kids,Robes,Modèle de couronne filles s'habillent pour 4Y-15Y,25.99,45.99,44,63
kids,Costume & Jupe-culotte,Vêtements de filles de Noël pour 1Y-7Y,23.99,39.99,40,54
kids,Chaussures pour fille,Robe bowknot Mary Jane pour fille,18.91,36.78,49,54
kids,Chapeaux,Bonnet Dino Garçons En Tricot De Laine Pour Les 0-5 Ans,20.99,34.99,40,46
kids,Coutumes & Co-ords,Chemise rayée garçon + pantalon Costume formel pour 1-8 ans,31.08,78.32,60,14
kids,Chaussures pour garçon,Chaussures de plage de loisirs unisexes pour enfants,27.77,48.46,43,112
kids,Chaussures pour fille,Filles bowknot robe plate chaussures,18.63,34.72,46,93
kids,Tops & Tees,Hauts d'allaitement de maternité à imprimé floral,27.07,68.21,60,109
kids,Brassières de grossesse,Soutien-gorge d'allaitement maternité sans fil sans couture,20.99,41.98,50,1
kids,Chapeaux,Casquette Deer Corn Girls pour 2-8 ans,16.99,28.99,41,35
kids,Chaussettes,Angel Wings Filles Soft Jambières,18.99,30.99,39,72
kids,Bas,Pantalon bébé imprimé lettre pour 0-24M,17.99,35.99,50,4
kids,Salopettes & Combinaisons,Barboteuses Gentleman pour 3-24M,16.54,41.67,60,10
kids,Brassières de grossesse,Soutien-gorge d'allaitement sans fil en dentelle sexy de maternité,15.99,31.98,50,6
kids,Robes,Summer Infant Girls Robe à manches courtes,25.06,63.15,60,95
kids,Chaussures pour bébé,Animal Warm Slip On Shoes Pour 0-24M,15.99,30.99,48,157
kids,Sacs des couches,Tête d'oreiller avec protège-tête pour bébé de 3 à 18 mois,18.04,45.46,60,40
kids,Tops & Tees,Imprimé de maternité de bande dessinée Casual Soft Tops,19.99,39.98,50,5
kids,Salopettes & Combinaisons,Ensemble barboteuse drapeau bébé,18.99,43.99,57,48
kids,Costumes pour bébé,2pcs Santa Pattern Baby Set pour 0-24M,20.99,34.99,40,22
kids,Costume & Jupe-culotte,Ensemble de vêtements décontractés sans manches épissés de couleur unie pour fille pour 1-7Y,19.99,39.98,50,10
kids,Tops & Tees,Sweat à capuche d'allaitement Big Pocket Maternity,35.09,86.99,60,99
kids,Chapeaux,Chapeau mignon de bonnet de boules de poils de garçons de fille d&#39;enfants infantile d&#39;enfant en bas âge de couleur unie,7.81,15.64,50,65
kids,Chaussures pour fille,Filles Bling Couronne Lovely Mary Jane,18.9,36.78,49,137
kids,Costumes pour bébé,Ensembles rayés bébé hippopotame pour 0-24M,22.06,55.57,60,14
kids,Costumes pour bébé,Ensemble de vêtements pour bébés d'été pour 0-24M,26.07,65.68,60,51
kids,Salopettes & Combinaisons,3Pcs Cowboy Boy Jumpsuit Set Pour 0-24M,33.09,83.37,60,117
kids,Écharpes,Cache-cou écharpe coton hiver enfants,13.99,21.99,36,49
kids,Tops & Tees,Maternité Soft Haut de lit d'allaitement,24.06,60.63,60,18
kids,Vêtements de nuit,Pyjama à lacets pour fille Cartoon pour 2-8 ans,18.49,36.98,50,8
kids,Robes,Girl's Butterfly Flower Embroidery Spliced Short-sleeved Casual Dress For 1-7Y,18.99,37.98,50,7
kids,Brassières de grossesse,Soutien-gorge d'allaitement respirant en dentelle de maternité,18.99,37.98,50,1
kids,Pyjamas,Pyjama garçon imprimé dinosaure pour 6-11 ans,15.99,31.98,50,10
kids,Sweaters & Hoodies,Pull à imprimé géométrique pour enfants 4 à 11 ans,15.99,31.98,50,0
kids,Costume & Jupe-culotte,Ensemble à manches longues imprimé fille pour 1-7 ans,16.99,33.98,50,0
kids,Trainers,Garçons Sports Comfy Antidérapant Crochet Loop Casual Sneakers,23.16,51.47,55,1
kids,Costume & Jupe-culotte,Ensemble d'impression de lettres pour fille pour 1-7 ans,14.99,29.98,50,1
kids,Robes,Robe de princesse avec nœud à paillettes pour fille pour 1-7 ans,33.99,67.98,50,0
kids,Salopettes & Combinaisons,Barboteuses à imprimé camouflage pour bébé pour 3 à 18 mois,11.99,23.99,50,0
kids,Sneakers,Chaussures de course à pied unisexe pour enfants confortables avec boucle à crochet antidérapante,29.78,66.18,55,2
kids,Sneakers,Unisexe Enfants Couleurs Rayé Soft Semelle Casual Chunky Baskets,31.99,71.11,55,1
kids,Sneakers,Unisexe Enfants Daisy Mesh Tissu Tie-dye Semelle Blanche Baskets Chunky,31.44,69.87,55,1
kids,Trainers,Baskets légères en tissu tricoté respirant élégant pour garçons,34.2,76.11,55,1
kids,Robes,Robe imprimée à rayures pour fille pour 1-7 ans,8.99,17.98,50,0
kids,Robes,Robe en tulle à manches volantées pour fille 2-8 ans,8.99,17.98,50,0
kids,Robes,Robe de princesse en tulle en dentelle pour fille de 6 à 12 ans,32.99,65.98,50,0
kids,Coutumes & Co-ords,3pcs garçons imprimés vêtements ensembles pour 1Y-7Y,30.24,95.25,68,671
kids,Pantalons & Jupes,Combi-short en jean croisé pour jolie fille de 1 à 9 ans,4.89,30.59,84,210
kids,Robes,Robe de princesse à pois pour fille 3-11 ans,39.99,79.98,50,59
kids,Chaussures pour fille,Frozenly Elsa Princess Chaussures de robe,36.25,61.91,41,234
kids,Flats & Loafers,Unisexe Kids Comfy Soft Sole Canvas Flat Chaussures,12.95,26,50,18
kids,Sneakers,Baskets décontractées antidérapantes légères unisexes pour enfants,13.79,29.57,53,6
kids,Robes,Robe longue vintage pour filles 6Y-15Y,50.14,126.33,60,410
kids,Robes,Robe à imprimé de fleurs pour fille pour 2-8 ans,17.99,35.98,50,20
kids,Trainers,Unisexe Kids Comfy Slip Resistant Casual LED Sneakers rougeoyants,14.81,39,62,8
kids,Tops & Tees,T-shirt d'allaitement rayé à col rond,21.05,53.04,60,32
kids,Pulls & Sweat-shirts,Pull imprimé chat 3D pour 4-11 ans,33.09,83.37,60,53
kids,Tops & Tees,Débardeur d'allaitement sans manches à col en V,17.54,44.2,60,45
kids,Coutumes & Co-ords,2pcs Cartoon Boys Clothing Set,23.06,58.1,60,180
kids,Robes,Robe de fille de fleur de licorne pour 4-13 ans,17.04,42.94,60,330
kids,Tops & T-shirt,T-shirt imprimé balles de dessin animé pour garçon 3-12 ans,12.99,25.98,50,10
kids,Tops,T-shirt décontracté imprimé fille pour 2-8 ans,11.99,23.98,50,6
kids,Robes,Robe Fleur Fille Noeud Papillon Pour 3-13Y,44.12,111.17,60,244
kids,Salopettes & Combinaisons,Barboteuses de girafe de dessin animé de bébé pour 0-18M,18.04,45.46,60,53
kids,Coutumes & Co-ords,2pcs garçons ensembles de jeans t-shirt 2Y-9Y,35.09,88.42,60,195
kids,Costume & Jupe-culotte,Ensembles de vêtements pour filles de fleur 2Pcs pour 1Y-7Y,28.07,70.73,60,662
kids,Robes,Robes de filles de broderie de fleur 2Y-9Y,29.08,73.26,60,243
kids,Blousons & Vestes,Veste à imprimé de dessin animé pour fille,29.08,73.26,60,200
kids,Pantalons & Capris,Combinaison à imprimé floral Mommy And Me,17.99,35.98,50,18
kids,Costume & Jupe-culotte,Sweat Panda Fille Set Pour 4-15Y,43.12,108.64,60,118
kids,Sandals,Sandales d'eau à boucle à crochet antidérapantes pour filles,12.7,29.99,58,9
kids,Brassières de grossesse,Soutien-gorge d'allaitement sans fente,12.03,30.3,60,188
kids,Tops & T-shirt,T-shirt garçon imprimé camouflage dinosaure pour 2-10 ans,12.03,30.3,60,25
kids,Maillots de bain,Ensemble de 3 pièces de maillots de bain queue de sirène pour fille de 4ans-13ans,23.99,66.89,64,466
kids,Robes,Robe évasée à motif paon fille 2 à 11 ans,24.06,60.63,60,247
kids,Robes,Flower Girls Fancy Dress For 3Y-13Y,40.87,102.98,60,666
kids,Brassières de grossesse,Soutien-gorge d'allaitement maternité sans fil en coton avec t-shirt,16.04,40.41,60,90
kids,Brassières de grossesse,Soutien-gorge d'allaitement sans fil en dentelle sexy,19.9,50.14,60,52
kids,Robes,Colorful Robe tissée de filles de cheval pour 3-11Y,23.06,58.1,60,57
kids,Robes,Robe florale à motif de lapin,23.06,58.1,60,399
kids,Robes,Robe Patchwork Fille De Fleurs Pour 3-13Y,28.07,70.73,60,179
kids,Costumes pour bébé,Ensemble de 3 pantalons bébé barboteuse pour 0-24 mois,27.07,68.21,60,363
kids,Salopettes & Combinaisons,Barboteuses à imprimé animal bébé pour 6-24 m,13.53,26.98,50,36
kids,Robes,Bowknot Ruffles Girls Dress Pour 2-9Y,19.05,47.99,60,641
kids,Costumes pour bébé,Barboteuses bébé imprimé léopard tournesol pour 6-24M,16.99,33.98,50,24
kids,Pulls & Sweat-shirts,Sweat-shirt garçon imprimé loup 3D pour 4Y-11Y,41.11,103.59,60,85
kids,Sweaters & Hoodies,Sweat Fille Imprimé Léopard Pour 1-7Y,11.99,21.99,46,34
kids,Coutumes & Co-ords,Ensembles de pantalons de chemise à rayures pour garçons 1Y-5Y,31.08,78.32,60,238
kids,Flats & Loafers,Unisexe Kids Canvas Low Top Comfy Wearable Shoes,15.6,30,48,15
kids,Maillots de bain,Maillot de bain licou imprimé coco,19.55,49.25,60,39
kids,Robes,Robe de princesse arc-en-ciel fille pour 2-9 ans,20.05,50.52,60,160
kids,Salopettes & Combinaisons,Barboteuse bébé en coton imprimé pour 0-24 M,25.06,63.15,60,108
kids,Pantalons & Jupes,Pantalon chaud épais imprimé pour 4Y-15Y,24.06,60.63,60,156
kids,Salopettes & Combinaisons,Barboteuses d'impression de bande dessinée de bébé pour 0-18M,19.05,47.99,60,58
kids,Tops & Tees,Débardeurs d'allaitement maternité,19.99,39.98,50,7
kids,Robes,Robe à imprimé bowknot à pois pour fille pour 2-8 ans,17.99,35.98,50,30
kids,Robes,Colorful Robe à imprimé arc-en-ciel pour fille pour 1-7 ans,13.49,26.98,50,11
kids,Brassières de grossesse,Soutiens-gorge d'allaitement sexy en dentelle anti-affaissement,17.99,53.04,66,716
kids,Coutumes & Co-ords,Ensembles Casual Garçons Couleur Unie 3Y-11Y,27.07,68.21,60,145
kids,Sweaters & Hoodies,Chandail d'hiver de dinosaure pour tout-petits pour 2-11 ans,22.46,56.58,60,111
kids,Robes,Robe de maternité imprimée bohème,27.07,68.21,60,148
kids,Tops & T-shirt,Octopus Ships T-shirt imprimé garçon pour 3-12 ans,12.99,25.98,50,8
kids,Costumes pour bébé,Ensemble de vêtements de neige pour filles pour 0-36M,114.99,215.99,47,123
kids,Robes,Robe d'allaitement confortable avant ouverte,25.53,64.32,60,181
kids,Salopettes & Combinaisons,Barboteuses en dentelle de bébé glissées pour 6-24 m,18.99,39.98,53,28
