category,subcategory,name,current_price,raw_price,discount,likes_count
kids,Blousons & Vestes,Gilet pour fille bébé,21.59,42.99,50,316
kids,Salopettes & Combinaisons,Gentle Boys Romper Pour 0-24M,15.5,43.85,65,75
kids,Accessoires pour cheveux,Accessoires De Cheveux De Dentelle De Fleurs Pour 0-3 Ans,4.89,12.23,60,221
kids,Chaussures pour garçon,Chaussures plates unisexes de couleur unie,12.06,30.5,61,89
kids,Costume & Jupe-culotte,Ensemble d'été à volants pour fille pour 1 à 11 ans,9.59,40.79,77,200
kids,Coutumes & Co-ords,Sweatshirt Garçons + Ensembles de Pantalons Pour 1-7Y,21.18,50.99,59,35
kids,Chaussures pour bébé,Bébé unisexe First Walker pour 0-24M,11.19,25.99,57,103
kids,Pantalons & Jupes,Lettre Imprimé Garçon Sport Pant Pour 4Y-15Y,18.29,37.23,51,128
kids,Blousons & Vestes,Vestes de protection solaire à capuchon imprimées pour garçons,13.87,32.1,57,48
kids,Tops,T-shirts imprimés ananas pour fille,7.14,16.93,58,61
kids,Chaussures pour garçon,Souliers unisexes en toile pour enfants,12.06,29.77,60,127
kids,Salopettes & Combinaisons,Barboteuse bébé garçon avec chapeau pour 0-36 m,17.32,38.75,55,190
kids,Sweaters & Hoodies,Pullover Fleece Enfants Sweat Pour 6Y-15Y,25.88,67.32,62,33
kids,Blousons & Vestes,Imperméable à motif de grenouille mignonne pour enfant,27.27,54.99,50,223
kids,Tops & Tees,Haut de maternité à manches en tulle brodé,10.39,40.79,75,58
kids,Robes,Filles Casual Floral Maxi Dress Pour 1-11Y,19.25,43.85,56,355
kids,Costume & Jupe-culotte,Ensembles de vêtements pour petites filles pour 1Y-7Y,10.39,36.72,72,134
kids,Pantalons & Jupes,Legging à imprimé floral pour fille,9.62,20.02,52,294
kids,Robes,Cartoon Appliqued Girls Dress Pour 3-11Y,15.19,47.99,68,226
kids,Tops,Dessus de collier de style chinois,14.68,50.99,71,32
kids,Chaussures pour fille,Bowknot filles colorées sandales d'été,16.72,42.36,61,178
kids,Robes,Robe pull plissée fille pour 1-7 ans,22.02,55.06,60,46
kids,Sweaters & Hoodies,Pull à sequins Cartoon pour fille de 4 à 15 ans,17.59,42.99,59,25
kids,Chapeaux,"Bonnet bonnet, Bonnet en laine tricotée. Bonnet écharpe à capuchon",9.22,21.35,57,17
kids,Tops,T-shirt Coton Fille Imprimé Requins Pour 2-9Y,12.51,26.52,53,45
kids,Robes,Robes décontractées en coton pour filles,15.4,29.26,47,95
kids,Accessoires pour cheveux,Accessoires Cheveux Filles Pour 0-3 Ans,4.81,13.25,64,89
kids,Pantalons,Baby Cute Bear Ass Pant Pour 0-36M,10.6,27.52,62,73
kids,Tops & T-shirt,T-shirt décontracté pour garçon dinosaure pour 1-8 ans,8.82,27.77,68,18
kids,Robes,Robe florale à col en V pour filles de 6 à 15 ans,25.99,57.12,55,164
kids,Robes,Robe de maternité respirante sans manches,16.04,50.52,68,31
kids,Pulls & Sweat-shirts,Sweat-shirt garçon à imprimé animalier pour 2Y-11Y,19.25,50.99,62,15
kids,Robes,Fillette robe longue de demoiselle d'honneur à strass,30.48,96.01,68,520
kids,Robes,Robe princesse avec perles pour fille de 2-13 ans,17.65,55.57,68,437
kids,Sweaters & Hoodies,Pull à capuche Cartoon pour tout-petit pour 1-5 ans,14.39,33.99,58,26
kids,Costume & Jupe-culotte,Ensemble de courroie d'impression pour tout-petit pour enfant de 1 à 5 ans,21.21,70.36,70,32
kids,Robes,Bande Dessinée Filles Bande Dessinée Casual Pour 1-9Y,12.23,30.58,60,165
kids,Sweaters & Hoodies,Pull rayé arc-en-ciel pour fille de 1 à 7 ans,11.01,27.52,60,7
kids,Vêtements pour fille,Ensembles de vêtements pour filles de Noël pour 0-36M,19.19,42.99,55,93
kids,Tops & T-shirt,T-shirt imprimé rayures dinosaures pour garçon 2-8 ans,11.99,23.98,50,16
kids,Robes,Robe de poche pour toute-petite fille pour 2Y-9Y,21.05,53.04,60,236
kids,Tops,T-shirt à col en V imprimé fille pour 2-8 ans,12.99,25.98,50,26
kids,Brassières de grossesse,Soutien-gorge ajustable Comfort Maternity Comfort,17.04,42.94,60,153
kids,Robes,Robe de maternité décontractée à volants d'été,42.12,106.11,60,202
kids,Blousons & Vestes,Soft Polaire épaissir les filles pour 2-11 ans,42.12,106.11,60,540
kids,Salopettes & Combinaisons,2 pièces barboteuses rayées bébé tigre pour 0-18 m,23.06,58.1,60,44
kids,Sous-vêtements de maintien de grossesse,Après la naissance ventre formateur formateur ceinture,19.05,47.99,60,80
kids,Robes,Robe de baptême Big Bow Baby Girls pour 0-24M,40.11,101.06,60,79
kids,Robes,Robe motif fille chat 2Y-9Y,18.04,45.46,60,292
kids,Culottes de grossesse,3pcs culottes de maternité en coton Soft,22.06,55.57,60,60
kids,Coutumes & Co-ords,Costume d'Halloween Petit Diable,29.08,73.26,60,182
kids,Brassières de grossesse,Brassière de grossesse en dentelle décorative sans armature,17.04,42.94,60,317
kids,Sous-vêtements de maintien de grossesse,Grossesse Maternité Ventre Haut-Bas Bande L XL,23.06,58.1,60,131
kids,Brassières de grossesse,Soutien-gorge de sommeil sans fil,21.05,53.04,60,464
kids,Tops & T-shirt,T-shirt garçon imprimé crocodile violon pour 2-8 ans,11.99,23.98,50,5
kids,Sneakers,Unisexe Kids Respirant Soft Sole LED Casual Sneakers,14.99,37.62,60,12
kids,Robes,Jolie robe à fleurs pour 6-36M,21.05,53.04,60,378
kids,Robes,Robe de princesse à rayures pour filles de 3 à 10 ans,35.09,88.42,60,429
kids,Pulls & Sweat-shirts,Sweat à capuche Dinosaure pour Garçon 2Y-9Y,30.08,75.79,60,92
kids,Robes,Robe fille en dentelle effet patchwork pour enfant,30.08,75.79,60,919
kids,Chaussures pour garçon,Garçon Filles Slip On Sport Casual Chaussures,18.48,35.4,48,334
kids,Culottes de grossesse,Culotte abdominale à taille haute en coton,11.02,27.77,60,240
kids,Blousons & Vestes,Manteaux à capuchon Rainbow Girls 3Y-11Y,30.08,75.79,60,317
kids,Brassières de grossesse,Soutien-gorge d'allaitement sexy sans fil en dentelle ,15.03,37.88,60,140
kids,Salopettes & Combinaisons,Baby Cartoon Soft Barboteuses Pour 0-18M,16.32,41.12,60,46
kids,Robes,Robes de filles de fleur de dentelle pour 1Y-7Y,25.99,54.99,53,225
kids,Sous-vêtements de maintien de grossesse,Récupération après l'accouchement Bande,12.84,32.35,60,53
kids,Sweaters & Hoodies,Pull de broderie de fleurs pour fille 6-15Y,25.99,49.99,48,27
kids,Costumes pour bébé,Ensemble imprimé de fleurs de bébé pour 6-24M,17.04,33.98,50,31
kids,Costume & Jupe-culotte,Ensemble décontracté imprimé fille licorne pour 2-9 ans,23.06,58.1,60,134
kids,Robes,Robe maxi fleurie irrégulière princesse fille  ,40.11,101.06,60,133
kids,Sneakers,Baskets légères respirantes confortables pour enfants unisexes,17.11,33.22,49,9
kids,Costume & Jupe-culotte,Ensemble à volants sans manches Bowknot pour fille pour 1-7 ans,20.99,41.98,50,21
kids,Salopettes & Combinaisons,Barboteuse en coton pour bébé 0-24M,14.99,28.99,48,102
kids,Robes,Robe à fleurs papillon pour fille 3-10 ans,17.99,35.98,50,12
kids,Sweaters & Hoodies,Sweat à capuche motif de chat 3Y-11Y,33.09,83.37,60,163
kids,Tops & T-shirt,T-shirt Garçon Imprimé Monster Pour 2-11Y,16.04,40.41,60,106
kids,Pantalons & Jupes,Combinaison Pantalon Imprimé Animal,33.09,83.37,60,340
kids,Blousons & Vestes,Manteau épais de filles florale avec fourrure pour 4Y-15Y,58.16,146.55,60,198
kids,Blousons & Vestes,Vestes en duvet de dessin animé pour fille et garçon pour 3-13 ans,43.96,84.99,48,19
kids,Pantalons & Jupes,Combinaison de couleur unie pour fille pour 2-8 ans,14.49,28.98,50,21
kids,Costumes pour bébé,Ensemble de chandail à capuchon à rayures pour garçon 2Pcs pour 1-9Y,29.08,73.26,60,92
kids,Sneakers,Unisexe Kids Slip Soft Casual Camouflage Sneakers,28.69,56.38,49,6
kids,Salopettes & Combinaisons,Barboteuses d'impression de baleine de bébé de bande dessinée pour 6-24M,13.99,27.98,50,8
kids,Chaussures pour garçon,Unisexe Enfants cousant Soft Flats confortables,18.23,30.19,40,176
kids,Tops & T-shirt,T-shirt Garçon Imprimé Shark Pour 2-9Y,15.03,37.88,60,121
kids,Brassières de grossesse,Soutien-gorge d'allaitement sans fil taille Plus,15.03,37.88,60,139
kids,Brassières de grossesse,Soutien-gorge d'allaitement confortable en dentelle,17.04,42.94,60,62
kids,Costumes pour bébé,2pcs ensembles de vêtements de bébé unisexe pour 0-24m,19.99,29.99,33,302
kids,Salopettes & Combinaisons,Barboteuses en dentelle de tournesol pour bébé 0-24M,16.99,33.98,50,33
kids,Costume & Jupe-culotte,Ensemble imprimé léopard pour fille pour 2-11 ans,24.06,60.63,60,73
kids,Salopettes & Combinaisons,2pcs barboteuses à imprimé floral pour 6-24 m,12.99,25.98,50,32
kids,Salopettes & Combinaisons,Barboteuse pour filles avec chapeau pour 0-36M,26.07,65.68,60,139
kids,Tops & Tees,Modèle mignon maternité élastique Tummy Maternité,21.05,53.04,60,477
kids,Sweaters & Hoodies,Robe en couches pour fille de 3-11 ans,44.12,111.17,60,404
kids,Sneakers,Unisexe Kids Sports Slip Resistant Soft Casual Sneakers,28.69,56.38,49,4
kids,Salopettes & Combinaisons,Barboteuses à imprimé ballon bébé pour 6-24 m,12.99,25.98,50,7
kids,Coutumes & Co-ords,Costume formel imprimé à carreaux pour garçon de 3 pièces pour 1-8 ans,31.99,63.98,50,13
kids,Tops & T-shirt,T-shirt imprimé dinosaure pour garçon pour 2-10 ans,8.82,27.77,68,8
kids,Costumes pour bébé,2PCS Zebra Ensemble de vêtements pour bébés filles et garçons,16.04,50.52,68,353
kids,Pantalons & Jupes,Pantalon de pluie pour enfant,15.99,29.99,47,131
kids,Tops,Dessus De Garçons D'Imprimés De Dessin Animé Pour 1Y-11Y,15.4,32.64,53,100
kids,Tops,T-shirts à manches longues Sweet Candy Color Girls,21.92,54.84,60,41
kids,Costumes pour bébé,2pcs / Set bébé éléphant Set pour 0-24 M,16.36,35.28,54,144
kids,Tops & T-shirt,Chemise formelle garçons à carreaux pour 2Y-11Y,17.32,36.72,53,39
kids,Tops,T-shirt en coton imprimé de lettres pour 2-9 ans,8.15,20.39,60,98
kids,Robes,"Robe décontractée pour filles, imprimé pissenlit, 2 à 9 ans",18.45,58.1,68,113
kids,Chaussures pour garçon,Unisexe enfants respirant confortables chaussures de sport,20.33,49.4,59,99
kids,Salopettes & Combinaisons,Bébé Plus Barboteuses Velours Côtelé Pour 0-24M,26.39,69.99,62,77
kids,Sweaters & Hoodies,Pull d'impression de Noël pour 4-13Y,16.79,41.99,60,21
kids,Bas,Pantalon taille haute élastique pour bébé 0-18M,6.05,15.13,60,3
kids,Costumes pour bébé,Ensemble d'impression à capuche pour bébé 0-24M,14.39,34.99,59,180
kids,Costume & Jupe-culotte,Ensembles de filles d'impression d'ananas pour 3-11Y,16.31,42.83,62,108
kids,Robes,Vintage Flower Girls Dress Pour 3-11Y,23.42,56.57,59,118
kids,Salopettes & Combinaisons,TUBENG barboteuses de dessin animé mignon bébé,14.79,36.99,60,54
kids,Pyjamas,Pyjama garçon à imprimé requin pour 6-12 ans,15.24,47.99,68,12
kids,Costumes pour bébé,2pcs filles robes barboteuse + manteau pour 0-36m,20.39,57.94,65,291
kids,Costume & Jupe-culotte,2Pcs Garçons Filles Sport Set Pour 3-15Y,45.25,97.92,54,86
kids,Sweaters & Hoodies,Sweat Love Sequin pour filles pour 2Y-11Y,17.01,40.79,58,58
kids,Blousons & Vestes,Veste épaisse pour garçons imprimée en hiver,37.59,78.99,52,81
kids,Robes,Robe de princesse de filles de fleurs 1Y-9Y,24.86,78.32,68,90
kids,Chaussures pour bébé,Princesse Fleur Filles Chaussures Pour 0-24M,7.34,20.39,64,290
kids,Robes,Robes des filles à l'épaule,17.59,38.99,55,172
kids,Tops,T-shirt imprimé licorne pour 1 à 15 ans,11.22,35.35,68,298
kids,Vêtements de nuit,Big Wolf Combinaisons De Flanelle Pour 1Y-7Y,27.27,85.9,68,56
kids,Vêtements d'extérieur & Manteaux,Le manteau mignon de l'enfant épais pour 0-3 ans,24.06,50.99,53,63
kids,Brassières de grossesse,Soutien-gorge d'allaitement respirant sans fil,16.06,50.99,69,86
kids,Robes,Rainbow Unicorn Girls Dress Pour 3-11Y,15.5,40.79,62,125
kids,Costumes pour bébé,2pcs bébé ensemble décontracté de Noël pour 0-24m,15.19,35.99,58,18
kids,Salopettes & Combinaisons,Barboteuses de dessin animé bébé lion pour 0-24 m,11.99,29.99,60,22
kids,Pantalons & Capris,Pantalon de maternité Taille élastique Pantalon crayon,16.31,43.03,62,180
kids,Tops & T-shirt,T-shirts Garçons Imprimés Univers 1Y-9Y,12.51,27.12,54,113
kids,Tops,Pull de filles de dessin animé hiver filles,24.79,48.99,49,108
kids,Tops & T-shirt,Dinosaur Boys Tees Pour 2Y-11Y,10.6,24.81,57,58
kids,Chapeaux,Chapeau de seau de chapeau de fourrure de Noël d'élan,6.75,17.05,60,108
kids,Robes,Robe de Noël pour mère et fille,17.32,40.79,58,31
kids,Robes,Robe en dentelle de couleur unie pour 3-11 ans,7.19,30.59,77,55
kids,Robes,Robe d'allaitement de maternité à rayures et patchwork,22.46,70.73,68,31
kids,Robes,Robe imprimée de maternité à manches courtes et col en V,24.86,78.32,68,95
kids,Tops,T-shirt fille à motif animal 1Y-7Y,11.99,24.99,52,33
kids,Salopettes & Combinaisons,Elephant Soft Barboteuse Bébé Pour 0-24M,18.39,40.99,55,104
kids,Costume & Jupe-culotte,Ensemble de vêtements 3 pièces pour fille de 1an -7ans,24.06,75.79,68,917
kids,Chaussures pour fille,Jolies chaussures plates bowknot pour filles,16.54,42.05,61,176
kids,Pantalons & Jupes,Butterfly Girls Denim Pants Pour 4Y-15Y,23.1,51,55,54
kids,Blousons & Vestes,Lettre Imprimé Denim Coats Pour 2-11Y,23.66,61.19,61,29
kids,Pulls & Sweat-shirts,"Sweat-shirt de Noël pour garçons, 2 à 9 ans",20.86,65.68,68,44
kids,Pantalons & Jupes,Polka Dot Girls Wide Leg Pants Pour 2-9Y,12.23,33.65,64,135
kids,Blousons & Vestes,Imperméable EVA à capuche pour tout-petit pour 6-11 ans,12.79,30.99,59,31
kids,Tops,"Haut d'été pour filles, épaules dénudées",15.24,47.99,68,130
kids,Pantalons & Jupes,Jean brodé pour fille de 2-11 ans,19.82,49.98,60,174
kids,Blousons & Vestes,Fleur filles Zipper Vestes Pour 2Y-9Y,17.32,46.91,63,70
kids,Robes,Tenues assorties Robe en jean à manches longues,17.13,43.84,61,31
kids,Pyjamas,Pyjama imprimé garçon Diggers pour 1-5 ans,12.39,30.98,60,7
kids,Maillots de bain,Maillot de bain fille style sport depuis 2-15 ans,14.43,30.59,53,36
kids,Robes,Robe de fille de fleur de perles pour 0-24 mois,28.88,61.19,53,124
kids,Blousons & Vestes,Manteau d'hiver filles garçons pour 3Y-11Y,34.39,71.99,52,39
kids,Robes,Robe de fille en denim de printemps et d'été,18.49,50.99,64,594
kids,Tops & T-shirt,T-shirt Garçon Imprimé Dinosaures Pour 2-9Y,15.19,47.99,68,55
kids,Blousons & Vestes,Manteau de laine à carreaux filles pour 1Y-9Y,38.5,81.6,53,28
kids,Tops & Tees,Robe de maternité taille Plus,12.23,33.65,64,133
kids,Tops,Chemise de poche à imprimé léopard pour fille 4-15Y,23.1,51,55,25
kids,Chaussures pour garçon,Entraîneurs sportifs d'absorption des chocs pour garçons,25.06,67.08,63,44
kids,Chaussures pour fille,Strass fille habiller chaussures plates,18.19,45.03,60,259
kids,Tops & T-shirt,T-shirt Garçon Imprimé Requin Pour 1-9 Ans,11.19,28.99,61,57
kids,Coutumes & Co-ords,Costume de garçon pour 2-11Y,28.79,70.99,59,18
kids,Robes,Robe ras du cou pour fille 2-11ans,22.39,53.99,59,106
kids,Robes,Robe de maternité sexy en dentelle,17.59,43.99,60,60
kids,Robes,Robe de mariée en dentelle pour fille,34.39,84.99,60,132
kids,Tops,Sweat-shirt imprimé à arbre top pour enfant,14.39,32.99,56,127
kids,Tops & T-shirt,T-shirts à manches courtes Dinosaur pour garçons de 2 à 11 ans,10.6,25.08,58,56
kids,Robes,Robes 3D Fleur Filles,22.02,54.36,60,180
kids,Tops,T-shirt en coton à rayures pour filles,17.88,46.03,61,105
kids,Culottes de grossesse,Culotte de grossesse à taille haute ajustable,6.14,15.33,60,340
kids,Costume & Jupe-culotte,2pcs filles en mousseline de soie floral ensemble court pour 2-9Y,17.65,55.57,68,149
kids,Sweaters & Hoodies,Pull mignon filles motif ours,19.99,47.99,58,167
kids,Costume & Jupe-culotte,Style chinois fille garçon met Set 2Y-11Y,22.99,46.92,51,142
kids,Salopettes & Combinaisons,Barboteuse de bébé de bande dessinée pour 0-24M,14.39,40.99,65,45
kids,Robes,Maxi-robe de maternité sexy,17.29,43.85,61,274
kids,Vêtements de nuit,Ensemble de pyjama assorti en famille 2 pièces,25.99,61.19,58,70
kids,Robes,Robes tissées à imprimé chat pour 10-15 ans,14.43,45.46,68,225
kids,Maillots de bain,Maillot de bain rayé noeud-noeud pour 2-15Y,16.36,34.67,53,14
kids,Robes,Robe à fleurs pour filles pour 1Y-11Y,13.05,40.79,68,299
kids,Costume & Jupe-culotte,3pcs imprimé garçons vêtements pour filles ensemble 1Y-4Y,19.19,39.99,52,82
kids,Robes,Robe à imprimé floral en dentelle pour fille,19.25,40.8,53,236
kids,Tops & T-shirt,T-shirt imprimé de lettre de famille assorti,10.39,34.67,70,174
kids,Blousons & Vestes,Imperméable dinosaure enfant en bas âge pour 1Y-7Y,23.1,51,55,111
kids,Coutumes & Co-ords,Combinaison Halloween Boys pour 3Y-10Y,17.19,36.72,53,45
kids,Vêtements de nuit,Ensemble de pyjama assorti à la famille,25.99,61.19,58,52
kids,Sweaters & Hoodies,Dessus de poche à capuchon pour enfants pour 6Y-15Y,33.59,71.4,53,71
kids,Blousons & Vestes,Filles Garçons Imprimer Manteaux D'hiver Pour 2Y-9Y,32.73,69.36,53,100
kids,Tops & Tees,Chemisier décontracté à col rond et manches évasées,3.19,26,88,139
kids,Chaussures pour fille,Chaussures habillées bowknot avec motif de chat pour filles,14.5,39.26,63,102
kids,Robes,Floral Girl Dress Sets pour 0-3ans,21.18,50.99,59,52
kids,Robes,Grossesse Femmes Robe Imprimée Col V,23.34,57.12,59,124
kids,Chaussures pour garçon,Chaussures de sport camouflage confortables pour garçons,19.93,46.48,57,152
kids,Maillots de bain,Ensembles de bikini de filles de volants pour 2-15Y,18.29,38.75,53,16
kids,Costumes pour bébé,Baby Denim Barboteuse Sans Manche 0-24M,17.32,40.79,58,58
kids,Chaussures pour fille,Chaussures décontractées respirantes pour enfants,18.52,45,59,53
kids,Blousons & Vestes,Toddler Tassel Raincoat Transparent Pour 1-7Y,13.59,31.99,58,29
kids,Culottes de grossesse,Culotte de nuit en coton et dentelle,6.11,15.28,60,8
kids,Blousons & Vestes,Doudoune à capuche pour fille et garçon pour 3-11 ans,26.66,66.64,60,15
kids,Tops & T-shirt,Tops à manches longues Sport Boys Pour 2Y-12Y,15,35.87,58,120
kids,Salopettes & Combinaisons,Combishort bébé animal mignon pour 0-18M,18.45,58.1,68,371
kids,Chapeaux,Bonnet de bain imprimé garçon fille,8.02,25.25,68,83
kids,Chapeaux,Chapeau de baseball à broderies en coton solide Kids Boys Girls [*}] -dry Casquette Sunshade Outdoor Sports,7.58,17.22,56,11
kids,Chaussures pour garçon,Chaussures en cuir pour enfants,9.59,18.24,47,61
kids,Brassières de grossesse,Soutien-gorge d'allaitement sans fil,9.59,29.99,68,346
kids,Costumes pour bébé,Ensembles confortables 2 pièces pour 0-24M,18.39,40.99,55,144
kids,Maillots de bain,Ensembles de bikini sirène bébé fille,11.42,28.14,59,25
kids,Tops,T-shirt à manches longues pour filles,13.58,33.55,60,37
kids,Robes,Robe princesse élégante pour fille de 2-9 ans,28.79,60.99,53,129
kids,Coutumes & Co-ords,2pcs garçons ensembles de camouflage pour 6Y-15Y,35.62,76.5,53,81
kids,Chaussures pour garçon,Sandales confortables à semelle souple pour garçon,19.42,46.51,58,63
kids,Chapeaux,Casquette de baseball pour enfants,9.02,21.39,58,72
kids,Costumes pour bébé,Hélicoptère Bébé Garçons Court Set Pour 0-36M,18.39,37.99,52,150
kids,Tops & Tees,T-shirt de dessus de maternité de coton doux drôle pour des femmes enceintes,14.7,40.79,64,258
kids,Accesssoires des vêtements,Robe de bain mignonne avec motif animalière en flanelle pour enfants,26.39,54.99,52,65
kids,Costume & Jupe-culotte,Ensemble de filles rayé 3Y-11Y,15.1,32.64,54,184
kids,Chaussures pour bébé,Chaussures de bébé anti-dérapantes douces pour les 0-24 mois,13.59,28.99,53,131
kids,Robes,Strawberry Girls Romper Robe Pour 0-24M,12.23,34.67,65,119
kids,Salopettes & Combinaisons,Ensemble de combinaison de filles imprimées 2Pcs pour 0-24M,13.47,30.59,56,147
kids,Costumes pour bébé,Lovely Baby Set Vêtements Pour 0-36M,15.4,36.71,58,97
kids,Costume & Jupe-culotte,Ensemble de vêtements pour filles à rayures 2 pièces,24.06,75.79,68,340
kids,Blousons & Vestes,Manteau zippé à capuche avec dinosaure pour garçon 2-11Y,19.25,40.8,53,23
kids,Robes,Bunny Tie Bow - Robe plissée pour filles,24.06,51,53,133
kids,Blousons & Vestes,Manteau mignon filles oreilles pour 2Y-9Y,38.5,81.6,53,58
kids,Blousons & Vestes,Manteaux de laine d'hiver des filles pour 6Y-15Y,45.25,101.99,56,115
kids,Tops,T-shirt à manches longues imprimé requins pour 2-11Y,12.51,28.56,56,37
kids,Chaussures pour fille,Chaussures décontractées confortables de couleur bonbon pour filles pour garçons,24.71,60.06,59,63
kids,Chaussures pour fille,Chaussures unisexes pour enfants en toile,14.66,41,64,144
kids,Sets de coutumes,Combinaison en mousseline à épaules dénudées,28.54,71.39,60,53
kids,Pulls & Sweat-shirts,Sweat-shirt Épais pour Garçon Imprimé Lettre 1Y-7Y,20.39,53.04,62,37
kids,Sweaters & Hoodies,"Pull à paillettes pour fille, 2-11 ans",18.39,44.99,59,6
kids,Pantalons & Jupes,"Pantalon à motif arc-en-ciel pour fille, 1-9 ans",11.19,27.99,60,21
kids,Tops,Sweat-shirt Licorne Arc-En-Garçon Pour 1-9Y,10.6,25.48,58,23
kids,Salopettes & Combinaisons,Pyjama de vêtements assortis pour la famille,16.31,40.78,60,36
kids,Robes,Robes confortables de motif de chat de coeur de filles,16.79,38.99,57,62
kids,Pantalons,Pantalon Garçon Sport Rayé Pour 2Y-11Y,14.68,35.19,58,126
kids,Pantalons & Jupes,Sport style garçons filles pantalons pour 4Y-15Y,19.58,47.43,59,35
kids,Blousons & Vestes,Manteau à capuche fille imprimé floral,21.18,43.54,51,41
kids,Costume & Jupe-culotte,Pantalon OL Style Girl Set Pour 2-9Y,19.25,43.03,55,102
kids,Blousons & Vestes,Veste à rayures blouson pour enfant,31.32,75.29,58,130
kids,Vêtements de nuit,Ensemble de pyjama Star Print Boys Girls,25.78,61.02,58,59
kids,Pantalons & Jupes,Legging Jupes Filles Enfants,25.95,61.41,58,83
kids,Robes,Robe évidée pour filles,32.61,85.43,62,124
kids,Costume & Jupe-culotte,Costume col rond sans manches pour enfants avec motif floral,26.16,61.69,58,87
kids,Trousses,Étui à crayons décontracté pour impression sur toile avec 36 trous et sac de rangement pour stylo à bille,10.21,24.08,58,94
kids,Chaussures pour garçon,Youth Sandales de plage confortables en cuir pour garçons,25.97,62.14,58,55
kids,Robes,Filles A Line Ruffles au bas de la robe longue,26.5,57.84,54,72
kids,Costumes pour bébé,Ensemble de vêtements en coton épais pour bébés pendant 0 à 3 ans,16.36,34.67,53,69
kids,Salopettes & Combinaisons,Combinaison Bébé Motif Zèbre Pour 0-24M,28.56,69.69,59,93
kids,Costume & Jupe-culotte,Fox Pattern Set De Vêtements Pour Filles Pour 3Y-15Y,25.02,53.04,53,34
kids,Chaussures pour garçon,Sandales de plage confortables assorties pour garçons,14,33.86,59,109
kids,Vêtements de nuit & Robes,Soft Couverture de bébé en flanelle,21.21,54.05,61,87
kids,Robes,Robe à imprimé animalière pour 2-9 ans,18.45,58.1,68,61
kids,Costume & Jupe-culotte,Ensemble de vêtements pour filles vintage pour 6Y-15Y,43.19,91.99,53,80
kids,Costume & Jupe-culotte,2pcs animaux filles ensembles de pantalons pour 1Y-5Y,17.31,36.71,53,79
kids,Coutumes & Co-ords,Garçons de dessins animés shorts ensembles 1Y-9Y,16.36,34.68,53,89
kids,Swimwear,Maillot de bain garçon maillot de bain 3Y-9Y,10.58,22.44,53,17
kids,Coutumes & Co-ords,4pcs garçons ensembles officiels 1Y-9Y,28.88,61.2,53,119
kids,Coutumes & Co-ords,Ensemble de vêtements d'été pour garçons,23.99,49.99,52,68
kids,Costumes pour bébé,Ensembles de coton pour filles 3Pcs Letter pour 0-24M,15.99,39.99,60,99
kids,Salopettes & Combinaisons,Barboteuse en coton solide pour 0-24m,13.06,32.64,60,25
kids,Blousons & Vestes,Col montant garçons gilet pour 4Y-13Y,23.1,48.96,53,32
kids,Sweaters & Hoodies,Pulls à capuche pour filles décontractés pour 2Y-11Y,17.32,36.72,53,50
kids,Chaussures pour garçon,Pantoufles de plage avec coutures pures pour garçons,12.35,30.89,60,51
kids,Costumes pour bébé,Ensemble de jupes de fleurs pour 0-2 ans,15.5,40.79,62,133
kids,Pantalons & Jupes,Colorful Jupe Pompon Fille Tutu Pour 1-9Y,10.6,29.57,64,169
kids,Robes,Robe caraco fille pour ballet 2-11Y,3.99,30.59,87,73
kids,Salopettes & Combinaisons,Comfy Imprimé Bébé Barboteuse Pour 0-24 M,15.4,32.63,53,69
kids,Chaussures pour garçon,Chaussures de sport unisexes avec crochet pour enfants,15.65,37.2,58,89
kids,Costume & Jupe-culotte,Combinaison à imprimé floral pour filles 1-9 ans,11.99,29.98,60,34
kids,Costume & Jupe-culotte,Ensemble de filles élégantes à volants pour 2-9 ans,13.05,36.71,65,88
kids,Salopettes & Combinaisons,Ensemble de rayures arc-en-ciel pour filles 3 pièces pour 0-24M,14.39,34.99,59,21
kids,Vêtements de nuit,Pyjama en flanelle pour bambin de dessin animé pour enfant de 1 à 7 ans,20.79,50.99,59,29
kids,Tops & Tees,Pull d'allaitement ample à capuchon ,20.39,50.98,60,9
kids,Salopettes & Combinaisons,Barboteuse 6 couleurs Soft pour 0-24M,13.05,40.78,68,41
kids,Robes,Toddler Girls Casual Dress Pour 1-9Y,17.59,43.99,60,51
kids,Sweaters & Hoodies,Pull à capuche pour tout-petit pour 1-5 ans,15.5,37.72,59,72
kids,Robes,Robe de bande dessinée de fleur de fille pour 1-9Y,15.99,38.99,59,118
kids,Robes,Robe Fille Rayée Pour 1-9Y,19.19,46.99,59,45
kids,Costumes pour bébé,Ensemble de pyjama de vêtements assortis pour la famille 2Pcs,13.86,34.66,60,33
kids,Sweaters & Hoodies,Sweat à capuche fille à imprimé licorne pour 3-11 ans,17.54,43.84,60,5
kids,Robes,Robe de soirée vintage à rayures pour filles,30.39,68.99,56,226
kids,Robes,Robes bébé fille imprimé fleur pour 0-24M,16.79,35.99,53,282
kids,Salopettes & Combinaisons,Barboteuse Unisexe Pour 0M-4Y,16.84,53.04,68,250
kids,Salopettes & Combinaisons,Combinaison d'été bébé lapin oreille pour 0-18M,18.45,58.1,68,317
kids,Costume & Jupe-culotte,Ensemble de vêtements t-shirt + pantalon pour fille,27.99,61.99,55,172
kids,Culottes de grossesse,Soft Culotte de maternité respirante et respirante,5.94,16.89,65,74
kids,Robes,Paillettes plissées patchwork robe de princesse col rond sans manches pour enfants fille,20.41,48.15,58,104
