category,subcategory,name,current_price,raw_price,discount,likes_count
kids,Sandals,Sandales d'eau à bout fermé à séchage rapide pour enfants unisexe,16.2,32.4,50,45
kids,Culottes de grossesse,Lot de 3 Culottes en Coton Pure Elastique Convenable pour Maternité,23.06,58.1,60,202
kids,Culottes de grossesse,Sous-vêtements de maternité confortables taille haute,14.03,35.35,60,153
kids,Sandals,Unisexe Kids Comfy antidérapant jardin chaussures de sabot d'eau de jardin,6.99,13,46,60
kids,Chaussures pour garçon,Sandales de plage légères pour garçon,12.45,22,43,158
kids,Robes,Robe fille licorne papillon pour 4-13 ans,9.99,26.99,63,914
kids,Robes,Girls Unicorn Rainbow Stripe Print Short-sleeved Casual Dress For 3-8Y,19.99,39.98,50,42
kids,Brassières de grossesse,Soutien-gorge d'allaitement sans fil anti-affaissement en dentelle,10.02,25.25,60,1220
kids,Pantalons & Jupes,Jeans brodé chat fille pour 3-15 ans,18.04,45.46,60,670
kids,Costumes pour bébé,18pcs nouveau-né baby shower coffret pour 0-6m,45.12,113.7,60,350
kids,Pantalons & Jupes,Combinaison dos nu fille pour 3Y-11Y,20.05,50.52,60,686
kids,Brassières de grossesse,Brassière de grossesse en couleur pure,15.03,37.88,60,318
kids,Pantalons & Jupes,Combinaison à fleurs Bohème pour filles,24.06,60.63,60,667
kids,Robes,Robe de fleur de princesse fille 2PCs pour 1-7Y,32.09,80.84,60,171
kids,Robes,Filles Robe Grise Plissée Pour 4Y-15Y,49.14,123.8,60,752
kids,Robes,Filles Sling Sun Print Dress mignon pour 2-9Y,15.03,37.88,60,263
kids,Robes,Robe mère-fille fleurie assortie,23.99,39.99,40,104
kids,Salopettes & Combinaisons,Barboteuses d'impression de bande dessinée de bébé pour 0-18M,18.04,45.46,60,89
kids,Pantalons & Jupes,Combinaisons Dot Design Girls pour 2Y-11Y,26.07,65.68,60,1045
kids,Maillots de bain,Ensemble de maillots de bain 3 pièces pour fille de 4ans - 13ans,24.06,60.63,60,429
kids,Coutumes & Co-ords,Ensembles de vêtements pour tout-petits garçons pour 3-11 ans,23.06,58.1,60,531
kids,Tops & T-shirt,T-shirt garçon imprimé crocodile pour 2-8 ans,9.49,18.98,50,30
kids,Brassières de grossesse,Brassière de grossesse en coton souple respirante,14.03,35.35,60,1161
kids,Robes,Robe de princesse fille licorne pour 3-13 ans,29.08,73.26,60,977
kids,Tops & T-shirt,T-shirt d'été pour garçon dinosaure pour 2-10 ans,11.52,29.04,60,44
kids,Costume & Jupe-culotte,Ensemble d'impression de tournesol pour fille pour 1-7 ans,18.49,36.98,50,73
kids,Pyjamas,Pyjama rayé dinosaure garçon pour 1 à 7 ans,17.49,34.98,50,29
kids,Robes,Robe pour fille de 2-8 ans,28.07,70.73,60,602
kids,Flats & Loafers,Unisexe Enfants Comfy Respirant Soft Semelle Décontractée Slip On Chaussures Plates,18,40.99,56,20
kids,Robes,Robe à bretelles Flower Girl pour 1 à 7 ans,20.05,50.52,60,327
kids,Sandals,Unisexe Kids Classic Tie-Dye Hole Garden Water Clog Shoes,12.42,23.84,48,9
kids,Brassières de grossesse,Soutien-gorge d'allaitement maternité boutonné devant,19.05,47.99,60,333
kids,Costume & Jupe-culotte,Ensemble gilet et pantalon à volants pour fille pour 1-7 ans,18.55,36.98,50,91
kids,Brassières de grossesse,Soutien-gorge d'allaitement maternité confortable,14.03,35.35,60,325
kids,Salopettes & Combinaisons,Gigoteuse chaude et velours pour 0-24M,21.05,53.04,60,318
kids,Robes,Soft Robe de fillette en coton 2Y-11Y,27.07,68.21,60,416
kids,Chaussures pour garçon,Chaussures causales à boucles à crochets respirantes unisexe,30.49,51.12,40,442
kids,Blousons & Vestes,Veste de forage imprimée en denim pour fille de 1 à 15 ans,30.08,75.79,60,232
kids,Tops,T-shirt à 3D imprimé pour enfant de 1-9 ans,17.04,42.94,60,423
kids,Costume & Jupe-culotte,Ensembles de vêtements floraux pour 2-9 ans,22.06,55.57,60,644
kids,Brassières de grossesse,Brassière de grossesse,10.02,25.25,60,2148
kids,Robes,Flower Girls Casual Dress Pour 2-11Y         ,22.06,55.57,60,233
kids,Pantalons,Short de sport pour garçon animalier pour 2Y-11Y,25.06,63.15,60,188
kids,Robes,Robe de dessin animé pour fille de 2-9 ans,19.05,47.99,60,618
kids,Robes,Robe à volants à fleurs bleues pour fille 3-10 ans,17.99,35.98,50,30
kids,Robes,Princesse Layered Girls Dress Pour 3Y-11Y,33.38,84.1,60,383
kids,Blousons & Vestes,Manteau Trench Imperméable pour Enfant Garçon Fille,29.08,73.26,60,941
kids,Robes,Casual Robe imprimée à col en V pour 4-15Y,21.05,53.04,60,243
kids,Robes,Fleur filles robe en mousseline de soie pour 4Y-15Y,23.06,58.1,60,956
kids,Robes,Vintage filles lâche robe pour 4-15 ans,25.06,63.15,60,283
kids,Chaussures pour fille,Filles toile dessin animé belles chaussures de sport,24.49,44.41,45,307
kids,Costume & Jupe-culotte,Panda Pattern Girls Ensembles décontractés pour 3-11Y,24.53,61.81,60,430
kids,Coutumes & Co-ords,Ensembles de shorts en lin et coton pour garçons 2-7 ans,22.06,55.57,60,442
kids,Costume & Jupe-culotte,Ensemble à carreaux à volants pour fille pour 1-7 ans,16.54,41.67,60,41
kids,Salopettes & Combinaisons,Barboteuse en denim de dessin animé pour 0-24 mois,27.07,68.21,60,417
kids,Robes,Robe à imprimé papillon pour fille pour 2-8 ans,17.99,35.98,50,20
kids,Robes,Robe de princesse pour filles à gros nœud pour 1Y-7Y,31.08,78.32,60,471
kids,Chaussures pour fille,Chaussures de loisirs pour filles avec crochet en maille,15.1,26.6,43,545
kids,Coutumes & Co-ords,Ensembles de vêtements pour garçons de loisirs pour 2Y-7Y,23.06,58.1,60,357
kids,Sandals,Sandales d'eau à bout fermé à séchage rapide pour enfants unisexe,16.2,32.4,50,45
kids,Culottes de grossesse,Lot de 3 Culottes en Coton Pure Elastique Convenable pour Maternité,23.06,58.1,60,202
kids,Culottes de grossesse,Sous-vêtements de maternité confortables taille haute,14.03,35.35,60,153
kids,Sandals,Unisexe Kids Comfy antidérapant jardin chaussures de sabot d'eau de jardin,6.99,13,46,60
kids,Chaussures pour garçon,Sandales de plage légères pour garçon,12.45,22,43,158
kids,Robes,Robe fille licorne papillon pour 4-13 ans,9.99,26.99,63,914
kids,Robes,Girls Unicorn Rainbow Stripe Print Short-sleeved Casual Dress For 3-8Y,19.99,39.98,50,42
kids,Brassières de grossesse,Soutien-gorge d'allaitement sans fil anti-affaissement en dentelle,10.02,25.25,60,1220
kids,Pantalons & Jupes,Jeans brodé chat fille pour 3-15 ans,18.04,45.46,60,670
kids,Costumes pour bébé,18pcs nouveau-né baby shower coffret pour 0-6m,45.12,113.7,60,350
kids,Pantalons & Jupes,Combinaison dos nu fille pour 3Y-11Y,20.05,50.52,60,686
kids,Brassières de grossesse,Brassière de grossesse en couleur pure,15.03,37.88,60,318
kids,Pantalons & Jupes,Combinaison à fleurs Bohème pour filles,24.06,60.63,60,667
kids,Robes,Robe de fleur de princesse fille 2PCs pour 1-7Y,32.09,80.84,60,171
kids,Robes,Filles Robe Grise Plissée Pour 4Y-15Y,49.14,123.8,60,752
kids,Robes,Filles Sling Sun Print Dress mignon pour 2-9Y,15.03,37.88,60,263
kids,Robes,Robe mère-fille fleurie assortie,23.99,39.99,40,104
kids,Salopettes & Combinaisons,Barboteuses d'impression de bande dessinée de bébé pour 0-18M,18.04,45.46,60,89
kids,Pantalons & Jupes,Combinaisons Dot Design Girls pour 2Y-11Y,26.07,65.68,60,1045
kids,Maillots de bain,Ensemble de maillots de bain 3 pièces pour fille de 4ans - 13ans,24.06,60.63,60,429
kids,Coutumes & Co-ords,Ensembles de vêtements pour tout-petits garçons pour 3-11 ans,23.06,58.1,60,531
kids,Tops & T-shirt,T-shirt garçon imprimé crocodile pour 2-8 ans,9.49,18.98,50,30
kids,Brassières de grossesse,Brassière de grossesse en coton souple respirante,14.03,35.35,60,1161
kids,Robes,Robe de princesse fille licorne pour 3-13 ans,29.08,73.26,60,977
kids,Tops & T-shirt,T-shirt d'été pour garçon dinosaure pour 2-10 ans,11.52,29.04,60,44
kids,Costume & Jupe-culotte,Ensemble d'impression de tournesol pour fille pour 1-7 ans,18.49,36.98,50,73
kids,Pyjamas,Pyjama rayé dinosaure garçon pour 1 à 7 ans,17.49,34.98,50,29
kids,Robes,Robe pour fille de 2-8 ans,28.07,70.73,60,602
kids,Flats & Loafers,Unisexe Enfants Comfy Respirant Soft Semelle Décontractée Slip On Chaussures Plates,18,40.99,56,20
kids,Robes,Robe à bretelles Flower Girl pour 1 à 7 ans,20.05,50.52,60,327
kids,Sandals,Unisexe Kids Classic Tie-Dye Hole Garden Water Clog Shoes,12.42,23.84,48,9
kids,Brassières de grossesse,Soutien-gorge d'allaitement maternité boutonné devant,19.05,47.99,60,333
kids,Costume & Jupe-culotte,Ensemble gilet et pantalon à volants pour fille pour 1-7 ans,18.55,36.98,50,91
kids,Brassières de grossesse,Soutien-gorge d'allaitement maternité confortable,14.03,35.35,60,325
kids,Salopettes & Combinaisons,Gigoteuse chaude et velours pour 0-24M,21.05,53.04,60,318
kids,Robes,Soft Robe de fillette en coton 2Y-11Y,27.07,68.21,60,416
kids,Chaussures pour garçon,Chaussures causales à boucles à crochets respirantes unisexe,30.49,51.12,40,442
kids,Blousons & Vestes,Veste de forage imprimée en denim pour fille de 1 à 15 ans,30.08,75.79,60,232
kids,Tops,T-shirt à 3D imprimé pour enfant de 1-9 ans,17.04,42.94,60,423
kids,Costume & Jupe-culotte,Ensembles de vêtements floraux pour 2-9 ans,22.06,55.57,60,644
kids,Brassières de grossesse,Brassière de grossesse,10.02,25.25,60,2148
kids,Robes,Flower Girls Casual Dress Pour 2-11Y         ,22.06,55.57,60,233
kids,Pantalons,Short de sport pour garçon animalier pour 2Y-11Y,25.06,63.15,60,188
kids,Robes,Robe de dessin animé pour fille de 2-9 ans,19.05,47.99,60,618
kids,Robes,Robe à volants à fleurs bleues pour fille 3-10 ans,17.99,35.98,50,30
kids,Robes,Princesse Layered Girls Dress Pour 3Y-11Y,33.38,84.1,60,383
kids,Blousons & Vestes,Manteau Trench Imperméable pour Enfant Garçon Fille,29.08,73.26,60,941
kids,Robes,Casual Robe imprimée à col en V pour 4-15Y,21.05,53.04,60,243
kids,Robes,Fleur filles robe en mousseline de soie pour 4Y-15Y,23.06,58.1,60,956
kids,Robes,Vintage filles lâche robe pour 4-15 ans,25.06,63.15,60,283
kids,Chaussures pour fille,Filles toile dessin animé belles chaussures de sport,24.49,44.41,45,307
kids,Costume & Jupe-culotte,Panda Pattern Girls Ensembles décontractés pour 3-11Y,24.53,61.81,60,430
kids,Coutumes & Co-ords,Ensembles de shorts en lin et coton pour garçons 2-7 ans,22.06,55.57,60,442
kids,Costume & Jupe-culotte,Ensemble à carreaux à volants pour fille pour 1-7 ans,16.54,41.67,60,41
kids,Salopettes & Combinaisons,Barboteuse en denim de dessin animé pour 0-24 mois,27.07,68.21,60,417
kids,Robes,Robe à imprimé papillon pour fille pour 2-8 ans,17.99,35.98,50,20
kids,Robes,Robe de princesse pour filles à gros nœud pour 1Y-7Y,31.08,78.32,60,471
kids,Chaussures pour fille,Chaussures de loisirs pour filles avec crochet en maille,15.1,26.6,43,545
kids,Coutumes & Co-ords,Ensembles de vêtements pour garçons de loisirs pour 2Y-7Y,23.06,58.1,60,357
kids,Brassières de grossesse,Soutien-gorge d'allaitement à rayures devant,21.05,53.04,60,51
kids,Brassières de grossesse,Soutien-gorge de maternité imprimé sans fil,16.04,40.41,60,119
kids,Coutumes & Co-ords,2pcs noël garçon vêtements set 2-11y,40.11,101.06,60,290
kids,Tops & Tees,Chemise décontractée confortable pour femmes enceintes,22.06,55.57,60,123
kids,Costume & Jupe-culotte,Ensemble sans manches à imprimé floral pour fille pour 2-7 ans,16.54,32.98,50,22
kids,Vêtements de nuit,Baby Boys filles vêtements de nuit à manches longues,27.07,68.21,60,354
kids,Maillots de bain,Swan Imprimé Maillots de bain pour filles avec un chapeau,21.05,53.04,60,216
kids,Pyjamas,Pyjama garçon à imprimé animal pour 1-5 ans,13.49,26.98,50,12
kids,Sous-vêtements de maintien de grossesse,Femme confortable amincissant taille ventre ventre,15.03,37.88,60,205
kids,Slippers,Unisexe enfants ange ailes décor antidérapant Soft semelle mignon pantoufles,8.26,18.36,55,2
kids,Slippers,Pantoufles antidérapantes unisexe pour enfants mignons petits animaux,12.07,26.82,55,2
kids,Slippers,Pantoufles à la maison antidérapantes pour enfants unisexes,9.32,20.71,55,2
kids,Trainers,Baskets respirantes en dentelle élastique pour garçons,30.33,67.4,55,3
kids,Trainers,Unisexe Enfants Soft Wide Fit Casual Chunky Sneakers,29.78,66.18,55,3
kids,Sneakers,Unisexe Enfants Daisy Pattern Colorblock Soft Casual Sneakers,30.88,68.62,55,3
kids,Trainers,Unisexe Enfants Antidérapant Classic Blanc Baskets Chaussures,23.99,53.33,55,2
kids,Sneakers,Unisexe Colorblock Soft Baskets de course antidérapantes,22.05,49,55,3
kids,Flats & Loafers,Mocassins plats de danse scolaire à lacets pour filles,23.44,52.09,55,1
kids,Trainers,Garçons Comfy Breatahble Knitted Soft Baskets de course antidérapantes,25.99,69.87,63,2
kids,Trainers,Baskets décontractées portables en tissu maille pour garçons,25.99,69.87,63,2
kids,Maillots de bain,Ensemble de 3 pièces de maillots de bain queue de sirène pour fille de 4ans-13ans,31.99,64.99,51,264
kids,Costumes pour bébé,Barboteuse à manches longues dinosaure pour 0-24M,30.99,54.99,44,117
kids,Sandals,Sandales de plage unisexe pour enfants,13.52,30.04,55,3
kids,Sneakers,Unisexe Enfants Élastique Bande Tricoté Soft Slip On Sneakers,20.99,57.58,64,4
kids,Maillots de bain,Maillot de bain à volants uni,19.55,49.25,60,25
kids,Chaussures pour fille,Jolies chaussures plates pour filles avec cerises,17.13,34.19,50,137
kids,Robes,Robe de plumes à manches longues pour filles 4-15Y,25.99,43.99,41,62
kids,Brassières de grossesse,Soutien-gorge confortable sans fil,21.05,53.04,60,71
kids,Brassières de grossesse,Soutien-gorge de maternité à imprimé floral,14.03,35.35,60,128
kids,Brassières de grossesse,Soutien-gorge d'allaitement anti-relâchement en dentelle,18.04,45.46,60,81
kids,Salopettes & Combinaisons,Barboteuses de dessin animé mignon paresseux bébé pour 0-24M,17.04,42.94,60,38
kids,Brassières de grossesse,Soutien-gorge d'allaitement sans manches en dentelle de maternité,18.99,35.99,47,10
kids,Brassières de grossesse,Soutien-gorge nursing sexy en dentelle à fermeture avant,24.06,60.63,60,161
kids,Culottes de grossesse,"Culotte de shorty enceinte pour garçons, respirante et modale, respirante et confortable",12.03,30.3,60,53
kids,Robes,Robe à pois pour femmes enceintes,26.57,66.94,60,20
kids,Bas,Pantalon anti-moustique Baby Daisy pour 6-24M,13.53,26.98,50,11
kids,Costume & Jupe-culotte,Hauts imprimés pour filles + jupe rayée pour 1-8 ans,19.99,39.98,50,12
kids,Tops & T-shirt,T-shirt rayé de bande dessinée garçon pour 2-10 ans,8.99,17.98,50,1
kids,Slippers,Unisexe Enfants Salle De Bains Antidérapant Soft Pantoufles Domestiques Semelles,9.82,21.82,55,2
kids,Trainers,Garçons LED Baskets Light Comfy Antidérapantes Classic,31.44,69.87,55,2
kids,Tops & T-shirt,T-shirt à imprimé de bande dessinée pour garçon 2-10 ans,8.99,17.98,50,1
kids,Flats & Loafers,Filles Plaid Canvas Daisy Jelly Sole Soft Chaussures Plates,21.45,47.67,55,1
kids,Sneakers,Chaussures de skate rayées à boucle à crochet pour fille,26.99,69.87,61,2
kids,Trainers,Espadrilles épaisses en tissu tricoté rétro pour garçons,25.99,69.87,63,3
kids,Trainers,Baskets larges unisexes respirantes pour enfants,27.99,78.44,64,2
kids,Sneakers,Baskets à boucle à crochet en tissu tricoté à paillettes pour fille,25.99,71.11,64,4
kids,Robes,Robe de fille décontractée à fleurs pour 1-9Y,22.06,55.57,60,66
kids,Robes,Robe de soirée à sequins avec noeud pour 1-7Y,30.08,54.99,45,57
kids,Costumes pour bébé,Ensembles de pantalons bébé à bretelles pour 0-24M,29.99,49.99,40,120
kids,Robes,Robe fleurie à manches évasées pour filles de 6 à 15 ans,40.11,101.06,60,165
kids,Trainers,Baskets respirantes en tissu tricoté à rayures pour garçons,33.64,74.76,55,2
kids,Blousons & Vestes,Manteau d'hiver de filles en fausse fourrure pour 2Y-11Y,38.21,96.28,60,322
kids,Chaussures pour bébé,Canvas Stripe Slip On Shoes Pour 0-24M,18.99,30.99,39,156
kids,Sneakers,Chaussures décontractées de sport unisexe pour enfants,23.99,66.18,64,2
kids,Trainers,Unisexe Enfants Lettre Patch Décor À Lacets Baskets,23.99,66.18,64,2
kids,Trainers,Baskets à bouts anti-collision tricotés pour garçons,23.99,66.18,64,2
kids,Brassières de grossesse,Soutien-gorge de sommeil infirmier sans fil ,19.05,47.99,60,107
kids,Costume & Jupe-culotte,Ensemble de shorts pour garçons vintage pour filles 2Y-11Y,34.09,85.9,60,390
kids,Robes,Robe en tulle en couches pour fillette de 2ans - 9ans,32.09,80.84,60,403
kids,Salopettes & Combinaisons,Barboteuse en coton pour garçons de 0 à 24 mois,19.05,47.99,60,194
kids,Robes,Robe imprimée épaules dénudées pour filles 1Y-9Y,20.99,34.99,40,44
kids,Robes,Robe florale sans manches pour fille de 2 à 11 ans,25.06,63.15,60,271
kids,Tops,T-shirt décontracté à pois pour filles de 3 à 12 ans,25.06,41.99,40,73
kids,Sweaters & Hoodies,Chandail en tricot patchwork pour filles pour 1Y-7Y,29.99,49.99,40,41
kids,Robes,Robe fleurie paillettes fille pour 4-13 ans,30.66,58.99,48,46
kids,Costume & Jupe-culotte,Ensemble de fleurs orange pour fille de 3 pièces pour 1-5 ans,23.06,58.1,60,26
kids,Chapeaux,Chapeau Béret Newsboy Lettre de broderie enfants,11.58,22.17,48,116
kids,Sneakers,Baskets décontractées antidérapantes pour enfants unisexes,15.45,66.67,77,4
kids,Brassières de grossesse,Soutien-gorge d'allaitement sans fil en dentelle de maternité,18.99,37.98,50,1
kids,Pantalons & Jupes,Pantalon imprimé lettre pour garçon 2-8 ans,19.99,39.98,50,2
kids,Coutumes & Co-ords,Hauts pour garçon + short en jean pour 1-5 ans,18.04,35.98,50,19
kids,Pyjamas,Pyjama garçon imprimé baleine pour 6-11 ans,18.04,45.46,60,19
kids,Slippers,Pantoufles antidérapantes unisexes pour enfants,9.37,20.82,55,2
kids,Slippers,Pantoufles antidérapantes pour enfants unisexe,8.26,18.36,55,2
kids,Slippers,Pantoufles à la maison antidérapantes pour enfants unisexes,10.37,23.04,55,2
kids,Trainers,Baskets décontractées antidérapantes confortables à motif géométrique pour garçons,29.78,66.18,55,1
kids,Coutumes & Co-ords,Ensemble imprimé football garçon pour 1-7 ans,11.99,23.98,50,3
kids,Tops & T-shirt,T-shirt à imprimé cactus pour garçon 2-10 ans,8.99,17.98,50,0
kids,Pulls & Sweat-shirts,Sweat à imprimé dinosaure pour garçon 2-10 ans,15.99,31.98,50,0
kids,Flats & Loafers,Filles à bout carré à boucles multiples Bande Chaussures plates princesse à tige haute,23.16,51.47,55,2
kids,Flats & Loafers,Mocassins de princesse en tissu à carreaux rétro,21.78,48.4,55,1
kids,Trainers,Baskets épaisses respirantes tricotées à motif de lettres pour garçons,25.99,69.87,63,3
kids,Sneakers,Tissu tricoté pour filles Soft Baskets décontractées respirantes,23.99,64.96,63,2
kids,Robes,Girls Cute Cartoon Floral Print Short-sleeved Casual Dress For 2-7Y,16.99,33.98,50,7
kids,Robes,Girls Unicorn Rainbow Striped Print Short-sleeved Casual Dress For 3-8Y,18.99,37.98,50,12
kids,Pantalons & Capris,Femmes enceintes Soft Pencil Un pantalon,34.09,85.9,60,40
kids,Sweaters & Hoodies,Chandail d'impression 3D de Noël pour tout-petits pour 4-13 ans,24.06,60.63,60,25
kids,Trainers,Garçon à rayures avec détail tricoté Soft - Baskets décontractées à semelle,23.99,66.18,64,1
kids,Chaussures pour garçon,Sandales de plage décontractées pour enfants,19.68,39.71,50,49
kids,Pantalons & Jupes,Jupe décontractée en dentelle à pois pour fille pour 2-8 ans,13.99,27.98,50,6
kids,Brassières de grossesse,Soutien-gorge respirant de maternité fermeture frontale,17.04,42.94,60,30
kids,Brassières de grossesse,Soutien-gorge de maternité détaillé en dentelle,19.99,43.99,55,44
kids,Salopettes & Combinaisons,Ensemble de coton pour bébé 4Pcs pour 0-24M,21.99,43.99,50,80
kids,Chaussures pour garçon,Unisexe Enfants Pure Color Zipper Flats,21.2,39.89,47,175
kids,Robes,Robe de mariée en tulle arc-en-ciel pour fille pour 1-7 ans,25.99,51.98,50,86
kids,Brassières de grossesse,Plus Soutien-gorge d'allaitement sans fil taille,20.05,50.52,60,151
kids,Tops & Tees,Hauts d'allaitement à rayures patchwork de maternité,20.55,51.78,60,34
kids,Robes,Robe de princesse épissée en tulle à fleurs pour fille pour 3-11 ans,31.49,62.98,50,30
kids,Costume & Jupe-culotte,Ensemble sans manches à imprimé feuilles pour fille pour 3-8 ans,14.99,29.98,50,9
kids,Robes,Robe de princesse en dentelle brodée pour fille pour 1-7 ans,28.99,57.98,50,11
kids,Costume & Jupe-culotte,Ensemble de fruits rayés pour fille pour 2-8 ans,21.99,43.98,50,10
kids,Costume & Jupe-culotte,Vêtements à volants à rayures florales pour fille pour 2-8 ans,21.99,43.98,50,7
kids,Costume & Jupe-culotte,Ensemble de manches courtes à carreaux pour fille pour 1-7 ans,21.99,43.98,50,12
kids,Robes,Robe fleurie bébé formelle 0-24M,27.07,68.21,60,34
kids,Robes,Robe rayée à manches volantes pour fille pour 1-10 ans,16.04,40.41,60,29
kids,Robes,Robe à lacets de maternité à imprimé tournesol,24.56,61.89,60,13
kids,Brassières de grossesse,Cotton Push Up Soutien-gorge de maternité,19.05,47.99,60,118
kids,Tops & T-shirt,T-shirt imprimé à rayures pour garçon pour 2-8 ans,11.99,23.98,50,5
kids,Brassières de grossesse,Soutien-gorge d'allaitement maternité en coton doux,19.05,47.99,60,72
kids,Sneakers,Baskets décontractées antidérapantes respirantes en maille pour filles,25.99,66.99,61,5
kids,Robes,Robe rayée pour filles de loisirs 3Y-13Y,41.11,103.59,60,129
kids,Tops,T-shirt fille imprimé girafe 2Y-11Y,21.05,53.04,60,51
kids,Brassières de grossesse,Brassière de grossesse en dentelle en patchwork effet rassembler,18,45.36,60,108
kids,Brassières de grossesse,Soft brillant dentelle ~ brassières de bonnet H,37.1,93.48,60,27
kids,Chaussures pour garçon,Souliers unisexe style cow-boy pour enfants,20.66,38.27,46,141
kids,Chaussures pour garçon,Chaussures plates unisexes pour enfants,27.51,50.46,46,121
kids,Brassières de grossesse,Soutien-gorge d'allaitement sans fil anti-affaissement,19.05,47.99,60,140
kids,Tops & T-shirt,Tee-shirt Garçons Noel Imprimé Noël Pour 1-7Y,20.05,50.52,60,13
kids,Tops & Tees,Pull d'allaitement ample à capuche,23.06,58.1,60,28
kids,Tops & Tees, Hauts d'allaitement en coton patchwork de maternité,28.07,70.73,60,50
kids,Sweaters & Hoodies,Pull arc-en-ciel fille et garçon pour 1-9 ans,19.05,47.99,60,10
kids,Robes,Robe d'été florale pour filles 4Y-15Y,25.06,63.15,60,160
kids,Trousses,Couleurs Portable Dessin Crayons Crayons Pen Case Holder Bag pour 72pcs Crayons,17.43,27.99,38,1051
kids,Brassières de grossesse,Soutien-gorge d'allaitement maternisé Soft,18.99,37.98,50,0
kids,Robes,Robe à lacets rose pour fille pour 1-7 ans,17.99,35.98,50,2
kids,Pyjamas,Ensemble de pyjama rayé pour garçon de 6 à 12 ans,19.99,39.98,50,2
kids,Costume & Jupe-culotte,Ensemble à rayures pour chat mignon pour fille pour 1-5 ans,15.99,31.98,50,5
kids,Costume & Jupe-culotte,Ensemble imprimé floral papillon pour fille pour 3-8 ans,14.99,29.98,50,15
kids,Pantalons & Jupes,Short décontracté à fleurs roses pour fille de 1 à 5 ans,9.99,19.98,50,4
kids,Flats & Loafers,Mocassins plats à boucle à crochet pour filles,22.63,50.29,55,2
kids,Sous-vêtements de maintien de grossesse,"Ceinture de récupération du ventre pour les femmes après l'accouchement, ML XL",31.08,78.32,60,95
kids,Robes,Robe plissée à col rond pour bébé 3-18M,13.99,27.98,50,0
kids,Pantalons & Jupes,Combinaisons en dentelle de filles de denim pour 2Y-9Y,28.07,70.73,60,189
kids,Robes,Robes filles de pageant robe pour 8-15y,44.12,111.17,60,228
kids,Robes,Robe fille à manches longues à fleurs / rayures,22.06,55.57,60,193
kids,Sweaters & Hoodies,Sweat-shirt décontracté imprimé filles pour 1Y-11Y,25.06,63.15,60,61
kids,Costumes pour bébé,2pcs ensembles bébé fille confortables pour 0-24m,27.07,68.21,60,203
kids,Coutumes & Co-ords,Ensemble de vêtements 2Pcs Graphic Boys pour 1Y-9Y,25.06,63.15,60,139
kids,Brassières de grossesse,Plus Soutien-gorge d'allaitement sans fil taille T-Shirt,17.04,42.94,60,43
kids,Robes,Robe d'allaitement maternité couleur unie,24.06,60.63,60,144
kids,Brassières de grossesse,Soutien-gorge d'allaitement confortable avec boutons sur le devant,17.17,43.26,60,159
kids,Chapeaux,Écharpes épaisses de chapeau de capot d'enfants pour 3Y-12Y,19.99,32.99,39,78
kids,Vêtements d'extérieur & Manteaux,Jumpsuit Enfant en Forme de Chien Mignon Pour 1-5Y,60.99,103.99,41,119
kids,Tops & T-shirt,Hauts Garçon Imprimés Lettre Pour 2Y-11Y,19.05,47.99,60,40
kids,Salopettes & Combinaisons,Cartoon unisexe bébé barboteuse pour 3-18m,20.05,50.52,60,91
kids,Sweaters & Hoodies,Pull dinosaure enfant en bas âge pour 2-11Y,22.06,55.57,60,54
kids,Tops & Tees,Superbe débardeur de maternité solide,14.99,45.46,67,93
kids,Tops & T-shirt,T-shirt Imprimé À Manches Longues Pour Garçons 1Y-9Y,19.05,47.99,60,132
kids,Costume & Jupe-culotte,Ensemble de filles à fleurs imprimées pour 4 à 13 ans,22.52,56.73,60,77
kids,Salopettes & Combinaisons,Costume formel gris garçon pour 6-24M,27.07,68.21,60,271
kids,Brassières de grossesse,Soutiens-gorge d'allaitement sans fil ouverts et respirants,20.31,51.17,60,200
kids,Chaussures pour bébé,Toile Denim Slip On Shoes Pour 0-24M,18.99,30.99,39,105
kids,Sneakers,Baskets décontractées respirantes et légères pour filles,28.69,59.42,52,4
kids,Tops & T-shirt,T-shirt à imprimé de bande dessinée pour garçon 2-10 ans,8.99,17.98,50,2
kids,Costumes pour bébé,Ensemble imprimé arc-en-ciel pour bébé pour 6-24 mois,15.99,31.98,50,1
kids,Robes,Robe Etoile Dorée Filles 3Y-13Y,23.06,58.1,60,263
kids,Chaussures pour garçon,Chaussons en bois de résineux confortables unisexe,21.52,37.88,43,231
kids,Pyjamas,Pyjama imprimé garçon pour 1-5 ans,13.49,26.98,50,17
kids,Brassières de grossesse,Soutien-gorge de grossesse sans fil en dentelle sexy,21.05,53.04,60,72
kids,Tops,T-shirt imprimé dessin animé pour enfants pour 1-8 ans,16.04,40.41,60,13
kids,Robes,Dinosaur Girls tenue décontractée pour 3-11Y,22.06,55.57,60,158
